fandom,relationship,taggedRel,title,relType,isCanon,isRPF,datetime,kudos,rating,warnings,tags
One Direction (Band),Niall Horan/Liam Payne,Eleanor Calder/Louis Tomlinson,Uneasy Hearts Weigh the Most,F/M,Yes,Yes,08 Nov 2017,52,Explicit,"Rape/Non-Con,Underage","Alternate Universe,Non-Sexual Age Play,Cousin Incest,Sibling Incest,Abusive Relationships,Harry Styles & Louis Tomlinson Are Brothers,Underage Rape/Non-con,liam is louis and eleanor's son,niall is zayn and harry's son,so niall and liam are cousins,Cross-Posted on Wattpad,Other Additional Tags to Be Added"
One Direction (Band),Niall Horan/Harry Styles,Eleanor Calder/Louis Tomlinson,The Boy On The Train,F/M,Yes,Yes,13 Oct 2015,52,Teen And Up Audiences,Major Character Death,"Angst,Fluff,Cheating,lying,sad!Niall,sad!harry,Alcoholic!Niall,alcoholic!harry,Selfish!Louis,Bad Boyfriend!Zayn,Bad Boyfriend!Louis,Therapist!Liam,Depression,Alcohol Abuse/Alcoholism,Verbal Abuse,abusive!zayn,Hurt/Comfort,Depressed!Niall,depressed!harry"
One Direction (Band),Zayn Malik/Liam Payne,Eleanor Calder/Louis Tomlinson,confusing happiness,F/M,Yes,Yes,25 Apr 2015,52,Teen And Up Audiences,Creator Chose Not To Use Archive Warnings,"louis has a kid,Harry is an ass,there almost sex,and then some other shit"
One Direction (Band),Eleanor Calder/Louis Tomlinson,Eleanor Calder/Louis Tomlinson,sometimes when i close my eyes i pretend i'm alright (but it's never enough),F/M,Yes,Yes,15 Mar 2015,52,Mature,"Creator Chose Not To Use Archive Warnings,Graphic Depictions Of Violence","Depression,Anorexia,Angst,Happy Ending,the elounor is pretty minor,it's mainly about harry and louis,triggering,Fluff,Fluff and Angst"
One Direction (Band),Harry Styles/Louis Tomlinson,Eleanor Calder/Louis Tomlinson,Regulations,F/M,Yes,Yes,03 Aug 2014,52,General Audiences,"Creator Chose Not To Use Archive Warnings,No Archive Warnings Apply","OT5 Friendship,True Love,Fluff,Hurt/Comfort,Jay's wedding,OT5-Brotherly Love,Lottie being badass and totally awesome,Established Harry Styles/Louis Tomlinson,Implied Zayn Malik/Liam Payne"
One Direction (Band),Niall Horan/Zayn Malik,Eleanor Calder/Louis Tomlinson,Heart Attack,F/M,Yes,Yes,07 Jan 2013,52,Not Rated,Creator Chose Not To Use Archive Warnings,
One Direction (Band),Harry Styles/Louis Tomlinson,Eleanor Calder/Louis Tomlinson,Scaring the Thought of Kissing Razors,F/M,Yes,Yes,02 Jan 2015,58,Not Rated,Major Character Death,"Angst,theres death,i wrote this in 2013,but i sorta edited it,this story is kinda embarrassing,is that how you spell it,idk - Freeform,but im posting it so i can delete it off tumblr,Harry is sad,Sad,Hurt,uh,im really bad at tagging - Freeform,sorry for the bad story,Self Harm,trigger warning,i put that in caps bc its rly important,also,Sucide,Suicidal Thoughts"
One Direction (Band),Harry Styles/Louis Tomlinson,Eleanor Calder/Louis Tomlinson,The Very Error of the Moon,F/M,Yes,Yes,07 Dec 2013,58,Teen And Up Audiences,Creator Chose Not To Use Archive Warnings,"Swimming,Alternate Universe - Swimming,Swimming Boys,Alternate Universe - High School,Fluff and Angst,Gay Male Character,Nerd Harry,Jock Louis,One Shot,Love/Hate,Depressed Harry,Ocean,basically i wrote this while listening to ambient music"
One Direction (Band),Harry Styles/Louis Tomlinson,Eleanor Calder/Louis Tomlinson,Best Part of Me (Was Always You),F/M,Yes,Yes,05 Jul 2013,58,Mature,Creator Chose Not To Use Archive Warnings,"Smut,Fluff and Angst,Hurt,Unrequited Love,Blow Jobs"
One Direction (Band),Harry Styles/Louis Tomlinson,Eleanor Calder/Louis Tomlinson,The Tutor,F/M,Yes,Yes,09 Jun 2013,58,Mature,Creator Chose Not To Use Archive Warnings,"Alternate Universe - College/University,Drinking,Pining,tutor!louis,Drugs,Fingerfucking,Party,Jealousy,Unrequited Love,Homophobia,Blow Jobs,Hand Jobs,Swearing,Anger"
One Direction (Band),Harry Styles/Louis Tomlinson,Eleanor Calder/Louis Tomlinson,Oops! we're married,F/M,Yes,Yes,11 Jun 2016,57,Teen And Up Audiences,Creator Chose Not To Use Archive Warnings,"Accidental Marriage,Las Vegas,harry loves Louis,Bottling Up Feelings,Smut,Bottom Harry,Top Louis"
One Direction (Band),Liam Payne/Harry Styles,Eleanor Calder/Louis Tomlinson,Follow Me In Merry Christmas,F/M,Yes,Yes,15 Nov 2014,57,General Audiences,"Creator Chose Not To Use Archive Warnings,No Archive Warnings Apply","Christmas fic,Kid!Fic,Schmoop,Alternate Universe"
One Direction,Zayn Malik/Liam Payne,Eleanor Calder/Louis Tomlinson,"""Heartbroken.""",F/M,Yes,Yes,27 Sep 2014,57,Not Rated,No Archive Warnings Apply,"Angst,I cried while writing this,Possible smut,Alcohol Abuse"
One Direction (Band),Zayn Malik/Liam Payne,Eleanor Calder/Louis Tomlinson,you tell me that your tears are here to stay (i just wanna see ya),F/M,Yes,Yes,10 Dec 2013,57,Not Rated,Creator Chose Not To Use Archive Warnings,"um shiot,literally 2k of angst and fluff,Angst,Fluff and Angst,Triggers,Depressed Zayn,Fluff,like this is so fluff that they don't even kiss,idk man,it's just kinda a gratuitious feels bomb,enjoy"
One Direction (Band),Zayn Malik/Liam Payne,Eleanor Calder/Louis Tomlinson,Magic in the Air,F/M,Yes,Yes,04 Nov 2013,57,General Audiences,No Archive Warnings Apply,"Fluff,Break Up,Realization,First Kiss,Getting Together"
One Direction (Band),Harry Styles/Louis Tomlinson,Eleanor Calder/Louis Tomlinson,4) The Last First Kiss,F/M,Yes,Yes,29 Mar 2013,57,Teen And Up Audiences,Creator Chose Not To Use Archive Warnings,"Angst,omg im so sorry,this turned out wayyy,angstier than i thought it was,going to so oopsies,First Time,First Kiss,No Smut,Fluff and Angst,Twisted and Fluffy Feelings,Sexual Confusion,Louis' kind of an ass at the end,and Harry doesnt understand"
One Direction (Band),Harry Styles/Louis Tomlinson,Eleanor Calder/Louis Tomlinson,l'histoire,F/M,Yes,Yes,21 Dec 2020,56,General Audiences,No Archive Warnings Apply,"Alternate Universe - College/University,Childhood Friends,Friends to Lovers,Angst,Fluff,Slow Burn,Not Actually Unrequited Love,Shy Louis Tomlinson,Frat Boy-ish Harry Styles,Happy Ending,Niall Horan & Harry Styles Friendship,Pet Names,Harry Styles & Louis Tomlinson are the Same Age"
One Direction (Band),Eleanor Calder/Louis Tomlinson,Eleanor Calder/Louis Tomlinson,amsterdam without you,F/M,Yes,Yes,25 Aug 2017,56,Teen And Up Audiences,No Archive Warnings Apply,"Recreational Drug Use,Nostalgia,Windmills"
One Direction (Band),Zayn Malik/Louis Tomlinson,Eleanor Calder/Louis Tomlinson,i'll explain the infinite,F/M,Yes,Yes,09 Feb 2016,56,Explicit,Creator Chose Not To Use Archive Warnings,"Polyamory,Cheating,Drug Use,fuzzy boundaries,Bottom Louis,Bottom Zayn,Top Zayn,Top Louis,Phone Sex"
One Direction (Band),Zayn Malik/Liam Payne,Eleanor Calder/Louis Tomlinson,"you're the cure, you're the pain",F/M,Yes,Yes,09 Mar 2015,56,Teen And Up Audiences,Creator Chose Not To Use Archive Warnings,
One Direction (Band),Niall Horan/Harry Styles,Eleanor Calder/Louis Tomlinson,lucky we're in love in every way,F/M,Yes,Yes,21 Dec 2014,56,General Audiences,Creator Chose Not To Use Archive Warnings,"Babysitting,Fluff"
One Direction,Harry Styles/Louis Tomlinson,Eleanor Calder/Louis Tomlinson,take only what you need from me,F/M,Yes,Yes,18 Dec 2013,56,Not Rated,Creator Chose Not To Use Archive Warnings,"Eleanor Is A Beard,Nick doesn't love Harry,Louis' closeted,Boyband!Louis,Indie!Harry,bartender!liam"
One Direction (Band),Harry Styles/Louis Tomlinson,Eleanor Calder/Louis Tomlinson,Stay Brave,F/M,Yes,Yes,03 Nov 2013,56,Mature,Creator Chose Not To Use Archive Warnings,"Bully Zayn,Bully Niall,Guilty Liam,Bully Josh,Bullied Harry,Nerd Harry Styles,Eventual Smut,Fluff and Angst,Self Confidence Issues,Self Harm,Ambushes and Sneak Attacks,Hurt Harry,Hurt No Comfort,Top Louis,Bottom Harry"
Radio 1 RPF,Harry Styles/Louis Tomlinson,Eleanor Calder/Louis Tomlinson,wide eyed (like we're in a crime scene),F/M,Yes,Yes,08 Jan 2013,56,Mature,No Archive Warnings Apply,"Dom/sub,BDSM,Polyamory,Established Relationship"
One Direction (Band),Harry Styles/Louis Tomlinson,Eleanor Calder/Louis Tomlinson,What Feels Right,F/M,Yes,Yes,30 May 2018,55,Mature,Creator Chose Not To Use Archive Warnings,"Friends to Lovers,Boys Kissing,I don’t know how to do tags,gay realisation,Canon-ish"
One Direction (Band),Harry Styles/Louis Tomlinson,Eleanor Calder/Louis Tomlinson,"If You Like It, So",F/M,Yes,Yes,28 Dec 2013,55,Not Rated,"Creator Chose Not To Use Archive Warnings,No Archive Warnings Apply","Bodyswap,Cheating"
One Direction (Band),Past Harry Styles/Louis Tomlinson - Relationship,Eleanor Calder/Louis Tomlinson,Just Like Their Fathers.,F/M,Yes,Yes,13 Jul 2014,62,General Audiences,Creator Chose Not To Use Archive Warnings,"Reunions,Father-Daughter Relationship,daddy au,father!harry,Father!Louis"
One Direction (Band),Harry Styles/Louis Tomlinson,Eleanor Calder/Louis Tomlinson,When Louis Met Harry,F/M,Yes,Yes,14 Nov 2013,62,Teen And Up Audiences,"Creator Chose Not To Use Archive Warnings,No Archive Warnings Apply","When Harry Met Sally AU,sometimes if you want an au badly enough you have to write it yourself,Mushy,Alternate Universe"
One Direction (Band),Harry Styles/Louis Tomlinson,Eleanor Calder/Louis Tomlinson,"You're My Downfall, You're My Muse",F/M,Yes,Yes,29 Sep 2016,61,Explicit,No Archive Warnings Apply,"Alternate Universe,Alternate Universe - Canon Divergence,Famous Louis,Famous Harry,Musician Harry,Musician Louis,Touring,Implied/Referenced Cheating,Cheating,Pregnancy,Unplanned Pregnancy,Angst,Hurt,Engagement,Sex,Anal Sex,Anal Fingering,Explicit Sexual Content,Gay Sex,Boys Kissing,Bottom Harry,Top Louis,Smut,Happy Ending,Community: comment_fic,Prompt Fic,Prompt Fill,Songwriting,Songwriter Louis,Songwriter Harry,5 Things,Male Slash,Slash,Bisexual Louis"
One Direction (Band),Louis Tomlinson/Eleanor Calder,Eleanor Calder/Louis Tomlinson,small bump,F/M,Yes,Yes,27 May 2012,61,Teen And Up Audiences,Creator Chose Not To Use Archive Warnings,
One Direction (Band),Eleanor Calder/Louis Tomlinson,Eleanor Calder/Louis Tomlinson,"baby, here we go again",F/M,Yes,Yes,15 Jul 2017,60,Mature,No Archive Warnings Apply,"Angry Sex,Voyeurism"
One Direction (Band),Harry Styles/Louis Tomlinson,Eleanor Calder/Louis Tomlinson,Who Could Want You More?,F/M,Yes,Yes,28 Nov 2015,60,General Audiences,No Archive Warnings Apply,"only a little eleanor,I promise,Endgame Larry,Fluff,Friends to Lovers,Harry is jealous,louis is confused,non-au,Pinning Harry,some angst too,Under 10k"
One Direction (Band),Harry Styles/Louis Tomlinson,Eleanor Calder/Louis Tomlinson,everything reminds me of you,F/M,Yes,Yes,13 Nov 2015,60,Mature,Creator Chose Not To Use Archive Warnings,"Angst,Self-Hatred,or minor self-hatred rather,flatmates,Unrequited Love,Best Friends,Ex-Best Friends,Home,hey angel,Fluff,Smut,Memories,Flashbacks,fetus larry,present larry,Friendship/Love,Top!Harry,bottom!Louis"
One Direction (Band),Harry Styles/Louis Tomlinson,Eleanor Calder/Louis Tomlinson,Not in that way.,F/M,Yes,Yes,06 May 2015,60,General Audiences,No Archive Warnings Apply,"Hurt Harry Styles,Louis Tomlinson's Always In My Heart Tweet,larry used to be real,zayn was mentioned,Crying Harry,Drunk Harry,happy louis,Emotional,this is an old fic of mine when elounor was still existing so yeah,I suck at tags,this is just my second time idek bye,larry is real,this is just pure work of my fucked up mind,harry and louis exes"
One Direction (Band),Harry Styles/Louis Tomlinson,Eleanor Calder/Louis Tomlinson,There's nowhere you can be that isn't where you're meant to be,F/M,Yes,Yes,22 Mar 2015,60,General Audiences,No Archive Warnings Apply,"Elounor jest tylko na początku,Larry jest w większej części historii więc nie macie się co martwić,Valentine's Day,Valentine's Day Fluff,Friends to Lovers,chociaż bardziej strangers to lovers,Strangers to Lovers,przypadkowe spotkanie,czy to w ogóle jest tag?,hmmm,Dużo fluffu,zaręczyny,ale jedynie takie na pokaz?,zdrada (na samym początku),tagowałam fluff?,fluff (tak dla pewności),nie ma tam reszty chłopaków,(zapomniałam ich tutaj wcisnąć),walentynki,larry stylinson - Freeform,Elounor (ale tylko trochę),Aiden i Louis pracują razem w kawiarni,Eleanor często tam bywała,one direction nie jest sławne,larry - Freeform,Louis nienawidzi walentynek,First Kiss,romantyczny wieczór,First Date"
One Direction (Band),Eleanor Calder/Harry Styles/Zayn Malik,Eleanor Calder/Louis Tomlinson,take a shot for me,F/M,Yes,Yes,19 Dec 2014,60,Explicit,No Archive Warnings Apply,"Infidelity,Threesome - F/M/M,Double Penetration,Double Sucking,Cunnilingus,Fingering,Spanking,Deepthroating,Anal Sex,Oral Sex,Revenge Sex,safe sex,Angst,i honestly don't know how to tag"
One Direction (Band),Nick Grimshaw/Harry Styles,Eleanor Calder/Louis Tomlinson,A Day at the Races,F/M,Yes,Yes,27 Feb 2013,60,Teen And Up Audiences,No Archive Warnings Apply,"Manchester concert,Backstage"
One Direction (Band),Harry Styles/Louis Tomlinson,Eleanor Calder/Louis Tomlinson,Larry Stylinson - I'm only human (and I bleed when I fall down),F/M,Yes,Yes,19 Apr 2020,59,General Audiences,No Archive Warnings Apply,"Past Elounor Relationship,it's just mentioned,But it's essential,Angst,Homosexuality denial,louis is confused,You'll understand if you read,A LOT of Angst,Like 'Get you tissues ready' angst,Chaptered,You'll have to leave feedback if you want to know what happens next ;),First chaptered story,hope you like it,Oh! Happy Ending!,Inspired in the song ""Human"" by Christina Perri"
One Direction (Band),Niall Horan/Harry Styles,Eleanor Calder/Louis Tomlinson,I only have these eyes for you,F/M,Yes,Yes,23 Dec 2014,59,Teen And Up Audiences,No Archive Warnings Apply,"Fluff,famous!niall,Law Student!Harry,Uni AU"
One Direction (Band),Zayn Malik/Liam Payne,Eleanor Calder/Louis Tomlinson,The air was still until the water called,F/M,Yes,Yes,25 Aug 2014,59,Teen And Up Audiences,Creator Chose Not To Use Archive Warnings,"Friendship,Friends to Lovers,Friendship/Love,Pining,Mutual Pining,Middle School,Growing Up,Neighbors,Alternate Universe"
One Direction (Band),Niall Horan/Zayn Malik,Eleanor Calder/Louis Tomlinson,Only the Naïve Believe,F/M,Yes,Yes,13 Feb 2014,59,Teen And Up Audiences,No Archive Warnings Apply,"Minor Character Death,Alternate Universe - Coffee Shops & Cafés"
One Direction (Band),Niall Horan/Zayn Malik/Liam Payne/Harry Styles/Louis Tomlinson,Eleanor Calder/Louis Tomlinson,And It Tips Me Off (Your Heartbeat; Soft),F/M,Yes,Yes,04 Jan 2014,59,Teen And Up Audiences,Creator Chose Not To Use Archive Warnings,"Hurt/Comfort,OT5,lying is the most fun a guy can have with his clothes on,except not really Zayn is miserable,Loads of Angst,better endings,sorry to Perrie fans,I don't mean it I really know nothing about her,if I ruled the world the boys would always be together"
One Direction (Band),Harry Styles/Louis Tomlinson,Eleanor Calder/Louis Tomlinson,Rule Breakers,F/M,Yes,Yes,30 Jul 2013,59,Teen And Up Audiences,Creator Chose Not To Use Archive Warnings,"Oh look! Another chaptered fic by me!,Angst,Fluff,Chaptered,Starts off as:,Unrequited Love,but gets better after that first hump of angst,larry stylinson - Freeform,Smut,(in later chapters),Submissive Louis,Sexuality Confusion,Bottom Louis,Dominant Harry,Top Harry"
One Direction (Band),Harry Styles/Louis Tomlinson,Eleanor Calder/Louis Tomlinson,Love Island 2021,F/M,Yes,Yes,11 Sep 2021,58,Mature,"Creator Chose Not To Use Archive Warnings,No Archive Warnings Apply","Love Island AU,Love Island,Smut,Fluff,Oblivious Louis Tomlinson,Bisexual Louis Tomlinson,Bisexual Harry Styles,Truth or Dare,Challenges,Love island games,Awkward Dates,Reality TV,Alternate Universe - Non-Famous"
One Direction (Band),Zayn Malik/Harry Styles,Eleanor Calder/Louis Tomlinson,¿De Quién?,F/M,Yes,Yes,05 Jun 2020,58,Teen And Up Audiences,No Archive Warnings Apply,"Anal Sex,Mpreg,Unplanned Pregnancy,Alternate Universe - Canon Divergence,Bottom Zayn Malik,Porn,Explicit Sexual Content,Hurt Zayn,Implied/Referenced Abortion,Anxiety,Eating Disorders,Rape/Non-con Elements"
One Direction,Eleanor Calder/Louis Tomlinson,Eleanor Calder/Louis Tomlinson,I'll Stop Eating Food and I'll Squeeze Into A Dress,F/M,Yes,Yes,09 Feb 2013,66,Teen And Up Audiences,Creator Chose Not To Use Archive Warnings,Eating Disorders
One Direction (Band),Niall Horan/Zayn Malik,Eleanor Calder/Louis Tomlinson,know you're not alone,F/M,Yes,Yes,12 Sep 2017,65,Mature,No Archive Warnings Apply,"Alternate Universe - Werewolf,Pack Dynamics,Veterinary Clinic,Animal Shelter,idk man,ziall,what are tags,Dogs,Bad Writing,Wolf stuff,who knows - Freeform,I APOLOGIZE"
One Direction (Band),Liam Payne/Louis Tomlinson,Eleanor Calder/Louis Tomlinson,There's a Power in Letting Go,F/M,Yes,Yes,01 Oct 2015,65,Explicit,No Archive Warnings Apply,"BDSM,Dom/sub,cuddly bdsm,Open Relationships,Polyamory,OT4,Oral Sex"
One Direction (Band),Niall Horan/Harry Styles,Eleanor Calder/Louis Tomlinson,and i know the same does not apply to you,F/M,Yes,Yes,03 Mar 2014,65,Not Rated,Creator Chose Not To Use Archive Warnings,"Werewolves,lycanthropy,talks of schizophrenia,talks of depression,Fluff"
One Direction (Band),Liam Payne/Harry Styles,Eleanor Calder/Louis Tomlinson,Dedication Takes a Lifetime (Dreams Only Last for a Night),F/M,Yes,Yes,15 Aug 2013,65,Teen And Up Audiences,Creator Chose Not To Use Archive Warnings,"Lirry - Freeform,Larry Stylinson rumours,Larry Stylinson - friendship,Gay Male Character,Secret Relationship,Angst,Fluff and Angst,Slash,Male Slash,Male Homosexuality,Depressed Harry,Liam is being a dick basically,Romance,Lirry Stayne,lirry fic,this turned out way more romantic than i expected,depressed harry is returning though,idek,Lirry feels"
One Direction (Band),Nick Grimshaw & Louis Tomlinson,Eleanor Calder/Louis Tomlinson,A Spiny Mammal of the Subfamily Tomlinson,F/M,Yes,Yes,10 Dec 2018,64,General Audiences,No Archive Warnings Apply,"Animal Transformation,Hedgehogs,Friendship,Canon Relationships"
One Direction (Band),Niall Horan/Zayn Malik,Eleanor Calder/Louis Tomlinson,you and me,F/M,Yes,Yes,12 Aug 2018,64,Teen And Up Audiences,Creator Chose Not To Use Archive Warnings,Alternate Universe - Superheroes/Superpowers
One Direction (Band),past Louis Tomlinson/Eleanor Calder,Eleanor Calder/Louis Tomlinson,If tomorrow,F/M,Yes,Yes,29 Dec 2015,64,Not Rated,No Archive Warnings Apply,"Asexual Character,Zayn departure talk,Acephobia (kind of ?),Elounor breakup,Demisexuality,Aroflux Character,alcohol consumption"
One Direction (Band),Harry Styles/Louis Tomlinson,Eleanor Calder/Louis Tomlinson,Under The Willow Tree (Winds Whisper Our Story) ~Larry Stylinson AU~,F/M,Yes,Yes,26 Jul 2016,64,Not Rated,Major Character Death,"punk!harry,broken!harry,normal!louis,Sort of Innocent!Louis,Punk!Ed,Minor Eleanor Calder/Louis Tomlinson,Louis and Harry switch from Top and Bottoming,Smut Obviously,Sneaking Out,forced relationships - Freeform,Mentions of Death,fear of being alone,Fear of Letting People In,Fear of Heights,Facing Fears,Cheating,Threats of Violence,Death Threats,Other Additional Tags to Be Added"
One Direction (Band),Harry Styles/Louis Tomlinson,Eleanor Calder/Louis Tomlinson,Let It Be Me,F/M,Yes,Yes,09 Jan 2014,64,Not Rated,Creator Chose Not To Use Archive Warnings,"Break Up,Friendship/Love,Friends to Lovers,Boys Kissing,Fluff and Angst,larry stylinson - Freeform"
One Direction (Band),OT5 - Brotherly Love,Eleanor Calder/Louis Tomlinson,my catastrophe,F/M,Yes,Yes,03 Jan 2014,64,Mature,Creator Chose Not To Use Archive Warnings,"trigger warning,like serious trigger warning,Depression,Anxiety,Mental Health Issues,Recreational Drug Use,Self-Harm"
One Direction (Band),Niall Horan/Original Female Character(s),Eleanor Calder/Louis Tomlinson,Relief Girl,F/M,Yes,Yes,05 Jun 2014,64,Explicit,Creator Chose Not To Use Archive Warnings,"Explicit Sexual Content,Blow Jobs,Public Sex,Sex Toys Under Clothing,Sex Toys,Double Penetration,Creampie,Smut,Porn With Plot,Wall Sex"
One Direction (Band),Harry Styles/Louis Tomlinson,Eleanor Calder/Louis Tomlinson,Stuff of Legends,F/M,Yes,Yes,17 Aug 2012,64,Mature,Rape/Non-Con,"Vampires,Vampire Sex,larry stylinson - Freeform,lourry,vampire thrall equals non-con"
One Direction (Band),Louis Tomlinson/You,Eleanor Calder/Louis Tomlinson,Seeking Solace,F/M,Yes,Yes,26 Apr 2020,63,Mature,No Archive Warnings Apply,"Reader-Insert,POV Second Person,Fluff,Angst,Emotional Hurt/Comfort,Cheating,Real Life,Cigarettes,Smoking,Requited Unrequited Love,Affection,Cuddling & Snuggling,Jealousy,Sleepy Cuddles,Grief/Mourning,Mild Smut,Naked Cuddling,Vaginal Fingering,Cunnilingus,Hair-pulling,Scratching,Biting,Nipple Play,Love Bites,Fluff and Smut,Angst and Fluff and Smut,Kissing,Surprise Kissing,Surprise Sex,Neck Kissing,Childhood Friends,Implied/Referenced Character Death"
One Direction (Band),Eleanor Calder/Louis Tomlinson,Eleanor Calder/Louis Tomlinson,bad blood,F/M,Yes,Yes,23 Apr 2017,63,Mature,No Archive Warnings Apply,"Drug Use,Airplanes,Angst"
One Direction (Band),Harry Styles/Louis Tomlinson,Eleanor Calder/Louis Tomlinson,Just a Little Bit of Your Heart,F/M,Yes,Yes,28 Dec 2015,63,Not Rated,Creator Chose Not To Use Archive Warnings,"just a little bit of your heart,ariana grande's song,Inspired by Fanart,elounor date,Confessions,2014"
One Direction (Band),Niall Horan/Harry Styles,Eleanor Calder/Louis Tomlinson,One Shots [Narry],F/M,Yes,Yes,07 Dec 2014,63,General Audiences,"Creator Chose Not To Use Archive Warnings,No Archive Warnings Apply","Narry - Freeform,Fluff,Angst,One Shot Collection,one shots,there's only narry though,and some other relationships,whatever,narry storan - Freeform,niall - Freeform,harry - Freeform,Liam - Freeform,zayn,louis - Freeform"
One Direction (Band),Harry Styles/Louis Tomlinson,Eleanor Calder/Louis Tomlinson,It Was Always You,F/M,Yes,Yes,18 Jul 2013,63,Teen And Up Audiences,Creator Chose Not To Use Archive Warnings,endgame is larry no worries ok
One Direction (Band),Harry Styles/Louis Tomlinson,Eleanor Calder/Louis Tomlinson,The Moments I Chose to Ignore That Told Me You Were Going to Leave Me,F/M,Yes,Yes,31 Jul 2014,62,Not Rated,Creator Chose Not To Use Archive Warnings,"Harry is very indie and very hipster-y,Louis is not really famous,but he's a business man,they don't fit until they do,A LOT of Angst,harry cries a lot,and he gets outed,paps are twats,eleanor just kinda appears and opens a door,harry and louis fall apart,and then fall back together,Happy Ending,because i love them,louis finds harry after all,louis also fucks up a lot,oh and Harry gets linked to Taylor,but he looks like 2014 harry,and louis looks like 2014 louis"
One Direction (Band),Harry Styles/Louis Tomlinson,Eleanor Calder/Louis Tomlinson,"a desert every morning, every night a flood",F/M,Yes,Yes,16 Sep 2018,71,Mature,No Archive Warnings Apply,"Road Trips,Sexuality Crisis,California,Future Fic,Bisexuality,Sharing a Bed,possibly more Bigfoot discussion than necessary,background canon pairing"
One Direction (Band),Niall Horan/Zayn Malik,Eleanor Calder/Louis Tomlinson,All He Has Left,F/M,Yes,Yes,09 Feb 2015,71,Teen And Up Audiences,No Archive Warnings Apply,"One-Shot,Ziaounarry,Boy Love,MxM - Freeform,Polyamory,niall is lonely,Not A Happy Ending,Niall Centric,remenicing,x factor - Freeform"
One Direction (Band),Harry Styles/Louis Tomlinson,Eleanor Calder/Louis Tomlinson,You Still Have My Heart (Even If You Don't Deserve It),F/M,Yes,Yes,12 Apr 2014,71,Not Rated,Creator Chose Not To Use Archive Warnings,"Weddings,Alternate Universe,Romance,Bubble Bath,Fluff,Maybe? At least I tried...,Happy Ending,Kissing,You Still Have My Heart (Even If You Don't Deserve it),Please Baby?"
One Direction (Band),Harry Styles/Louis Tomlinson,Eleanor Calder/Louis Tomlinson,The Harry Diaries,F/M,Yes,Yes,04 Aug 2013,71,Teen And Up Audiences,Creator Chose Not To Use Archive Warnings,"larry fluff,larry stylinson - Freeform,Pining Harry,Alternate Universe - High School,larry au"
One Direction (Band),Harry Styles/Louis Tomlinson,Eleanor Calder/Louis Tomlinson,"God Bless, Bitch",F/M,Yes,Yes,09 Mar 2014,70,Not Rated,Creator Chose Not To Use Archive Warnings,"Homophobia,Homophobic Language,Implied Sexual Content,Closeted Character,Closeted!Louis"
One Direction (Band),Eleanor Calder/Louis Tomlinson,Eleanor Calder/Louis Tomlinson,as you take what's left of you and i,F/M,Yes,Yes,30 Dec 2012,70,Teen And Up Audiences,Creator Chose Not To Use Archive Warnings,"unintentional bearding,eleanor-centric,Infidelity"
One Direction (Band),Niall Horan/Louis Tomlinson,Eleanor Calder/Louis Tomlinson,BeautyAndTheBlond,F/M,Yes,Yes,30 Dec 2013,69,Teen And Up Audiences,No Archive Warnings Apply,"mentions of dan and phil,YouTuber Louis,YouTuber Niall"
One Direction (Band),Harry Styles/Louis Tomlinson,Eleanor Calder/Louis Tomlinson,Up All Night,F/M,Yes,Yes,26 May 2015,68,Mature,No Archive Warnings Apply,"Partially Alternate Universe,Throwback to Young One Direction,Gay,Romance,Clueless Harry,Sex- Eventually,This Story Has A Plot,Not Exactly Accurate,Based on Some Real Events,United Kingdom,United States,First story,Drama,Verbal Abuse,Alcohol,Lots more that I can't think of right now,Drunk Harry,Fluff,Smut,Angst,Lust,Love,Grimmy is an Asshole"
One Direction (Band),Harry Styles/Louis Tomlinson,Eleanor Calder/Louis Tomlinson,(Never) Too Late,F/M,Yes,Yes,17 Mar 2014,68,Not Rated,Creator Chose Not To Use Archive Warnings,"larry - Freeform,side elounor - Freeform,eww I know,fight,Angst,bullshit,bullshit tweet,Background story"
One Direction (Band),Zayn Malik/Liam Payne,Eleanor Calder/Louis Tomlinson,Now I'm Shining Too,F/M,Yes,Yes,31 Jul 2013,68,Mature,Creator Chose Not To Use Archive Warnings,Alternate Universe
One Direction (Band),Liam Payne/Louis Tomlinson,Eleanor Calder/Louis Tomlinson,make it feel like the first time,F/M,Yes,Yes,27 Jun 2013,68,Explicit,Creator Chose Not To Use Archive Warnings,"Polyamory,Barebacking,Anal Sex,Cunnilingus,Comeplay,Alternate Universe - Canon Divergence,Anal Fingering"
