fandom,relationship,taggedRel,title,relType,isCanon,isRPF,datetime,kudos,rating,warnings,tags
One Direction (Band),Louis Tomlinson/Harry Styles,Eleanor Calder/Louis Tomlinson,The Green in his Eyes,F/M,Yes,Yes,29 Jun 2013,25,Teen And Up Audiences,"Creator Chose Not To Use Archive Warnings,Graphic Depictions Of Violence","Unrequited Love,Slash,Mpreg"
One Direction (Band),Harry Styles/Louis Tomlinson,Eleanor Calder/Louis Tomlinson,Nowhere Else I'd Rather Be,F/M,Yes,Yes,24 Jan 2013,25,Teen And Up Audiences,No Archive Warnings Apply,Angst
One Direction (Band),Harry Styles/Louis Tomlinson,Eleanor Calder/Louis Tomlinson,Fool's Gold,F/M,Yes,Yes,01 Jan 2018,28,Mature,No Archive Warnings Apply,"Unrequited Love,Pining,I don't know what to tag again,Heavy Angst"
One Direction,Harry Styles/ OMC,Eleanor Calder/Louis Tomlinson,A Sub's Life,F/M,Yes,Yes,29 Jul 2017,28,Mature,"Rape/Non-Con,Underage","Dom/sub,Slave/Master,dom Harry Liam zayn Luke and Ashton,subs are everyone else,forced relationships - Freeform,there will be rape somewhere in here,the guys aren't necessarily mean but they mean business,lots of kinky stuff,Read at Your Own Risk"
One Direction (Band),Zayn Malik/Louis Tomlinson,Eleanor Calder/Louis Tomlinson,Better Than Words (Zouis AU),F/M,Yes,Yes,30 Jun 2015,28,Teen And Up Audiences,Creator Chose Not To Use Archive Warnings,"zouis,Fluff,Bottom Zayn,Top Louis,Pinning Zayn"
One Direction (Band),Harry Styles/Louis Tomlinson,Eleanor Calder/Louis Tomlinson,I'd Spend Forever With You,F/M,Yes,Yes,26 Sep 2014,28,Teen And Up Audiences,Creator Chose Not To Use Archive Warnings,"Louis' POV,Basically a fic where Harry & Louis are soulmates,People don't understand,Louis still loves Eleanor,No Eleanor bashing,The boys are still in 1D,I'm Bad At Titles,and probably tagging too,Story focuses on Larry Stylinson (as a confusingly romantic bromance),So pretty much how they normally act"
One Direction (Band),Harry Styles/Louis Tomlinson,Eleanor Calder/Louis Tomlinson,You let me go,F/M,Yes,Yes,02 Dec 2013,28,Mature,Creator Chose Not To Use Archive Warnings,"Eventual Larry,Extreme angst,Angst,Trigger warning for suicide,Beards (Relationships),broken!harry,quiet!zayne,bigbrother!Liam,Niall is Niall,who knows what the fuck is going on here!Louis,closeted!harry"
One Direction (Band),Harry Styles/Louis Tomlinson,Eleanor Calder/Louis Tomlinson,Beautiful Nightmares,F/M,Yes,Yes,06 Sep 2013,28,Teen And Up Audiences,Creator Chose Not To Use Archive Warnings,"Angst,Fluff,Fluff and Angst,Romance,Flashbacks,Dreams and Nightmares,Nightmares"
One Direction (Band),Zayn Malik/Louis Tomlinson,Eleanor Calder/Louis Tomlinson,And You Can't Be That Man I Adored,F/M,Yes,Yes,01 Jan 2013,28,Teen And Up Audiences,No Archive Warnings Apply,"Alternate Universe,Best Friends,Internalized Homophobia,Social Homophobia,Implied Relationships,Songfic,Religious Conflict,Angst,Album: Up All Night (One Direction),Album!fic,Friendship/Love,Friends to Lovers,Coming of Age,Coming Out,Childhood Friends"
One Direction (Band),Harry Styles/Louis Tomlinson,Eleanor Calder/Louis Tomlinson,A Touch of Pink in a sea of Blues & Green,F/M,Yes,Yes,14 Aug 2020,27,Mature,Major Character Death,"Freeform,Original Female Character(s) - Freeform,One Direction Reunion,One Direction Tours,Happily Ever After,kind of,major character death isn't one of the boys,Adoption,strange pregnancies,Medical stuff,this is a family show,OR IS IT,bigamy is a whole thing,Harry Styles and Louis Tomlinson are Saps,Dad Harry,dad louis,dad niall,Minor Zayn Malik/Liam Payne,Past Relationship(s),Hopeful Ending,love is love,Crack"
One Direction (Band),Harry Styles/Louis Tomlinson,Eleanor Calder/Louis Tomlinson,Over Again,F/M,Yes,Yes,27 Aug 2017,27,Teen And Up Audiences,"Creator Chose Not To Use Archive Warnings,No Archive Warnings Apply","AU,Band,Interview,Dunkirk,Angst,Reunion,Recent,Bisexual,Bisexuality,2017,Hiatus,Touring,Meeting,one direction - Freeform,1d,larry - Freeform,Elounor,Texting,Friendship,Break Up,Hurt/Comfort,Confused Louis,Niall Horan & Louis Tomlinson Friendship,Cute Louis,Family,big brother Louis,Harry Louis Friendship - Freeform,Eleanor Louis Friendship,Canon Compliant"
One Direction (Band),Niall Horan/Harry Styles,Eleanor Calder/Louis Tomlinson,Where Do Broken Hearts Go?,F/M,Yes,Yes,09 Nov 2014,27,Not Rated,Creator Chose Not To Use Archive Warnings,
One Direction (Band),Harry Styles/Louis Tomlinson,Eleanor Calder/Louis Tomlinson,"Goodbye, Fare You Well",F/M,Yes,Yes,03 Jul 2014,27,Mature,Creator Chose Not To Use Archive Warnings,"Pirate AU,swashbuckling,sex will eventually happen okay,the two pairings hinted at are relevant to the plot i promise,larry endgame,Blowjobs,Sex,mentions of switching,other tags to come i'm sure,Language,Drinking,they're pirates people come on,Fluff,Angst,It's all here folks,i fiddle a bit with history,work with me here"
One Direction (Band),Harry Styles/Louis Tomlinson,Eleanor Calder/Louis Tomlinson,I'll Have to Leave Soon,F/M,Yes,Yes,28 Mar 2014,27,Mature,No Archive Warnings Apply,"Infidelity,Angst,tiny bit of smut,lots of hope for the future,read the notes before you read for the love of god"
One Direction,Eleanor Calder/Louis Tomlinson,Eleanor Calder/Louis Tomlinson,All These Reasons,F/M,Yes,Yes,16 Jan 2014,27,General Audiences,Creator Chose Not To Use Archive Warnings,"Sad,im sorry,real tears were shed in the making of this,Unrequited Love"
One Direction,Louis Tomlinson/Harry Styles,Eleanor Calder/Louis Tomlinson,Larry New Years Drabble.,F/M,Yes,Yes,05 Jan 2014,27,Mature,"Creator Chose Not To Use Archive Warnings,No Archive Warnings Apply","Its late okay,Dont expect anything good"
X Factor (US) RPF,Camila Cabello/Lauren Jauregui,Eleanor Calder/Louis Tomlinson,"Decisions we make, or regret",F/M,Yes,Yes,26 Dec 2013,27,General Audiences,No Archive Warnings Apply,"Camren - Freeform,Narry - Freeform"
One Direction (Band),Zayn Malik/Louis Tomlinson,Eleanor Calder/Louis Tomlinson,"an unspoken heartbreak, a heartbroken handshake",F/M,Yes,Yes,31 Aug 2013,27,Not Rated,No Archive Warnings Apply,"Fluff and Angst,Unrequited Love,AU,this is set some time after cars and telephones were invented,and when london was small and sooty,louis and zayn are best friends and zayn likes louis wowowow,theyre refered to as king and prince of london,louis is with eleanor but just like for one second,i really dont know what to tag this as"
One Direction (Band),Harry Styles/Louis Tomlinson,Eleanor Calder/Louis Tomlinson,just a little bit of your heart,F/M,Yes,Yes,05 Feb 2021,26,General Audiences,Creator Chose Not To Use Archive Warnings,"Pining,Angst,harry is louis's baby,Minor Eleanor Calder/Louis Tomlinson,Break Up,Fluff,Fluff and Angst,Jealous Harry"
One Direction (Band),Harry Styles/Louis Tomlinson,Eleanor Calder/Louis Tomlinson,The Story of my Paper Life,F/M,Yes,Yes,16 Oct 2017,26,Not Rated,Creator Chose Not To Use Archive Warnings,"Alternate Universe - Office,Mutual Pining,Pining,Abusive Relationships,not graphic,Office Romance,Gigi is Kelly,Zayn is Ryan,Harry is Pam,Louis is Jim,taylor is angela,Liam is Andy,eleanaor is karen,niall is kevin,but not really,he just likes food,cara is oscar,Scared Harry,Harry in Denial,louis is so in love,Office Pranks"
One Direction (Band),Harry Styles/Louis Tomlinson,Eleanor Calder/Louis Tomlinson,Like Real People Do,F/M,Yes,Yes,10 Sep 2015,26,Not Rated,Major Character Death,"harry works in a bookstore,Louis is sassy,Sassy Louis,mentions of sophiam,Minor elounor,the boy with the curls,Poems,christopher poindexter,I wrote this for school,Love Affair,i'll add tags as i go,this was for school,so i had to substitute fuck for damn ect,and im too lazy to go through and change it,Sorry Not Sorry,louis compares harry to basically every type of animal,What else is new,Mental Health Issues,mental health implied,harry is a hipster"
One Direction (Band),Harry Styles/Louis Tomlinson,Eleanor Calder/Louis Tomlinson,Something New (Larry Stylinson),F/M,Yes,Yes,31 Jul 2014,30,Teen And Up Audiences,Creator Chose Not To Use Archive Warnings,"Nerd Harry,Nerd Harry Styles,Bad Boy Liam,Insecure Louis,Scared Louis"
One Direction (Band),Harry Styles/Louis Tomlinson,Eleanor Calder/Louis Tomlinson,Riptide,F/M,Yes,Yes,22 Jun 2014,30,General Audiences,Creator Chose Not To Use Archive Warnings,"kinda sad,Hurt/Comfort,dentist!Louis,warvictim!harry,Phobias,Friends to Lovers,Moving In Together,the thing happens in paris london and nyc and im sad"
One Direction (Band),Harry Styles/Louis Tomlinson,Eleanor Calder/Louis Tomlinson,City of Angels,F/M,Yes,Yes,25 May 2014,30,Teen And Up Audiences,Creator Chose Not To Use Archive Warnings,"Fluff,Angst,uni - Freeform,College,Love/Hate,Bad Boy Louis,Innocent Harry,He's not that innocent actually,Louis hates Louis,Gay,except they both think they're not,we know they are though,Love,Cute,Smitten Harry,Jealous,Jealousy,Jealous Louis,Jealous Harry,angry,Banter,sarcastic,Sad,sometimes,Smut,Chaptered,Sexual Tension,Friends With Benefits,but they're not actually friends,but they still have benefits,im bad at explaining,just read it,im telling you its good,well somewhat"
One Direction (Band),Harry Styles/Louis Tomlinson,Eleanor Calder/Louis Tomlinson,"If I could, I would look at us all the time",F/M,Yes,Yes,21 May 2014,30,Not Rated,Creator Chose Not To Use Archive Warnings,
One Direction (Band),Harry Styles/Louis Tomlinson,Eleanor Calder/Louis Tomlinson,It's a beard thing,F/M,Yes,Yes,08 Feb 2014,30,Not Rated,Creator Chose Not To Use Archive Warnings,"Gay,Gay Character,gay relationship,Gay teens,Alternate Universe - High School"
One Direction (Band),Harry Styles/Louis Tomlinson,Eleanor Calder/Louis Tomlinson,Story of My Life,F/M,Yes,Yes,08 Dec 2013,30,Not Rated,Creator Chose Not To Use Archive Warnings,
One Direction (Band),Niall Horan/Liam Payne/Harry Styles/Louis Tomlinson,Eleanor Calder/Louis Tomlinson,Even if the Skies get Rough,F/M,Yes,Yes,11 Dec 2012,30,Teen And Up Audiences,No Archive Warnings Apply,"Alternate Universe,Alternate Universe - High School,Only brief mentions of Danielle Eleanor Josh Nick and Zayn,Passing glance of Perrie also,fetus!1D"
One Direction (Band),Zayn Malik/OC,Eleanor Calder/Louis Tomlinson,with a rotten tongue,F/M,Yes,Yes,22 Jun 2012,30,Explicit,Graphic Depictions Of Violence,"Fuckery,The one where they all have dopplegangers"
One Direction (Band),Harry Styles/Louis Tomlinson,Eleanor Calder/Louis Tomlinson,falling into the sun,F/M,Yes,Yes,26 Apr 2023,29,Teen And Up Audiences,No Archive Warnings Apply,"Alternate Universe - Historical,side shiall,Louis is a Duke,Childhood Friends to Lovers,Friends to Lovers,Pretend marriage,Harry marries Taylor to cover up he is fruity,Louis is married to Eleanor cause he thinks he is straight,Timothée is french,zayn is shy,Liam loves chess,Lots of flowers,And ballgowns,and cravats,Dash of almost-smut?,Anal Fingering,Horses and cats,and dogs,Gay Panic,wine and port,no beta we die like men,ed sheeran has a guest role,minor cheating,not between Harry and Louis,Fluff,why is timothée here i don't know but i don't care,AH YES,Past Harry Styles/Timothée Chalament,Implied Sexual Content,references to Greek mythology,Ambiguous/Open Ending"
One Direction (Band),Nick Grimshaw/Harry Styles,Eleanor Calder/Louis Tomlinson,invincible (the days we were golden),F/M,Yes,Yes,22 Sep 2022,29,Explicit,No Archive Warnings Apply,"New York City,Established Relationship,Sequel,Flash Forward,Marriage,Kid Fic,Fluff and Angst,Hurt/Comfort,Alcohol,Recreational Drug Use,Gun Violence,Post-Traumatic Stress Disorder - PTSD,Obsessive-Compulsive Disorder,Body focused repetitive behaviors,Childhood Mental Illness,Premature Infants,hospital stays,Mentions of Infertility,mentions of miscarriages,Sick Children,Past Violence,mild child peril,Panic Attacks,Night Terrors,Discussions of Suicide,Smut,Smut Between Parents,no underage smut,Boys In Love,Angst with a Happy Ending"
One Direction (Band),Harry Styles/Louis Tomlinson,Eleanor Calder/Louis Tomlinson,you can call me babe for the weekend,F/M,Yes,Yes,23 Dec 2020,29,General Audiences,Creator Chose Not To Use Archive Warnings,"Lovers to Friends,Break Up,Post-Break Up,Break Up Talk,Christmas Angst,Angst,Christmas,Sad Ending,Bad Ending,Sad and Happy,i think it's sort of happy,listen to my playlist !!!,Fake/Pretend Relationship,coming home,Moving On,Christmas fic"
One Direction (Band),Eleanor Calder/Louis Tomlinson,Eleanor Calder/Louis Tomlinson,you're too good to be all mine,F/M,Yes,Yes,17 Feb 2019,29,Explicit,No Archive Warnings Apply,"Alternate Universe - Set It Up (2018) Fusion,Alternate Universe - Non-Famous,established Eleanor Calder/Louis Tomlinson,Minor Niall Horan/Hailee Steinfeld,seeing blind AU"
One Direction (Band),Eleanor Calder/Louis Tomlinson,Eleanor Calder/Louis Tomlinson,Tenerife Sea,F/M,Yes,Yes,05 Apr 2018,29,General Audiences,No Archive Warnings Apply,wedding drabble
Louis Tomlinson - Fandom,Eleanor Calder/Louis Tomlinson,Eleanor Calder/Louis Tomlinson,"Brighter, Brightest",F/M,Yes,Yes,19 Feb 2018,29,Explicit,No Archive Warnings Apply,"Canon,Smut,Fluff and Smut,because the fluff comes naturally,Elounor"
One Direction (Band),Harry Styles/Louis Tomlinson,Eleanor Calder/Louis Tomlinson,In the Here and Now,F/M,Yes,Yes,04 Jan 2018,29,General Audiences,Creator Chose Not To Use Archive Warnings,"Angst with a Happy Ending,Angst,larry - Freeform,Larry Stylinson Is Real,Teacher Harry,Yoga Harry,Rich Louis,closeting,Gay,Homophobia,louis has a kid,Fleetwood Mac,Fluff,A - Freeform,Alternate Universe,Oscar Wilde - Freeform,The Beatles - Freeform,Dorian Gray - Freeform,Poetry,Happy Ending"
One Direction,Harry Styles/Louis Tomlinson,Eleanor Calder/Louis Tomlinson,Inked Skin and Immured Hearts,F/M,Yes,Yes,25 Jul 2017,29,Mature,Creator Chose Not To Use Archive Warnings,"Larry Stylinson Is Real,larry stylinson - Freeform,larrystylinson,Fluff,Angst,NSFW,Smut,Porn,BoyxBoy,cute shit,Adventures,Closeted Gay,uptown harry,upperclass harry,Bottom Harry,sub!Harry,harrie - Freeform,top!Louis,dom!Louis,westside louis,Flower Harry,Punk Louis"
One Direction (Band),Niall Horan/Liam Payne,Eleanor Calder/Louis Tomlinson,Good Boy,F/M,Yes,Yes,03 Aug 2015,29,General Audiences,No Archive Warnings Apply,"Alternate Universe,Fluff,sort of angst? I don't know,Kind of sad/depressed Niall,Animals love Niall"
One Direction (Band),Niall Horan/Harry Styles,Eleanor Calder/Louis Tomlinson,En estado de perpetua taquicardia,F/M,Yes,Yes,08 Jul 2014,29,Teen And Up Audiences,Creator Chose Not To Use Archive Warnings,"Romance,Humor,Drama,Pining,Fluff,Angst,AO3 1 Million,5+1 Things"
One Direction,Harry Styles/Louis Tomlinson,Eleanor Calder/Louis Tomlinson,The Light by Which my Spirit's Born,F/M,Yes,Yes,28 Aug 2012,29,General Audiences,No Archive Warnings Apply,Alternate Universe
One Direction (Band),Harry Styles/Louis Tomlinson,Eleanor Calder/Louis Tomlinson,Capture It,F/M,Yes,Yes,20 Jan 2013,32,Not Rated,Creator Chose Not To Use Archive Warnings,"Alternate Universe,Alternate Universe - College/University,filmstudent!Harry,dramastudent!Louis,Fluff and Angst,College"
One Direction (Band),Harry Styles/Louis Tomlinson,Eleanor Calder/Louis Tomlinson,Fight Off Your Demons,F/M,Yes,Yes,09 Jan 2013,32,Teen And Up Audiences,No Archive Warnings Apply,"Non-Graphic Violence,Mild Language,Infidelity,Eating Disorders,Depression,Angst,Unhealthy Levels of Codependence"
One Direction (Band),Zayn Malik/Harry Styles,Eleanor Calder/Louis Tomlinson,Once in a lifetime,F/M,Yes,Yes,12 May 2023,31,Explicit,No Archive Warnings Apply,"Alternate Universe,Explicit Sexual Content,Mpreg"
One Direction (Band),Harry Styles/Louis Tomlinson,Eleanor Calder/Louis Tomlinson,we’re just friends,F/M,Yes,Yes,31 Jul 2017,31,Explicit,"No Archive Warnings Apply,Underage","larry stylinson - Freeform,larry - Freeform,Gay,iphone conspiracies,LGBTQ,Gay Couple,Harry and Louis - Freeform,Friends to Lovers,Cheating,(but not really),Smut,Fluff,Fluff and Smut,Anal Sex,Anal Fingering,Shower Sex,ziam,(not really but they snog ig),one direction - Freeform,they’re in the band,AU,I’m bad at tagging,and I’m also bad at summaries,toplinson,Top Louis,Bottom Harry,they kind of share that really,Friends With Benefits,(in the beginning?),Short Chapters,please read the warnings,Homophobia"
One Direction (Band),Niall Horan/Harry Styles,Eleanor Calder/Louis Tomlinson,You're Good at Looking at Me like I'm See Through,F/M,Yes,Yes,18 Dec 2020,31,Not Rated,Creator Chose Not To Use Archive Warnings,"Love Triangles,Alternate Universe - High School,Love Confessions,Idiots in Love,Mutual Pining,Slow Burn,Slow Build,Trauma,Past Abuse,Past Relationship(s),Awkward Tension,Unresolved Romantic Tension,Unresolved Sexual Tension,they'll work it out,Unrequited Crush,Not Actually Unrequited Love,One-Sided Attraction,seemingly"
One Direction (Band),Niall Horan/Zayn Malik,Eleanor Calder/Louis Tomlinson,We Saw the Same Sunset,F/M,Yes,Yes,23 Feb 2020,31,Mature,No Archive Warnings Apply,"It’s the 1950’s AU no one asked for,Alternate Universe - High School,Socs and Greasers are a thing,Niall is a girl in this"
One Direction (Band),Harry Styles/Louis Tomlinson,Eleanor Calder/Louis Tomlinson,Smoke and Mirrors,F/M,Yes,Yes,30 Jul 2016,31,Mature,Creator Chose Not To Use Archive Warnings,"Smut,Fluff and Angst,Worry,Grinding,Smoking,Mirrors,Windows - Freeform,Exhibitionism"
One Direction (Band),Liam Payne/Harry Styles/Louis Tomlinson,Eleanor Calder/Louis Tomlinson,[Podfic] only because you know (that you wanna feel the same),F/M,Yes,Yes,24 Nov 2014,31,Mature,No Archive Warnings Apply,"Podfic & Podficced Works,Podfic,Podfic Length: 3.5-4 Hours,Alternate Universe,Alternate Universe - School,Superpowers,Precognition,Invisibility,Pyromancy,Mind Control,Audio Format: MP3,Audio Format: Streaming,Audio Format: M4B"
One Direction (Band),Harry Styles/Louis Tomlinson,Eleanor Calder/Louis Tomlinson,You have to go with him,F/M,Yes,Yes,02 Mar 2014,31,Not Rated,Creator Chose Not To Use Archive Warnings,"Friends to Lovers,Uni AU,Harry is broken,louis is an idiot,Happy Ending,what else,im so bad at this :(,Self Harm,Eating Disorder"
One Direction (Band),Harry Styles/Louis Tomlinson,Eleanor Calder/Louis Tomlinson,Titanic,F/M,Yes,Yes,14 Nov 2013,31,Teen And Up Audiences,Major Character Death,"Titanic!Larry,larry au"
One Direction (Band),Harry Styles/Louis Tomlinson,Eleanor Calder/Louis Tomlinson,We Are Doing Our Best,F/M,Yes,Yes,23 Jul 2013,31,Teen And Up Audiences,Creator Chose Not To Use Archive Warnings,"Angst,Fake/Pretend Relationship,Sad"
One Direction (Band),Harry Styles/Louis Tomlinson,Eleanor Calder/Louis Tomlinson,Pictures Don't Do You Justice,F/M,Yes,Yes,03 Nov 2013,31,Not Rated,"No Archive Warnings Apply,Creator Chose Not To Use Archive Warnings","Harry likes Louis,Louis hates everyone,Alternate Universe - High School,because that's never been done before,Graduation,Pining,questionable nationality,I think Niall is the only one I'm sure about,everyone else may or may not be English or American,i say soccer because im american,i will avoid naming locations,will there be background ziam nobody knows,is soccer even a summer sport,so many questions"
One Direction (Band),Liam Payne/Original Female Character,Eleanor Calder/Louis Tomlinson,My Little Bird (A Liam Payne FanFic),F/M,Yes,Yes,07 Apr 2013,31,Teen And Up Audiences,Creator Chose Not To Use Archive Warnings,"Original work - Freeform,Yes I wrote every single word of this"
One Direction,Harry Styles/Louis Tomlinson,Eleanor Calder/Louis Tomlinson,Breathing Again,F/M,Yes,Yes,02 Nov 2012,31,Teen And Up Audiences,No Archive Warnings Apply,"Romance,Reality,one direction - Freeform,Angst"
One Direction (Band),Zayn Malik/Harry Styles,Eleanor Calder/Louis Tomlinson,Damage control,F/M,Yes,Yes,25 Oct 2021,30,Mature,Creator Chose Not To Use Archive Warnings,"zarry - Freeform,larry rumors,Alternate Canon,Friends to Lovers,Big Brother Liam Payne,Mutual Pining,Sexuality Crisis,Self-Acceptance,Caring Zayn Malik,Moody Harry Styles,Obsessive Harry Styles,Minor Harry Styles/Louis Tomlinson,codependent in a good way,OT5 Friendship (One Direction),Self-Doubt,Needy Harry Styles,Vulnerability"
One Direction (Band),Eleanor Calder/Louis Tomlinson,Eleanor Calder/Louis Tomlinson,Cursing My Name,F/M,Yes,Yes,16 Sep 2021,30,Teen And Up Audiences,Creator Chose Not To Use Archive Warnings,"Exes,Past Relationship(s),Canon Compliant,Sad,Happy Ending,not well written oops"
One Direction (Band),Harry Styles/Louis Tomlinson,Eleanor Calder/Louis Tomlinson,Need Me Again,F/M,Yes,Yes,02 Sep 2021,30,Not Rated,Creator Chose Not To Use Archive Warnings,"Minor Eleanor Calder/Louis Tomlinson,Larry Stylinson Is Real,Angst,Soulmates,Broken Harry,Angry Louis Tomlinson,Friends to Lovers,lovers to strangers,sad fic,Sad with a Happy Ending,Ambiguous/Open Ending"
One Direction (Band),Harry Styles/Louis Tomlinson,Eleanor Calder/Louis Tomlinson,You Don't Remember?,F/M,Yes,Yes,17 Jul 2021,30,General Audiences,Creator Chose Not To Use Archive Warnings,"One Direction Tours,OT5 Friendship (One Direction),Break Up,Amnesia,Accidents,Hospitals,Hurt Harry Styles,Happy Eleanor Calder,Happy Simon Cowell,Happy Modest Management,Jealous Louis Tomlinson"
One Direction (Band),Eleanor Calder/Louis Tomlinson,Eleanor Calder/Louis Tomlinson,(Today is the most exciting day of our lives.),F/M,Yes,Yes,28 Jul 2017,30,General Audiences,No Archive Warnings Apply,"Alternate Universe - Fantasy,Fae & Fairies,Witches,True Love's Kiss"
One Direction (Band),Harry Styles/Louis Tomlinson,Eleanor Calder/Louis Tomlinson,crown on my head but the world on my shoulder,F/M,Yes,Yes,25 Jul 2015,30,Not Rated,Creator Chose Not To Use Archive Warnings,"Fake/Pretend Relationship,Eleanor and Sophia as Matchmakers yes bitch"
One Direction (Band),Harry Styles/Louis Tomlinson,Eleanor Calder/Louis Tomlinson,Lips of an Angel,F/M,Yes,Yes,21 Jun 2013,34,Teen And Up Audiences,No Archive Warnings Apply,"Angst,Infidelity,Getting Back Together,Alternate Universe - Canon Divergence"
One Direction (Band),Harry Styles/Louis Tomlinson,Eleanor Calder/Louis Tomlinson,Letters of love,F/M,Yes,Yes,20 Jan 2014,34,Mature,Creator Chose Not To Use Archive Warnings,"Letters,Diary/Journal,idk - Freeform,afraid,Depression,Anxiety Disorder,scared,Secrets,Self-Harm,Cutting,Suicidal Thoughts"
One Direction (Band),narry,Eleanor Calder/Louis Tomlinson,Fighting For Your Love,F/M,Yes,Yes,12 Mar 2013,34,Teen And Up Audiences,No Archive Warnings Apply,
One Direction (Band),Niall Horan/Harry Styles,Eleanor Calder/Louis Tomlinson,If I Could Write A Perfect Story,F/M,Yes,Yes,03 Sep 2016,33,Mature,Creator Chose Not To Use Archive Warnings,"Alternate Universe,Cheating,Pining,Smut,Fluff,Alternate Universe - College/University"
One Direction,Liam Payne/Louis Tomlinson,Eleanor Calder/Louis Tomlinson,Ready to Run,F/M,Yes,Yes,04 Nov 2015,33,Teen And Up Audiences,No Archive Warnings Apply,"Past Harry Styles/Louis Tomlinson,Past Eleanor Calder/Louis Tomlinson,past sophia smith/liam payne,otra,Bisexual Character,Pansexual Character,Canon Divergence,Niall Horan & Liam Payne Friendship,Zayn Malik & Liam Payne Friendship,Harry Styles & Louis Tomlinson Friendship,On the Road Again Tour,Fluff"
One Direction (Band),Harry Styles/Louis Tomlinson,Eleanor Calder/Louis Tomlinson,shake it out,F/M,Yes,Yes,19 Mar 2013,33,Explicit,"Creator Chose Not To Use Archive Warnings,Underage","Gay Sex,Underage Drinking,Underage Sex,Angst,Hurt/Comfort,Prostitution,Alternate Universe,Explicit Sexual Content,Past Abuse,Polygamy"
Taylor Swift (Musician),Liam Payne/Harry Styles,Eleanor Calder/Louis Tomlinson,"Weave Us Together, Tear Us Apart",F/M,Yes,Yes,28 Dec 2012,33,Mature,Creator Chose Not To Use Archive Warnings,"Angst,Fluff,Transgender,Fem!Louis,Songfic,Drug Use"
Larry Stylinson - Fandom,Harry Styles/Louis Tomlinson,Eleanor Calder/Louis Tomlinson,I'm Less Without You (Popularity Isn't Everything),F/M,Yes,Yes,29 Oct 2021,32,Teen And Up Audiences,No Archive Warnings Apply,"Falling In Love,Desire,True Love's Kiss,Loss of Virginity,Virgin Harry,Mpreg,Mpreg Harry,Louis Talk Spanish,Cheating,Rich Louis,Gay Parents,Making Love,Making Out,Rough Sex,Anal Sex,Flirting,Shopping,Dreams,Insecure Harry,Innocent Harry,Best Friends,flower shop,Restaurants,Engaged Harry Styles/Louis Tomlinson,Married Harry Styles/Louis Tomlinson,Soulmates Harry Styles/Louis Tomlinson,Children of Characters"
One Direction (Band),Harry Styles/Louis Tomlinson,Eleanor Calder/Louis Tomlinson,Do Not Wait,F/M,Yes,Yes,21 Dec 2021,32,Mature,Creator Chose Not To Use Archive Warnings,"Alternate Universe,Singer Harry Styles,Journalist Louis,Assistant Harry Styles,Tinder,Mutual Pining,louis has fake relationship with OC,harry gets jealous and sad,Internalized Homophobia,Light Angst,problems are eased with a cup of tea"
One Direction (Band),(Implied Unrequited) Louis Tomlinson/Harry Styles,Eleanor Calder/Louis Tomlinson,another place and time (if only),F/M,Yes,Yes,06 Aug 2019,32,General Audiences,No Archive Warnings Apply,"babygate,Bisexuality,Bisexual Female Character,Bisexual Male Character,Louis Tomlinson Loves Harry Styles,Unrequited Love,Missing Scene,Light Angst,Angst and Feels,Freddie Is A Tomlinson,Eleanor Is A Good Friend,Honesty"
One Direction (Band),Liam Payne/Harry Styles,Eleanor Calder/Louis Tomlinson,Don't Wanna Be A Monster Among Men,F/M,Yes,Yes,31 Oct 2018,32,Teen And Up Audiences,Graphic Depictions Of Violence,"Alternate Universe - Werewolf,Alternate Universe - College/University,Roommates,Football | Soccer,the hunting and changing into a werewolf part gets a bit graphic,Nudity,mentions of bullying"
