fandom,relationship,taggedRel,title,relType,isCanon,isRPF,datetime,kudos,rating,warnings,tags
One Direction (Band),Harry Styles/Louis Tomlinson,Harry Styles/Louis Tomlinson,amaryllis,M/M,No,Yes,13 Sep 2014,"3,094",Explicit,Graphic Depictions Of Violence,"Werewolves,that's pretty much it um,Friends to Lovers,Family,Angst,Fluff,Bows & Arrows,machetes,and the like,the Swifts are a clan of hunters because i'm pathetic,the boys don't know what they're doing,The End,Werewolf Harry,Werewolf Louis,Werewolf Liam,Werewolf Zayn,after half a year i felt compelled to add a tag saying that this isn't a/b/o,it's more teen wolf-y lol"
One Direction (Band),Harry Styles/Louis Tomlinson,Harry Styles/Louis Tomlinson,We Will Find Our Way,M/M,No,Yes,22 Dec 2013,"3,092",Mature,No Archive Warnings Apply,"Alternate Universe - College/University,Christmas Fluff"
One Direction (Band),Harry Styles/Louis Tomlinson,Harry Styles/Louis Tomlinson,bite me,M/M,No,Yes,12 Jun 2015,"3,303",Explicit,"Creator Chose Not To Use Archive Warnings,No Archive Warnings Apply","Alpha Harry,Omega Louis,Alpha Liam,Alpha Zayn,Omega Niall,Alpha Nick,Werewolf AU,Angst,Smut,Fluff,Werewolves,Mpreg,Pregnant Louis,Mean Harry,rude harry,cynical harry,Pregnant Niall,Mating Cycles/In Heat,Knotting,Self-Lubrication,Submission,Angry Harry"
One Direction (Band),Harry Styles/Louis Tomlinson,Harry Styles/Louis Tomlinson,Switch Out The Batteries,M/M,No,Yes,07 Jun 2014,"3,301",Explicit,No Archive Warnings Apply,"Orgasm Denial,Cock Ring,Sex dice,Spanking,Daddy Kink,D/s,Service Kink,spreader bar,ball gag dildo thing,Paddling,Flogging,love egg,blindfolding,Sensation Play,remote control vibe,DAVID BECKHAM - Freeform,Fisting,Orgy,Double Anal Penetration,zourry threeway,Exhibitionism,Dom Louis,Sub Harry,bottom dom louis,but also top dom louis,everyone gets it in the ass it's 90k,collaring,coming on command,Panties,ruined orgasm,A TRULY INORDINATE AMOUNT OF RIMMING,Subspace,emotional resolution through gangbang"
One Direction (Band),Harry Styles/Louis Tomlinson,Harry Styles/Louis Tomlinson,happiness comes in on tiptoe,M/M,No,Yes,09 Aug 2015,"3,295",Not Rated,Creator Chose Not To Use Archive Warnings,"Neighbor au,Fluff,Teacher Louis,Insane Amounts of Fluff,harry washing a car in jorts,harry might be the nicest person louis has ever come across,louis doesn't know what to do with this information,Tooth Rotting Fluff,cute boys being cute,and baking a lemon drizzle cake,Baker Harry,sophia is in this for a hot second bc she's my mom"
One Direction (Band),Harry Styles/Louis Tomlinson,Harry Styles/Louis Tomlinson,with your love we could breathe underwater,M/M,No,Yes,09 Sep 2014,"3,289",Mature,No Archive Warnings Apply,"Alternate Universe,Alternate Universe - Mermaids,Alternate Universe - Fantasy,mermaid au,a lot of fluff,a lot of adventure,a dash of smut,and a happy ending!"
One Direction (Band),Harry Styles/Louis Tomlinson,Harry Styles/Louis Tomlinson,"let your damage, damage me",M/M,No,Yes,20 May 2022,"3,288",Explicit,Creator Chose Not To Use Archive Warnings,"Alpha/Beta/Omega Dynamics,Alternate Universe - Regency,Alpha Harry Styles,Omega Louis Tomlinson,Arranged Marriage,Enemies to Lovers,Morally Ambiguous Character,Marking,Possessive Behavior,Blasphemy,King Harry,Deception,Angst with a Happy Ending,Jealousy,Barebacking,Unrequited Love,Mating Bites,Additional Warnings In Author's Note,Explicit Sexual Content,Bottom Louis Tomlinson,Top Harry Styles,Powerful Harry Styles,dark-ish Harry,Virginity Loss,Rimming"
One Direction (Band),Harry Styles/Louis Tomlinson,Harry Styles/Louis Tomlinson,Beautiful War,M/M,No,Yes,30 Jan 2022,"3,288",Mature,Graphic Depictions Of Violence,"Alternative Universe - FBI,Harry is a British FBI-Agent (just go with it),Clairvoyant!Louis,FBI!Harry,agentharry,AgentZayn,AgentNiall,Murder Mystery,Serial Killers,References to Norse Religion & Lore,Autumn,Portland Oregon,Enemies to Lovers,Hate to Love,Like serious hate to soft stuff,Eventual Smut,Will update smut tags as we go,Louis has PTSD and severe Anxiety,Anxiety Attacks,Anxiety Disorder,Blood and Gore,Violence,Flashbacks,Soft Louis Tomlinson,Louis in oversized jumpers,protective!harry,Blood Eagle,Legal Jargon,Legal terms that might not be completely accurate,Federal Bureau of Investigation,Investigations,Crimes & Criminals,Eventual Fluff,Angst,Lots of Angst,Angst with a Happy Ending,Hurt/Comfort,Happy Ending,Feel that's iportant to mention,Angst and Fluff and Smut,Visions,Prophetic Visions,Service Dogs,clifford,Misconceptions,POV Multiple,Minor Zayn Malik/Liam Payne,Sassy Louis Tomlinson,SMUT TAGS:,Blowjobs,handjobs,Rimming,Bottom Louis Tomlinson,Top Harry Styles,Alludes to Harry bottoming but it doesn’t happen in this fic so,If it matters who tops etc then this maybe isn’t the fic for you x"
One Direction (Band),Harry Styles/Louis Tomlinson,Harry Styles/Louis Tomlinson,Put It On Me,M/M,No,Yes,01 May 2015,"3,268",Mature,Creator Chose Not To Use Archive Warnings,"Stripper Louis,Rich Harry,Alternate Universe,Smut"
One Direction (Band),Harry Styles/Louis Tomlinson,Harry Styles/Louis Tomlinson,Can I Make It Any More Obvious?,M/M,No,Yes,29 Mar 2013,"3,266",Explicit,Creator Chose Not To Use Archive Warnings,"Abuse,Alcohol,Drug Addiction,Barebacking,Blow Jobs,Fingering,Car Sex,Ballerina!Louis,punk!harry,Alternate Universe"
One Direction (Band),Harry Styles/Louis Tomlinson,Harry Styles/Louis Tomlinson,so let's cross the lines we lost,M/M,No,Yes,13 Feb 2017,"3,264",Explicit,No Archive Warnings Apply,"Louis and Harry have a complicated past,mentions of past Aiden/Louis,mentions of past Aiden/Harry,Smut,like a lot,Alternate Universe - College/University,Neighbors,Enemies to Lovers,Enemies to Friends,domestic ot5,Enemies With Benefits,Louis' POV,some parts are Zayns POV,because ziall is important,Love/Hate,Friends With Benefits,Semi-Public Sex,Niall cooks a lot,Secret Relationship,Fluff and Angst,Hurt/Comfort"
One Direction (Band),Harry Styles/Louis Tomlinson,Harry Styles/Louis Tomlinson,"I Like the Way You Bend for Me, Baby",M/M,No,Yes,26 Jul 2014,"3,262",Mature,"Creator Chose Not To Use Archive Warnings,No Archive Warnings Apply","zayn and niall are louis' room mates,they cuddle a lot because who doesn't love cuddles,Alternate Universe - College/University,Pining,Fluff,Fluff and Smut,Unresolved Sexual Tension,so much of it like w o w,they're all uni students,harry also teaches yoga and sexually frustrates louis because tight leggings"
One Direction (Band),Harry Styles/Louis Tomlinson,Harry Styles/Louis Tomlinson,Blue Ice,M/M,No,Yes,05 Feb 2018,"3,258",Mature,Creator Chose Not To Use Archive Warnings,"Arranged Marriage,Adultery,Infidelity,Emotional/Psychological Abuse,Emotional Hurt/Comfort,Unrequited Love,Angst,Character Development,Possessive Behavior,Jealousy,Dark Harry,Mean Harry,Asshole Harry,Sweet Louis,Sassy Louis,Eventual Romance,Eventual Fluff,Eventual Smut,Top Harry,Bottom Louis,Complete"
One Direction (Band),Harry Styles/Louis Tomlinson,Harry Styles/Louis Tomlinson,before we knew,M/M,No,Yes,10 May 2020,"3,252",Explicit,No Archive Warnings Apply,"Alternate Universe - Soulmates,Soulmate-Identifying Marks,Angst,Pining Louis,Stubborn Harry,Medium Dom/Sub,Daddy Kink,filthy smut,full smut tags in notes,Bottom Louis"
One Direction (Band),Harry Styles/Louis Tomlinson,Harry Styles/Louis Tomlinson,"i don't wanna be your friend, i wanna kiss your neck",M/M,No,Yes,15 Jul 2014,"3,237",Explicit,Underage,"Alpha/Beta/Omega Dynamics,harry is 17,Underage Drinking,Underage Drug Use,Unprotected Sex,Frottage,Hand Jobs,Blow Jobs,Fingering,Friends to Lovers,There's a heat and a rut in there,And a short roadtrip,Also some thigh fucking,Super cliche and kinda fluffy"
One Direction (Band),Harry Styles/Louis Tomlinson,Harry Styles/Louis Tomlinson,long hair don't care,M/M,No,Yes,14 Sep 2014,"3,235",Explicit,No Archive Warnings Apply,"oh boy,Tangled AU,Alternate Universe - Fantasy,i think? i,i've never been so lost for tags before what do i PUT,sexed up disney,only mildly there's mostly plot,however there's the extremely unlikely existence of lube,but i tagged it with fantasy so i am the sassy girl emoji,heavy doses of cheesiness as well i will not lie to you that's it goodbye"
One Direction (Band),Harry Styles/Louis Tomlinson,Harry Styles/Louis Tomlinson,Just Another Ordinary Day,M/M,No,Yes,17 Jul 2015,"3,226",Teen And Up Audiences,Creator Chose Not To Use Archive Warnings,"Unrequited Love,Best Friends,Omega Louis,Alpha Harry,mention of MPREG,Pregnancy Kink,that tag makes me wanna claw my face off even though i wrote this before THAT,Friends to Lovers,First Kiss,oblivious boys,No really they're dumb as dirt,Dom/sub Undertones,Harry goes from sweet to pin you to the wall like woah,Insecure Louis,chubby Louis,Harry has a secret crush,Louis is lime green jello,Mates,Gemma gets the ball rolling"
One Direction (Band),Harry Styles/Louis Tomlinson,Harry Styles/Louis Tomlinson,Ever Since I Tried Your Way,M/M,No,Yes,16 Jun 2020,"3,225",Explicit,No Archive Warnings Apply,"Alternate Universe - Historical,Alternate Universe - 1940s,Alternate Universe - 1950s,Alternate Universe - Farm/Ranch,Post-WW2 America,Soldier Louis Tomlinson,Farmer Louis Tomlinson,Cowboy Louis,Farmer Harry,Virgin Harry,Feminine Harry Styles,Gay Cowboys,Repression,Religious Guilt,Internalized Homophobia,Hurt/Comfort,Emotional Hurt/Comfort,Fluff,Smut,Loss of Virginity,First Time Blow Jobs,First Time Topping,First Time Bottoming,Top Louis Tomlinson,Bottom Harry Styles,but they kind of share that,Feminization,Marraige Kink,Gender Exploration,Harry Styles Wearing Dresses,Louis Tomlinson Wearing Dresses,Lipstick,No Plot Just Tenderness,Graphic Cow Births,Kittens,southern louis,Religious Imagery & Symbolism,Romantic Face Shaving,Bathing/Washing,Body Worship,Polari,Country Music"
One Direction (Band),Harry Styles/Louis Tomlinson,Harry Styles/Louis Tomlinson,In This Light,M/M,No,Yes,24 Nov 2015,"3,221",Explicit,No Archive Warnings Apply,"Friends to Lovers,Pining,Secret Crush,famous/non-famous,Famous Louis,Stylist Harry,Anal Sex,Anal Fingering,Blow Jobs,Rimming,Minor Character Death,Edging,Orgasm Delay/Denial"
One Direction (Band),Harry Styles/Louis Tomlinson,Harry Styles/Louis Tomlinson,Birds in Gilded Cages,M/M,No,Yes,20 Jun 2015,"3,221",Mature,"Graphic Depictions Of Violence,Rape/Non-Con","Alternate Universe,Angst,Drama,Bottom Harry,harry - Freeform,Liam - Freeform,Niall Horan & Harry Styles Friendship,Hurt Harry Styles,Liam Payne & Harry Styles Friendship,Minor Nick Grimshaw/Harry Styles,Zayn Malik & Harry Styles Friendship,Attempted Rape/Non-Con,Rape,Rape Aftermath,Gang Rape,Bondage,Forced Prostitution,Prostitute Harry,Fluff and Smut,Anal Sex,Anal Fingering,Non-Consensual Oral Sex,Oral Sex,Explicit Sexual Content,Explicit Language,Harry Styles Loves Louis Tomlinson,Rich Louis Tomlinson,Sexual Abuse,Self-Harm,Kidnapping,Whipping,Falling In Love,Sexual Assault,Butt Plugs"
One Direction (Band),Harry Styles/Louis Tomlinson,Harry Styles/Louis Tomlinson,to kill the mess we've made,M/M,No,Yes,13 Aug 2016,"3,208",Explicit,No Archive Warnings Apply,"Alternate Universe - Fashion & Models,Friends With Benefits,Sexual Content,Rimming,it's a teensy bit sad,because harry is dramatic,basically harry and louis are models and that's all you need to know"
One Direction (Band),Harry Styles/Louis Tomlinson,Harry Styles/Louis Tomlinson,Cocaine for Breakfast,M/M,No,Yes,20 Jul 2020,"3,205",Not Rated,Graphic Depictions Of Violence,"Drug Addiction,Drug Dealing,Implied/Referenced Homophobia,Friends to Lovers,Slow Burn,Angst,Depression,Smut,Family Issues,Drug Use,Panic Attacks,Drug Dealer au,Paranoia,Near Death Experiences,a lot lot lot of angst,Fluff,Eventual Smut,Fluff and Angst,Angst with a Happy Ending,Happy Ending,Mutual Pining,Pining,Minor Character Death,Mentions of Suicide Attempt (past),mentions of self-harm (past),Violence,Blowjobs,Anal Fingering,POV Louis,Anal Sex,Oral Sex,Domestic Fluff,Fluff and Smut,Emotional Hurt/Comfort,Alternate Universe,Depressed Louis,Semi-Public Sex,Blow Jobs in a Car,Emotional Roller Coaster,Humor,OT5 Friendship,First Time Bottoming,Top Harry,Bottom Harry,Bottom Louis,Top Louis Tomlinson,because they kind of share that reaaally"
One Direction (Band),Harry Styles/Louis Tomlinson,Harry Styles/Louis Tomlinson,tennis court,M/M,No,Yes,16 Jan 2021,"3,474",Explicit,Creator Chose Not To Use Archive Warnings,"Office,Jealousy,Hate to Love,Himbo Harry Styles,Alpha/Beta/Omega Dynamics,Omega Louis Tomlinson,Light Angst,Domestic,Anal Sex,Size Difference,Praise Kink,Oblivious,Mating Cycles/In Heat,Sharing a Bed,Nesting,Comeplay,Possessive Behavior,Size Kink"
One Direction (Band),Harry Styles/Louis Tomlinson,Harry Styles/Louis Tomlinson,So Baby Whenever You're Ready,M/M,No,Yes,29 Mar 2014,"3,473",Explicit,Creator Chose Not To Use Archive Warnings,"Zayn POV!,18/26,Wax Play,Anal Plug,Facial,Exhibitionism,Voyeurism,Comeplay,zayn can look but he can't touch,Bit of bondage,Subspace,oh and daddy kink,nearly forgotten"
One Direction (Band),Harry Styles/Louis Tomlinson,Harry Styles/Louis Tomlinson,the value of this moment lives in metaphor,M/M,No,Yes,02 Dec 2014,"3,460",Teen And Up Audiences,Creator Chose Not To Use Archive Warnings,"Alternate Universe - High School,teacher!au,Fluff,dumb boys figuring out their feelings,and everyone's a larry shipper,aka the perfect universe,I think that's pretty much it,also the niall/barbara thing is very small,Friends to Lovers,i forgot that"
One Direction (Band),Harry Styles/Louis Tomlinson,Harry Styles/Louis Tomlinson,Naked & Proud,M/M,No,Yes,15 May 2016,"3,457",Explicit,No Archive Warnings Apply,"Where do I begin,Grocery Store,Small Towns,Farmer Harry,Songwriter Louis,lots of organic food,Pining,Summer Romance,Lust at First Sight,Blow Jobs,Anal Sex,Rimming,Fluff and Smut,Humor,only a little bit of angst because i'm incapable of leaving it out,Additional Warnings In Author's Note,Podfic Available"
One Direction (Band),Harry Styles/Louis Tomlinson,Harry Styles/Louis Tomlinson,Core 'ngrato,M/M,No,Yes,20 May 2014,"3,455",Not Rated,No Archive Warnings Apply,"Angst,So much angst,happy ending!,SO HAPPY!,the other boys aren't in it as much"
One Direction (Band),Harry Styles/Louis Tomlinson,Harry Styles/Louis Tomlinson,To Be Loved To Be In Love,M/M,No,Yes,09 Aug 2016,"3,422",Mature,No Archive Warnings Apply,"Dom/sub,BDSM,Smut,Mpreg,Polygamy,Dom Harry,Dom Liam,Dom Zayn,Sub Niall,Sub Louis,larry stylinson - Freeform,zaniam - Freeform,Spanking,Sugar Daddy Harry,Sugar Daddy Liam,Sugar Daddy Zayn,Sugar Baby Louis,Rich Harry,Poor Louis,Farmer Louis,Male Lactation,Lactation Kink,Mpreg Niall,Mpreg Louis,Daddy Harry,Daddy Liam,Daddy Zayn,Protective,Consensual,Punishment,Pregnancy Kink,Daddy Kink,Infertility,Sad Louis,Crossdressing Kink,Football Player Louis,Drinking,Drinking Games,Dom/Sub AU,Flogging,Alternate Universe - BDSM,Angst,like a lot of it,Past Relationship(s),Slight Slow Build,Stalking"
One Direction (Band),Harry Styles/Louis Tomlinson,Harry Styles/Louis Tomlinson,The Stars In Your Eyes Light Up The Sky,M/M,No,Yes,16 Feb 2014,"3,422",Explicit,Creator Chose Not To Use Archive Warnings,"Alternate Universe,Alternate Universe - Royalty,Prince Harry Styles"
One Direction (Band),Harry Styles/Louis Tomlinson,Harry Styles/Louis Tomlinson,fake it till you make it,M/M,No,Yes,24 Nov 2021,"3,417",Explicit,No Archive Warnings Apply,"Alternate Universe - College/University,Alpha/Beta/Omega Dynamics,Alpha Harry Styles,Omega Louis Tomlinson,Enemies to Lovers,more like Mutual Dislike tho,idiots to lovers,Fake/Pretend Relationship,Frat Boy Harry Styles,Himbo Harry Styles,Lacrosse Player Harry Styles,Peter Kavinsky who?,Jealousy,Humor,Explicit Sexual Content,Virgin Louis Tomlinson,Experienced Harry Styles,First Time,Niall is Tired TM,Additional Warnings In Author's Note"
One Direction (Band),Harry Styles/Louis Tomlinson,Harry Styles/Louis Tomlinson,"A Rose, By Any Other Name",M/M,No,Yes,23 Apr 2015,"3,413",Explicit,Graphic Depictions Of Violence,"Alternate Universe - Mob,Mafia AU,mob boss louis,harry is a simple boy from texas,louis likes to spoil harry,1920's,Top Louis,Bottom Harry,Barebacking,blowjobs while someone else is in the room"
One Direction (Band),Harry Styles/Louis Tomlinson,Harry Styles/Louis Tomlinson,May We Stay Lost On Our Way Home,M/M,No,Yes,24 Apr 2015,"3,412",Explicit,No Archive Warnings Apply,"fairy fic,Fairy Louis,kind of like tinkerbell only human-sized,harry is a pop star,niall is a good guy,zayn is a mystery,liam is a centaur,Light Bondage,Face-Fucking,Facials,Outdoor Sex,too many disney references,Magic,louis' jizz tastes like maple syrup roll with me,they make flower crowns,bottom!both,Dom/sub,dom!Louis,Sub Harry,magical self-lubricating ass,like a/b/o only without heats and things,so like wet pussy,Rimming,Face-Sitting,Wing Kink,Weed,Paddling,Vibrators,Subspace,Daddy Kink,Aftercare"
One Direction (Band),Harry Styles/Louis Tomlinson,Harry Styles/Louis Tomlinson,"don’t even need to touch me, baby, just breathe on me.",M/M,No,Yes,19 Jan 2014,"3,387",Explicit,No Archive Warnings Apply,"Teacher-Student Relationship,I'm so sorry,camboy!harry,I know,Masturbation,yeah - Freeform,Voyeurism,Sorry About It,Anal Sex,all that stuff u know the deal"
One Direction (Band),Harry Styles/Louis Tomlinson,Harry Styles/Louis Tomlinson,all we can do is keep breathing,M/M,No,Yes,01 Apr 2019,"3,372",Explicit,Creator Chose Not To Use Archive Warnings,"Greys Anatomy inspired,medical AU,Doctor Louis,father harry,set in seattle but h&l are still british,Slow Burn,like the slowest of slow burns im sorry,Angst,even more angst,Mutual Pinning,Character Death,emotional (highly),medical traumas,Coming of Age,Sadness,Heartbreak,Grief/Mourning,Emotional Hurt/Comfort,also read my authors note for more detail"
One Direction (Band),Harry Styles/Louis Tomlinson,Harry Styles/Louis Tomlinson,And I'll judge the cover by the book,M/M,No,Yes,02 Nov 2015,"3,372",Mature,No Archive Warnings Apply,"Alternate Universe - College/University,Closeted Character,Enemies to Friends to Lovers,Fluff and Angst,Coming Out,Friendship,Falling In Love,Top Louis,Bottom Harry,Rimming,Blow Jobs in a Car,this is a story about finding yourself when no one wants you to,Rich Harry"
One Direction (Band),Harry Styles/Louis Tomlinson,Harry Styles/Louis Tomlinson,Right Side of the Wrong Bed,M/M,No,Yes,08 Mar 2015,"3,357",Explicit,Creator Chose Not To Use Archive Warnings,"Humor,Fluff,gratuitous use of the word fuck,because Louis has a foul mouth,Anal Sex,Blow Jobs,Rimming,69 (Sex Position),Bottom Louis,read it for Louis' internal commentary"
One Direction (Band),Harry Styles/Louis Tomlinson,Harry Styles/Louis Tomlinson,ain't had none like you in a while,M/M,No,Yes,16 Mar 2014,"3,357",Explicit,Creator Chose Not To Use Archive Warnings,"Alternate Universe - Time Travel,december 2010,boys are silly about their feelings,30 and 28 fuck 16 and 18 into their senses,Foursome - M/M/M/M,Grinding,Anal Fingering,Rimming,Light Bondage,Blow Jobs,Light Dom/sub,Comeplay,Daddy Kink,Anal Sex,Felching,Age Difference,Bottom Harry,Bottom Louis,time travel is amazing,Barebacking,Implied subspace,Barely Legal,basically 30 year old louis is everybody's daddy"
One Direction (Band),Harry Styles/Louis Tomlinson,Harry Styles/Louis Tomlinson,smile in slow motion,M/M,No,Yes,06 May 2014,"3,340",Explicit,Creator Chose Not To Use Archive Warnings,"Alternate Universe - BDSM,Face-Fucking,Pining,Spanking,Daddy Kink,Cuddling & Snuggling,Exhibitionism,Panties,shockingly little smut for a sex club au,Kink Negotiation"
One Direction (Band),Harry Styles/Louis Tomlinson,Harry Styles/Louis Tomlinson,Web Me Harder,M/M,No,Yes,26 Apr 2015,"3,328",Explicit,No Archive Warnings Apply,"Louis webs Harry to the bed and fucks him,it's some of my best smut to date honestly,but the plot is adorable too???,this is honestly top 5 faves,enjoy,Top Louis,Bottom Harry,Bondage,face fucking,Friends to Lovers,(kinda),Spiderman AU,Zialliam don't exist sorry"
One Direction (Band),Harry Styles/Louis Tomlinson,Harry Styles/Louis Tomlinson,"tastes like summer, smiles like may",M/M,No,Yes,20 Nov 2020,"3,324",Explicit,Creator Chose Not To Use Archive Warnings,"Hate to Love,Royalty,Arranged Marriage,Loss of Virginity,Slow Burn,Alpha/Beta/Omega Dynamics,Alpha Harry,Omega Louis Tomlinson,Knotting,Mating Bites,Praise Kink,Size Kink,Breeding Kink,Dirty Talk,Louis Tomlinson in Panties,Jealousy,Possessive Behavior,Unrequited Love,Non-Graphic Violence,Angst with a Happy Ending,Explicit Sexual Content,Scenting,Anal Sex,Additional Warnings In Author's Note,Historical,Comeplay,Feminization"
One Direction (Band),Harry Styles/Louis Tomlinson,Harry Styles/Louis Tomlinson,King and Lionheart,M/M,No,Yes,14 Aug 2014,"3,324",Mature,Creator Chose Not To Use Archive Warnings,"Alpha/Beta/Omega Dynamics,Omega Louis,Alpha Harry,Alpha Liam,Alpha Niall,Romance,Beta Zayn,Mpreg,Rutting,Knotting,Angst"
One Direction (Band),Harry Styles/Louis Tomlinson,Harry Styles/Louis Tomlinson,falling into you,M/M,No,Yes,09 Feb 2018,"3,314",Mature,Creator Chose Not To Use Archive Warnings,"Alpha/Beta/Omega Dynamics,Alpha Harry,Omega Louis,Alpha Liam,Omega Zayn,Alpha Niall,Alternate Universe - School,Smut,Flashbacks,Bullying,Slow Build,Pining,POV Multiple,Angst,Past Abuse,Abuse,Domestic Violence,Alcohol Abuse/Alcoholism"
One Direction (Band),Harry Styles/Louis Tomlinson,Harry Styles/Louis Tomlinson,kiss me on the mouth and set me free,M/M,No,Yes,26 Oct 2015,"3,600",Not Rated,No Archive Warnings Apply,"brief mentions of various youtubers,youtubers au,YouTube,Gamer!Louis,Beauty Guru!Harry,Pining,Strangers to Lovers,Enemies to Lovers,Rimming,Anal Sex,Oral Sex,Shower Sex,theres a lot of mutual teasing going on,VidCon,thats p much it,Bottom!Harry"
One Direction (Band),Harry Styles/Louis Tomlinson,Harry Styles/Louis Tomlinson,a virgin to that money,M/M,No,Yes,31 Jul 2014,"3,596",Explicit,No Archive Warnings Apply,"Alternate Universe - College/University,Sex Tapes,Love/Hate,Bottom Louis"
One Direction (Band),Harry Styles/Louis Tomlinson,Harry Styles/Louis Tomlinson,The Space Between,M/M,No,Yes,14 Mar 2020,"3,594",Explicit,No Archive Warnings Apply,"Alpha/Beta/Omega Dynamics,Alpha Harry,Omega Louis,Famous Harry,Non-Famous Louis Tomlinson,Singer Harry Styles,Student Louis Tomlinson,Anal Fingering,Anal Sex,Knotting,Bottom Louis,Top Harry,Fluff,Angst,Insomnia,Sexism,Implied/Referenced Drug Use"
One Direction (Band),Harry Styles/Louis Tomlinson,Harry Styles/Louis Tomlinson,That's How I Know,M/M,No,Yes,03 Mar 2018,"3,582",Explicit,No Archive Warnings Apply,"Alternate Universe - Neighbors,Enemies to Lovers,Hate to Love,Professor Harry,Coach Louis,Midwest,Summer,British Louis Tomlinson,American Harry,Smut,Fluff and Humor,Masturbation,Masturbation in Shower,Anal Sex,Anal Fingering,Riding,Blow Jobs,POV Multiple,POV Louis,POV Harry,Mutual Pining,Sexual Tension"
One Direction (Band),Harry Styles/Louis Tomlinson,Harry Styles/Louis Tomlinson,the impossible now,M/M,No,Yes,09 Feb 2018,"3,575",Mature,No Archive Warnings Apply,"Dimension Travel,Photographer Harry,Scientist Louis,Botany,Popstar Harry,Sexuality Crisis,Smut,Fluff,Angst"
One Direction (Band),Harry Styles/Louis Tomlinson,Harry Styles/Louis Tomlinson,Won't See It Coming Til It's Already Gone,M/M,No,Yes,13 Oct 2015,"3,566",Explicit,No Archive Warnings Apply,"Explicit Sexual Content,Accidental Marriage,Unsafe Sex"
One Direction (Band),Harry Styles/Louis Tomlinson,Harry Styles/Louis Tomlinson,"You, Me, (and everyone we know)",M/M,No,Yes,07 Apr 2024,"3,545",Explicit,No Archive Warnings Apply,"Famous Harry,Non-Famous Louis Tomlinson,OT5,Famous Niall Horan,Famous Liam Payne,Famous Zayn Malik,Slow Burn,Hurt/Comfort,Fluff and Angst,Closeted Character,Sex Drugs and Rock and Roll,Unrequited Love,Not Actually Unrequited Love,Fluff and Humor,Attempt at Humor,Strangers to Lovers,Enemies to Lovers,Humor,im funny okay,Personal Assistant Louis Tomlinson,Angst,Angst with a Happy Ending,Angst and Hurt/Comfort,Angst and Fluff and Smut,Angst and Humor,Comfort/Angst,Character Development,Mental Health Issues,Substance Abuse,Minor Harry Styles/Original Male Character(s) early on. Not cheating,A range of mental health issues either mentioned or explored,DM to discuss same,the slowest of slow burns,You need to understand exactly how slow the slow burn is,Because its slow,REALLY slow,Quote: They kind of share that really (One Direction)"
One Direction (Band),Harry Styles/Louis Tomlinson,Harry Styles/Louis Tomlinson,Untangle Me,M/M,No,Yes,08 Sep 2015,"3,540",Explicit,No Archive Warnings Apply,"Reality,Canon Compliant,Angst,Fluff,Domestic Fluff,Pining,Friends to Lovers,First Time,Anal Fingering,Anal Sex,Masturbation,Mutual Masturbation,Blow Jobs,Alcohol,Recreational Drug Use,Clubbing,Smoking,First Kiss,Grinding,Hand Jobs,Dirty Talk,Kissing"
One Direction (Band),Harry Styles/Louis Tomlinson,Harry Styles/Louis Tomlinson,why don't we go there?,M/M,No,Yes,31 Dec 2014,"3,532",Explicit,Creator Chose Not To Use Archive Warnings,"Alternate Universe,Strangers to Lovers,Friends to Lovers,Fluff,Fluff and Smut,Phone Sex,Sexting,and the whole thing happen over texts which I think it's cool alright,Little Numbers AU"
One Direction (Band),Harry Styles/Louis Tomlinson,Harry Styles/Louis Tomlinson,Second Time's the Charm,M/M,No,Yes,12 Apr 2016,"3,527",Explicit,No Archive Warnings Apply,"POV Louis,Bottom Louis,Top Harry,Hand Jobs,Blow Jobs,Anal Sex,Fluff,Smut,i wrote a happy fic,i've never... done that?,don't count on this version of me to stay,I am not a fluff writer,but this was fun,Enjoy!,Angst to come"
One Direction (Band),Zayn Malik/Liam Payne,Harry Styles/Louis Tomlinson,I'll Be Strong For You,M/M,No,Yes,17 Mar 2013,"3,515",Explicit,Creator Chose Not To Use Archive Warnings,"character illness,but with a happy ending?"
