fandom,relationship,taggedRel,title,relType,isCanon,isRPF,datetime,kudos,rating,warnings,tags
One Direction (Band),Harry Styles/Louis Tomlinson,Harry Styles/Louis Tomlinson,Never Let Me Go,M/M,No,Yes,27 May 2017,"2,180",Explicit,Creator Chose Not To Use Archive Warnings,"Friends to Lovers,Childhood Friends,The 10 Years Plan AU,Lawyer Harry,Police Officer Louis,London,Angst,not too much tho i swear,Slow Burn,louis is a bit oblivious,and harry is a bit coward,marriage deal,louis has sex with omc,but it's NOT cheating,and it doesn't really mean anything,so you can just skip those parts,Masturbation,Grinding,Bottom Louis,Blow Jobs,Rimming,Karaoke,Clubbing,Jealous Louis,Growing Up Together,mentions of a past tomlinshaw,(but it's mentioned like twice and it's really not important)"
One Direction (Band),Harry Styles/Louis Tomlinson,Harry Styles/Louis Tomlinson,My Only Sunshine,M/M,No,Yes,12 Aug 2013,"2,180",Mature,Creator Chose Not To Use Archive Warnings,"Growing Up,Friends to Lovers,Alternate Universe - High School,Fluff and Angst,Smut,(not particularly graphic),Frottage,First Time,top!Louis,mentions of bullying,Homophobic Language,Implied/Referenced Underage Drinking,Coming of Age"
One Direction (Band),Harry Styles/Louis Tomlinson,Harry Styles/Louis Tomlinson,the way the storms blow,M/M,No,Yes,13 Jan 2020,"2,177",Explicit,No Archive Warnings Apply,"Friends to Lovers,Accidental Voyeurism,Pining,Bottom Louis,Bisexual Character,Alcohol"
One Direction (Band),Harry Styles/Louis Tomlinson,Harry Styles/Louis Tomlinson,i found love in you (and i learned to love me too),M/M,No,Yes,17 Jul 2023,"2,175",Explicit,No Archive Warnings Apply,"Famous Louis Tomlinson,Non-Famous Harry Styles,Summer Vacation,Reunions,Mutual Pining,Reunion Sex,Angst and Hurt/Comfort,Anxiety Disorder,Panic Attacks,Fluff,Skinny Dipping,Massage,Genderfluid Harry Styles,Feminization,gender euphoria,Gender Dysphoria,Harry in Lingerie,Harry Styles Wears a Dress,oh right and the big one of course,Age Difference,Older Louis Tomlinson,Parent Louis Tomlinson,Sneaking Around,Secret Relationship,Domestic Fluff,Humor,Meet the Family,Happy Ending,do you hear that ??,okay now the smut tags...,Anal Sex,Hand Jobs,Oral Sex,Blow Jobs,Intercrural Sex,Barebacking,Rimming,Daddy Kink,Awkward Sexual Situations,Orgasm Control,Light Dom/sub,Lapdance,yes you read right,Frottage,Please check author's notes for more content warnings,Infertility,Phone Sex,Masturbation"
One Direction (Band),Harry Styles/Louis Tomlinson,Harry Styles/Louis Tomlinson,Falling For Me Won't Be A Mistake,M/M,No,Yes,22 Apr 2017,"2,175",Mature,No Archive Warnings Apply,"Mpreg,Alternate Universe - Hospital,Surgeon Harry,Tropical Holiday,Travel,Top Louis,Bottom Harry,safe sex and unprotected sex,Fluff,Angst,Pining,Falling In Love,Cesarean Section,honestly Louis is everything"
One Direction (Band),Harry Styles/Louis Tomlinson,Harry Styles/Louis Tomlinson,Talk like a top take it like a bottom,M/M,No,Yes,27 Dec 2013,"2,174",Explicit,"Creator Chose Not To Use Archive Warnings,Underage","thigh fucking,why isn't that a tag,Bottom Harry,obviously,Daddy Kink,Nipple Play,Cock Tease,Sexual Tension,Dirty Talk,Underage Sex,Underage Harry,16 year old harry,21 year old louis,Plot What Plot/Porn Without Plot,pretty much straight up porn,im sorry,Sexting,Teasing,Anal Fingering,Come as Lube,I Don't Even Know,Overstimulation,harry is a slut,like actually,Dom/sub Undertones,Kinks,Face-Fucking,Facials,Come Shot,this was just an excuse for me to write 16/21 smut tbh,im so sorry,i'm a fuck up forgive me,12k words of FILTH,they dont even kiss,im sorry b ye"
One Direction (Band),Harry Styles/Louis Tomlinson,Harry Styles/Louis Tomlinson,This chemistry like candy to me,M/M,No,Yes,09 Aug 2021,"2,173",Explicit,No Archive Warnings Apply,"Alpha/Beta/Omega Dynamics,Omega Harry Styles,Alpha Louis Tomlinson,Kink Discovery,Lactation Kink,Male Lactation,Mpreg,Pregnant Harry Styles,Self-Lubrication,Knotting,References to Sexism,Fluff and Smut,Shy Harry,Kinda,Light Angst,Mating Cycles/In Heat,Nesting"
One Direction (Band),Harry Styles/Louis Tomlinson,Harry Styles/Louis Tomlinson,"Baby, What a Big Surprise",M/M,No,Yes,02 Apr 2016,"2,170",Explicit,No Archive Warnings Apply,"Mpreg,Mpreg Harry,High School,Unplanned Pregnancy,Teen Pregnancy,Halloween,Angst and Fluff and Smut,Shy Harry,Popular Louis,Cesarean Section,Louis and Liam and Zayn are the same age,Harry and Lottie and Niall are a year younger,I have no idea what sixth form is like so bear with me,Or being pregnant for that matter,Making stuff up is fun,wheee,also harry and louis are 16 and 17 and then 17 and 18 so don't read if that bothers you"
One Direction (Band),Harry Styles/Louis Tomlinson,Harry Styles/Louis Tomlinson,I See Your Colours and I'm Dying of Thirst,M/M,No,Yes,19 Apr 2015,"2,169",Not Rated,No Archive Warnings Apply,"Tattoos,Alternate Universe - Tattoo Parlor,tattoo artist!louis,Tattooed Harry,Tattooed Louis,Smut,Fluff and Smut,Anal Fingering,Riding,Blow Jobs,Painplay,Pain,Harry's Whale Tattoo,Dirty Talk,Top Harry,Bottom Louis"
One Direction (Band),Harry Styles/Louis Tomlinson,Harry Styles/Louis Tomlinson,True Love's Gold,M/M,No,Yes,03 Nov 2016,"2,167",Explicit,No Archive Warnings Apply,"Canon Compliant,Marriage Proposal,a couple of them actually,Engagement,Coming Out,sorta - Freeform,Explicit Sexual Content,Mutual Masturbation,also,Mutual Pining,Established Relationship,one mention of sophiam but otherwise no side relationship,tomlinshaw friendship,Fluff and Smut,Light BDSM,like so so so light,barely there,let's be real this is 25k of harry and louis thinking about how in love they are,and 2k of them telling each other that"
One Direction (Band),Harry Styles/Louis Tomlinson,Harry Styles/Louis Tomlinson,What's Stopping You?,M/M,No,Yes,03 Apr 2017,"2,166",Mature,No Archive Warnings Apply,"Alternate Universe,Roommates,Best Friends,Friends to Lovers,Banter,Pining,Oblivious Louis,a little bit of,Fluff,First Kiss,Dirty Talk,Sexting,Lapdance,Smut,Hand Jobs,Blow Jobs,Anal Sex,Bottom Louis,Top Harry,Multiple Orgasms"
One Direction (Band),Harry Styles/Louis Tomlinson,Harry Styles/Louis Tomlinson,thump thump thump (goes my heart again),M/M,No,Yes,09 Feb 2014,"2,166",Not Rated,Creator Chose Not To Use Archive Warnings,"Alternate Universe - High School,Friends to Lovers,Possessive Behavior,which basically means possessive!harry,Fluff,no smut unless i do a sequel,which will probably happen,what else should i tag,omg um,jay and anne are in it a lot,i forgot louis sisters lmao,i dont even know,its just fluff okay"
One Direction (Band),Harry Styles/Louis Tomlinson,Harry Styles/Louis Tomlinson,The Greatest Thing,M/M,No,Yes,04 Jun 2022,"2,161",Explicit,No Archive Warnings Apply,"Fake/Pretend Relationship,Fake Marriage,(kind of anyway - the marriage is very real,the relationship not so much),accidentally married in vegas,that's not a proper tag but it should be,could also say accidentally LARRIED in Vegas yes please,Enemies to Friends to Lovers,semi canon,Canon Compliant,Sort of anyway,Post-Break Up,of the band anyway,these tags are a mess but what's new eh?,just like old times,POV Harry Styles,Angst,Fluff,Fluff and Angst,Domestic Fluff,I've lost my ability to tag I'm sorry I'll add more as we go along,mild anxiety attack I'd say,Hurt/Comfort,Car Accidents,(not onscreen though),Injury,Happy Ending,It's a fine line between proper tagging and not spoiling too much innit?,message me if you have any questions,the fic is harmless,I pinky promise,also,Blow Jobs,Rimming,Anal Sex,Anal Fingering,Louis Tomlinson Calls Harry Styles Pet Names,i can't believe that's a tag but i love it"
One Direction (Band),Harry Styles/Louis Tomlinson,Harry Styles/Louis Tomlinson,taste on my tongue,M/M,No,Yes,07 Mar 2016,"2,159",Explicit,Creator Chose Not To Use Archive Warnings,"Reality TV,Cooking,Fluff and Smut,Sexual Tension,Anal Sex,Oral Sex,Anal Fingering,very tiny d/s,also some d/s negotation,but its honestly so mild,as for the sex they share that really,Bottom Harry,Bottom Louis"
One Direction,Zayn Malik/Liam Payne,Harry Styles/Louis Tomlinson,Every Little Secret,M/M,No,Yes,05 Jun 2013,"2,158",Explicit,Creator Chose Not To Use Archive Warnings,"mentions of child abuse,graphic descriptions of wounds,Excessive Swearing,Boarding School AU,mentions of Josh Devine/Niall Horan"
One Direction (Band),Harry Styles/Louis Tomlinson,Harry Styles/Louis Tomlinson,The End Should Be A Good One,M/M,No,Yes,02 Feb 2017,"2,156",Mature,No Archive Warnings Apply,"Alternate Universe,Break Up,Angst with a Happy Ending,Exes to Lovers"
One Direction (Band),Harry Styles/Louis Tomlinson,Harry Styles/Louis Tomlinson,"Needing You More and More, Let’s Give Love A Try",M/M,No,Yes,11 Apr 2016,"2,152",Explicit,No Archive Warnings Apply,"Mpreg Harry,Friends to Lovers,Lawyer Louis,Photographer Harry,way too many pregnancy facts and nicknames,Disgusting amounts of fluff,that's pretty much it tbh!,also,Blowjobs,Outdoor Sex,Reverse Cowgirl,Bottom Harry,ALSO the baby isn't louis',and harry is sad for like half a scene,BUT THE REST IS ALL FLUFF AND FALLING IN LOVE,I promise"
One Direction (Band),Harry Styles/Louis Tomlinson,Harry Styles/Louis Tomlinson,It's All Brand New Because of You,M/M,No,Yes,29 Jun 2013,"2,152",Teen And Up Audiences,No Archive Warnings Apply,"Fluff,Alternate Universe,Aquarium AU,(that is a thing okay)"
One Direction (Band),Harry Styles/Louis Tomlinson,Harry Styles/Louis Tomlinson,Hearts Don't Break Around Here,M/M,No,Yes,25 Jul 2017,"2,144",Explicit,Creator Chose Not To Use Archive Warnings,"Dunkirk,Alternate Universe,Actor Harry,Singer Louis,Famous Harry,Famous Louis,Bottom Harry,Top Louis,(because if he were a drag queen he'd be called tommo top dollar),Mutual Crushes,And they didn't even discuss it,No Angst,I even surprised myself,Fluff,fluff and love,Anal Sex,Hand Jobs,Blow Jobs,Lots of Kissing and Larry being cute,Banter,Liam is married to Sophia because I'll never give up"
One Direction (Band),Harry Styles/Louis Tomlinson,Harry Styles/Louis Tomlinson,"watch me apply the pressure, all decked in lace and leather",M/M,No,Yes,09 Feb 2014,"2,230",Explicit,No Archive Warnings Apply,"Yikes,Massage,not the prostate kind sorry,Rimming,so much rimming,what's it called when someone fuck's someone's butt cheeks,i'm gonna call it hot-dogging,Anal Sex,Alternate Universe"
One Direction (Band),Harry Styles/Louis Tomlinson,Harry Styles/Louis Tomlinson,You Got Time,M/M,No,Yes,25 May 2014,"2,224",Explicit,Creator Chose Not To Use Archive Warnings,"Minor Character Death,Original Character Though Not One of the Boys,dad louis,Uni student Harry,Some Fate and Soulmate-y stuff,Angst"
One Direction (Band),Harry Styles/Louis Tomlinson,Harry Styles/Louis Tomlinson,Boyfriend Material,M/M,No,Yes,26 Apr 2018,"2,218",Explicit,No Archive Warnings Apply,"Chef Harry,Slutty Louis,light slut shaming,Cooking Lessons,Top Harry,Bottom Louis,larry stylinson - Freeform"
One Direction (Band),Harry Styles/Louis Tomlinson,Harry Styles/Louis Tomlinson,Jump and I'll Catch You,M/M,No,Yes,24 Nov 2014,"2,213",Explicit,No Archive Warnings Apply,"Vampire AU,Sequel,Vampire Sex,Telepathy,Blood,A lot of sex,Daddy Kink,Daddy Louis,So many endearments,Tied-up Harry,some D/s themes,This is basically just a giant pwp,Felching,Rimming,Coming Untouched,Dirty Talk,soooo much sex"
One Direction (Band),Harry Styles/Louis Tomlinson,Harry Styles/Louis Tomlinson,I Think I’m Addicted to Your Light,M/M,No,Yes,30 Dec 2015,"2,212",Explicit,No Archive Warnings Apply,"New Year's Eve,Office Party,Office Sex,Blow Jobs,Bottom Harry,Harry in Lace,Louis in a tuxedo,idk they meet at a party,This is dumb I'm sorry,Plot What Plot/Porn Without Plot,sorry about liam and niall's roles,harry wears lingerie so if that's not your thing turn away now,ANYWAY I KNOW NEW YEAR'S EVE IS TOMORROW NIGHT BUT,HAPPY NEW YEAR PALS"
One Direction (Band),Harry Styles/Louis Tomlinson,Harry Styles/Louis Tomlinson,Until I Found You,M/M,No,Yes,16 Dec 2018,"2,211",Explicit,Creator Chose Not To Use Archive Warnings,"Alpha/Beta/Omega Dynamics,Alpha Louis,Omega Harry,Mating Cycles/In Heat,Famous Harry,Porn Star Louis,Cam Boy Louis,Enemies to Friends to Lovers,guitar player louis,Lace Panties,Non-Traditional Alpha/Beta/Omega Dynamics,Dildos,Knotting Dildos,Masturbation,Lube,Scenting,Scents & Smells,Dirty Talk,Butt Plugs,Jealousy,Jealous Louis,Jealous Harry,Sex Toys,Songwriting,Flirting,Alpha/Omega,ruts,Sexual Tension,Unresolved Sexual Tension,Smut,Anal Sex,Anal Fingering,Rimming,Love Bites,Making Love,Love Confessions,i guess maybe i should tag this as,Slow Burn,Resolved Sexual Tension,Fluff,Blow Jobs,Happy Ending"
One Direction (Band),Harry Styles/Louis Tomlinson,Harry Styles/Louis Tomlinson,I'd Still Dance With You,M/M,No,Yes,19 Mar 2018,"2,210",Mature,No Archive Warnings Apply,"Alternate Universe,Age Difference,Fluff,Pining,Mutual Pining,Banter,First Kiss,Making Out,Angst,it's really not that much but for me it's a decent amount,Student Harry,Slow Burn,not really they're practically dating the entire fic,Falling In Love,Smut,Anal Sex,Blow Jobs,Hand Jobs,Morning Sex,Happy Ending,Bottom Harry,Top Louis,Barista Harry"
One Direction (Band),Harry Styles/Louis Tomlinson,Harry Styles/Louis Tomlinson,Fall At My Door,M/M,No,Yes,14 Jan 2017,"2,210",Explicit,No Archive Warnings Apply,"Actor Harry,Musician Louis,Smut,Alternate Universe - America,Los Angeles,Las Vegas,New York City,Hotel Sex,Bathroom Sex,Blow Jobs,Anal Sex,Anal Fingering,Miscommunication,Friends With Benefits,a little bit of,Angst,Complete,Famous Louis Tomlinson,Famous Harry Styles"
One Direction (Band),Harry Styles/Louis Tomlinson,Harry Styles/Louis Tomlinson,Beyond The Point Of Weird,M/M,No,Yes,24 Feb 2016,"2,209",Mature,No Archive Warnings Apply,"Fluff,lots of fluff,Louis-centric,kind of,harry gets his moments too,they both cry sometimes,But mostly fluff,uni!Louis,Ex-Rockstar!Harry,Bottom Louis,Top Harry,Smut,Fluff and Smut,all sexy/triggery tags inside due to there being too many,pretending to date,Fake/Pretend Relationship,20-Year-Old Louis,29-Year-Old Harry,Complete"
One Direction (Band),Harry Styles/Louis Tomlinson,Harry Styles/Louis Tomlinson,'Til I Tasted You,M/M,No,Yes,28 Mar 2017,"2,205",Mature,No Archive Warnings Apply,"Famous Harry,Non-Famous Louis,Cooking,Baking,Tumblr,Alternate Universe - College/University,Mutual Pining,Masturbation,Kissing,Strangers to Lovers,Fluff"
One Direction (Band),Harry Styles/Louis Tomlinson,Harry Styles/Louis Tomlinson,"the whole world, it is sleeping (but my world is you)",M/M,No,Yes,03 Sep 2013,"2,199",Mature,Creator Chose Not To Use Archive Warnings,"x factor era,x factor fic,au but not au,Blind!Harry,Blind Character,Smut,Angst,Friends to Lovers,basically it's the harry/louis story as we know it except harry is blind you see,which changes things,just a tad"
One Direction (Band),Harry Styles/Louis Tomlinson,Harry Styles/Louis Tomlinson,You're Writing Verses About Me,M/M,No,Yes,20 Jun 2016,"2,198",Teen And Up Audiences,No Archive Warnings Apply,"Uni AU,Fake/Pretend Relationship,Roommates,Louis makes dumb decisions,harry is a romantic,What else is new?,Louis' in quite the perdicament,Harry just wants to fall in love,these tags tho,One Shot"
One Direction (Band),Harry Styles/Louis Tomlinson,Harry Styles/Louis Tomlinson,did the sun just come out (or did you smile at me),M/M,No,Yes,13 May 2013,"2,197",General Audiences,Creator Chose Not To Use Archive Warnings,"they're cats,That's it"
One Direction (Band),Harry Styles/Louis Tomlinson,Harry Styles/Louis Tomlinson,Fate Don't Know You,M/M,No,Yes,09 Dec 2018,"2,196",Mature,Creator Chose Not To Use Archive Warnings,"Alternate Universe - Student/Teacher,High School,Bad Boy Harry (Sort of),Teacher Louis,American AU,Love/Hate,Friends to Lovers,Minor Character Death,Angst,Hurt/Comfort,Threats,description of violence,Fluff,Kissing,Smut (eventually),Love,Happy Ending"
One Direction (Band),Harry Styles/Louis Tomlinson,Harry Styles/Louis Tomlinson,sing me like a choir,M/M,No,Yes,09 Nov 2015,"2,196",Not Rated,No Archive Warnings Apply,"YouTube,Established Relationship,Coming Out,Boyfriend Tag,Anal Sex,Riding,blowjob,Face Fucking (a bit),Bottom!Harry,bottom!Louis,Top!Harry,top!Louis,Makeup,i honestly have no idea what this is about"
One Direction (Band),Harry Styles/Louis Tomlinson,Harry Styles/Louis Tomlinson,say you want me,M/M,No,Yes,08 Aug 2016,"2,194",Mature,No Archive Warnings Apply,"Alternate Universe: Famous/Not Famous,Twitter,Closeted Character,Coming Out,Famous Harry,Non-Famous Louis,Fluff and Angst,strangers to enemies to friends to lovers,slight homophobia,Panic Attacks,Implied Smut"
One Direction (Band),Harry Styles/Louis Tomlinson,Harry Styles/Louis Tomlinson,Take me down with you,M/M,No,Yes,30 Jul 2015,"2,191",Mature,No Archive Warnings Apply,"I won't put too many because spoilers,Fluff and Angst,Fluff,Smut,Depression,Suicide Attempt,Suicide,Louis Has An Eating Disorder,it's funny I promise,Funny,Bottom Louis,I have no excuse for this,Top Harry,Manhandling,Angst and Fluff and Smut,Supernatural Elements,that's all I can say about that,Blow Jobs,Louis-centric,Insecure Louis,Sad Louis,but he's funny still,Anal Sex,Sexual Tension,Explicit Sexual Content,Falling In Love,Social Anxiety,Alternate Universe - College/University,Self-Acceptance,Self-Esteem Issues,Self-Destruction,Self-Hatred,Implied/Referenced Self-Harm,Public Blow Jobs,Public Display of Affection,Surprise Ending,versatile,Alternate Universe - Dark,Dark"
One Direction (Band),Harry Styles/Louis Tomlinson,Harry Styles/Louis Tomlinson,I Know How To Whisk (But Teach Me Anyway),M/M,No,Yes,27 Aug 2018,"2,187",Mature,Creator Chose Not To Use Archive Warnings,"Alpha/Beta/Omega Dynamics,Alpha Harry,Omega Louis,Beta Niall,Alpha Liam,Omega Zayn,Strangers to Lovers,Mating Cycles/In Heat,Bonding,Soulmates,Fluff,New York City,Baking"
One Direction (Band),Harry Styles/Louis Tomlinson,Harry Styles/Louis Tomlinson,we wreak havoc with our hearts,M/M,No,Yes,14 Jun 2014,"2,186",Explicit,No Archive Warnings Apply,"Canon Compliant,Friends to Lovers,Friends With Benefits,Developing Relationship,Porn with Feelings,Oral Sex,Rough Oral Sex,Choking,Rimming,Anal Fingering,Anal Sex,Face-Fucking,Pining"
One Direction (Band),Harry Styles/Louis Tomlinson,Harry Styles/Louis Tomlinson,I Wanna Be More Than Friends,M/M,No,Yes,17 Sep 2018,"2,182",Not Rated,No Archive Warnings Apply,"Alpha/Beta/Omega Dynamics,Alpha Harry,Omega Louis,Alpha Liam,Beta Niall,Mating Cycles/In Heat,Accidental Bonding,Friends to Lovers,Fluff,Childhood Friends,sense of smell,which Harry is missing,Platonic Cuddling,lose the platonic"
One Direction (Band),Harry Styles/Louis Tomlinson,Harry Styles/Louis Tomlinson,This Thing Upon Me (howls like a beast),M/M,No,Yes,25 Oct 2017,"2,268",Explicit,No Archive Warnings Apply,"Alpha/Beta/Omega Dynamics,Mating Cycles/In Heat,Knotting,Pregnancy Kink,Blow Jobs,Semi-Public Sex,First Time,Alternate Universe - College/University,Rimming,Feminization,Alpha Louis,Omega Harry,Jealousy,Riding,Dirty Talk,Oral Knotting"
One Direction (Band),Harry Styles/Louis Tomlinson,Harry Styles/Louis Tomlinson,Luscious blood,M/M,No,Yes,12 Dec 2016,"2,265",Mature,"Creator Chose Not To Use Archive Warnings,Graphic Depictions Of Violence,Underage","Vampire Harry,Human Louis,Alternate Universe - Vampire,Blood Drinking,Biting,Bonding,Gay Sex,Anal Sex,Anal Fingering,Blow Jobs,First Time,First Kiss,Love,Falling In Love,Love/Hate,Possessive Behavior,Rimming,Light BDSM,Alternate Universe - Soulmates,Alcohol,Mpreg Louis,Top Harry,Bottom Louis,Sassy Louis,Smart Louis,Half-Sibling Incest,Other Additional Tags to Be Added,Nouis,because they're best friends,Implied/Referenced Rape/Non-con,Louis isn't the one though"
One Direction (Band),Harry Styles/Louis Tomlinson,Harry Styles/Louis Tomlinson,Rated R,M/M,No,Yes,05 Jun 2016,"2,259",Explicit,No Archive Warnings Apply,"Sex Tape,Masturbation,Anal Sex,Established Relationship,Christmas"
One Direction (Band),Harry Styles/Louis Tomlinson,Harry Styles/Louis Tomlinson,You Could Have Moonlight in Your Hands,M/M,No,Yes,30 May 2016,"2,258",Explicit,No Archive Warnings Apply,"Famous Harry,Non-Famous Louis,Explicit Sexual Content,Bottom Louis,Blow Jobs,Anal Fingering"
One Direction (Band),Harry Styles/Original Male Character(s),Harry Styles/Louis Tomlinson,You Might Want to Marry My Husband,M/M,No,Yes,21 Oct 2017,"2,257",Not Rated,Creator Chose Not To Use Archive Warnings,"Minor Character Death (None of the boys),Friends to Lovers,Moving On,Angel/Death jokes,emotional support/comfort"
One Direction (Band),Harry Styles/Louis Tomlinson,Harry Styles/Louis Tomlinson,just a memory (and all that we could've been),M/M,No,Yes,27 Nov 2012,"2,257",Explicit,No Archive Warnings Apply,"Amnesia,Alternate Reality"
One Direction (Band),Harry Styles/Louis Tomlinson,Harry Styles/Louis Tomlinson,Strawberries & Cigarettes,M/M,No,Yes,14 Feb 2019,"2,256",Explicit,No Archive Warnings Apply,"Alpha/Beta/Omega Dynamics,Coming of Age,High School,Nerd Harry,Punk Louis,Artist Louis,Alpha Harry,Omega Louis,Alpha Niall,First Time,Rich Harry,Knotting,Mating Cycles/In Heat,Alpha/Omega,Mating,Mating Bond,Marking,Scent Marking,Scenting,Scents & Smells,Fluff and Angst,Friends to Lovers,Secret Relationship,Forbidden Love,Young Love,Daddy Issues,Self-Lubrication,Anal Sex,Rimming,Smut,Hand Jobs,Jealous Louis,Love Confessions,Falling In Love,Protective Harry,They're American in this,Exes,Exes to Lovers,Post-Break Up,CEO Harry,Unresolved Tension,Blow Jobs,Tattoos,Jealous Harry,Oral Knotting,Minor Character Death,it's just mentions of it,and it doesn't get explicit,Domestic Fluff,Angst with a Happy Ending,Time Jump,Miscommunication,very mild,Breeding Kink,Implied Mpreg,Mpreg,Mpreg Louis,the mpreg stuff takes place after the story ends in the time stamps just FYI,MPREG SEX"
One Direction (Band),Harry Styles/Louis Tomlinson,Harry Styles/Louis Tomlinson,picking up the pieces,M/M,No,Yes,30 May 2021,"2,254",Explicit,No Archive Warnings Apply,"Alpha/Beta/Omega Dynamics,Alpha Harry,Omega Louis,Fake/Pretend Relationship,(that is not hl),Childhood Friends,Mutual Pining,Misunderstandings,Hurt/Comfort,Demisexual Louis,Touch Deprivation,omega drop,Nesting,Courting Rituals,Explicit Sexual Content,Mating Cycles/In Heat,Top Harry,Bottom Louis"
One Direction (Band),Harry Styles/Louis Tomlinson,Harry Styles/Louis Tomlinson,"You and Me, We Run Like Ink (Though I'll Never Run Away)",M/M,No,Yes,03 Sep 2014,"2,253",General Audiences,No Archive Warnings Apply,"Fluff,Marriage Proposal,Proposal!AU,proposal,Cute,larry - Freeform,larry stylinson - Freeform,The X Factor Era,Romance,Fluffy,Drabble,One Shot"
One Direction (Band),Harry Styles/Louis Tomlinson,Harry Styles/Louis Tomlinson,set alight my veins,M/M,No,Yes,24 Jul 2013,"2,253",Mature,No Archive Warnings Apply,very background ziam
One Direction (Band),Harry Styles/Louis Tomlinson,Harry Styles/Louis Tomlinson,you came into my life,M/M,No,Yes,19 Jun 2018,"2,250",Mature,No Archive Warnings Apply,"American AU,queer eye AU,Alternate Universe - Firefighters,Closeted Character,Coming Out,Pining,Flirting,Fluff and Angst,mentions throughout of Jay's passing,Implied/Referenced Homophobia,tomlinshaw friendship,Liam Payne/Cheryl Cole - Freeform,Niall Horan/Hailee Steinfeld - Freeform,bebe rexha - Freeform,Niall Breslin - Freeform,Aimee Phillips - Freeform,Bobby Berk - Freeform,ben winston - Freeform,a truly excessive amount of blushing,sexually charged yoga,Masturbation,Eventual Smut,Slow Dancing,Boys Kissing,Dirty Talk,Hand Jobs,Brief comeplay,Harry in Panties"
One Direction (Band),Harry Styles/Louis Tomlinson,Harry Styles/Louis Tomlinson,speak now or forever hold your peace,M/M,No,Yes,19 Sep 2015,"2,244",Explicit,No Archive Warnings Apply,"Alternate Universe,Childhood Friends,Friends to Lovers,Bottom Harry,Top Louis,Weddings,Angst,Smut,Fluff,Alternate Universe - High School,Alternate Universe - College/University"
One Direction (Band),Harry Styles/Louis Tomlinson,Harry Styles/Louis Tomlinson,"I Could, But Wouldn't Stay",M/M,No,Yes,30 Jul 2021,"2,243",Not Rated,Creator Chose Not To Use Archive Warnings,"mafia,Organized Crime,Alpha/Beta/Omega Dynamics,Omega Louis,Alpha Harry,Omega Niall,Alpha Zayn Malik,Alpha Liam Payne,Dark,Spanking,Gangs,Power Dynamics,Domestic Violence,Dubious Consent,Mildly Dubious Consent,Implied/Referenced Child Abuse,Bottom Louis,Top Harry,Innocent Louis,Shy Louis Tomlinson,Hurt Louis,Age Difference,Blow Jobs,Hand Jobs,Lack of Communication,Blood,Dom/sub Undertones,Mob Boss Harry,Sad Louis Tomlinson,Praise Kink,Daddy Kink,Kidnapping,Happy Ending,Disclaimer: harry is mental,Pseudo-Incest,Unhealthy Relationships,Consensual Underage Sex,Underage Sex"
One Direction (Band),Harry Styles/Louis Tomlinson,Harry Styles/Louis Tomlinson,Drawn to You,M/M,No,Yes,24 Mar 2016,"2,243",Not Rated,Creator Chose Not To Use Archive Warnings,"Soulmate AU,complete fluff basically,and that's pretty much what it comes down to,Alternate Universe,Alternate Universe - Soulmates,Soulmates,Fluff"
One Direction (Band),Harry Styles/Louis Tomlinson,Harry Styles/Louis Tomlinson,Bravery,M/M,No,Yes,28 Oct 2013,"2,238",Teen And Up Audiences,No Archive Warnings Apply,"Canon Compliant,Friendship,Fluff,Coming Out,Harry and Louis being super domestic and adorable,Niall is a badass"
One Direction (Band),Harry Styles/Louis Tomlinson,Harry Styles/Louis Tomlinson,as long as skies are blue,M/M,No,Yes,13 Dec 2014,"2,237",Explicit,Creator Chose Not To Use Archive Warnings,"Alternate Universe - Summer Camp,Strangers to Lovers,Smut,a bit of angst and a bit of fluff because otherwise the fic wouldn't be complete,Rimming,Public Blow Jobs,there's also pining"
