fandom,relationship,taggedRel,title,relType,isCanon,isRPF,datetime,kudos,rating,warnings,tags
One Direction (Band),Harry Styles/Louis Tomlinson,Harry Styles/Louis Tomlinson,tell it like an old song,M/M,No,Yes,12 Jun 2020,"1,760",Explicit,Creator Chose Not To Use Archive Warnings,"Amnesia,Memory Loss,Jealousy,Possessive Behavior,Alpha/Beta/Omega Dynamics,Non-Traditional Alpha/Beta/Omega Dynamics,Bottom Louis,Comeplay,Praise Kink,Scent Marking,Mpreg,Additional Warnings In Author's Note,Breeding Kink,Alpha Harry,Alpha Louis Tomlinson"
One Direction (Band),Harry Styles/Louis Tomlinson,Harry Styles/Louis Tomlinson,let me carry your weight,M/M,No,Yes,01 Jun 2020,"1,760",Explicit,"Creator Chose Not To Use Archive Warnings,No Archive Warnings Apply","Trainer Harry,Insecure Louis,Top Harry,Bottom Louis,slight size kink,Strong Harry,Slight Voyeurism,If You Squint - Freeform,Friends With Benefits,kind of,Anal Sex,Anal Fingering,Rimming,Manhandling,Rough Sex,could be rougher but I'm too soft sorry,Light Spanking,Hand Jobs,Overstimulation,Masturbation,Smut,creative workout ideas!,I've never been to a gym in my life,so I'm sorry if anything is inaccurate,Some angst,Oh and Also,Pining,Light Choking,sauna sex,Body Positivity,Body Worship,body image issues,Flexible Louis,barbell is my new least favorite word,showering together,shower scenes,I can't stop with the bathing I'm sorry can you tell it's a thing for me,there is one scene of,Unsafe Sex,that is not discussed beforehand!!!"
Larry Stylinson - Fandom,Harry Styles/Louis Tomlinson,Harry Styles/Louis Tomlinson,Frame of Hearts,M/M,No,Yes,18 Dec 2014,"1,760",Mature,Graphic Depictions Of Violence,"Domestic!Louis,Domestic!Harry,Friends to Lovers,Childhood Sweethearts,Angst,Anxiety,Disorders,OCPD,8!Louis,7!Harry,Family Abuse,Self Harming,Eating Disorder,Obsessive Compulsive Personality Disorder,Animal Death,There is a mention of underage with Liam,It's only a sentence,So not a massive part of the fic,By underage I mean under 16 as that's Australian law,I follow my country's law lmao,Happy Ending"
One Direction (Band),Harry Styles/Louis Tomlinson,Harry Styles/Louis Tomlinson,six feet beneath the moon,M/M,No,Yes,11 Nov 2013,"1,759",Not Rated,Creator Chose Not To Use Archive Warnings,"New Year's Eve,First Kiss"
One Direction (Band),Harry Styles/Louis Tomlinson,Harry Styles/Louis Tomlinson,It's All Brand New,M/M,No,Yes,22 Jul 2014,"1,811",Teen And Up Audiences,No Archive Warnings Apply,"Alternate Universe - College/University,Famous Louis,Non-Famous Harry,Football Player Louis,University Student Harry,harry’s not an English major :O,I really like italics ok,greg horan is my favorite and he is the best boss ever"
One Direction (Band),Harry Styles/Louis Tomlinson,Harry Styles/Louis Tomlinson,Just What The Doctor Ordered,M/M,No,Yes,26 Jun 2013,"1,809",Explicit,Underage,"larry au,Alternate Universe,older! harry,Older Man/Younger Man,younger! louis,Bottom Louis,Top Harry,Riding,Doctor/Patient,doctor! harry,patient! louis,handjob,seductive? louis,Smut,larry smut,louis riding harry,harry/louis - Freeform,Anal Fingering,Oral Sex"
One Direction (Band),Harry Styles/Louis Tomlinson,Harry Styles/Louis Tomlinson,Until,M/M,No,Yes,12 May 2020,"1,807",Explicit,No Archive Warnings Apply,"Famous Harry,Non-Famous Louis Tomlinson,Actor Harry Styles,Songwriter Louis Tomlinson,Colorado,Cowboy Harry Styles,Cowboy Harry,Cowboy Hats,Horses,Enemies to Lovers,Hate to Love,Alcohol,Song Lyrics,Songfic,heartbreak weather,Only the Brave - Freeform,Pop Star Niall Horan,side shiall,Goats,Humor,Mountains,Light Angst,Alternate Universe - Farm/Ranch,Guitars,Smut,Anal Fingering,Hand Jobs,Riding,Anal Sex,Horseback Riding,POV Louis Tomlinson,Epilogue,Epilogue in Harry's pov,Music,Art,Outdoor Sex,Alternate Universe - Neighbors"
One Direction (Band),Harry Styles/Louis Tomlinson,Harry Styles/Louis Tomlinson,Where Do We Go Now,M/M,No,Yes,21 Feb 2018,"1,805",Explicit,Creator Chose Not To Use Archive Warnings,"Alpha/Beta/Omega Dynamics,Alpha Harry,Omega Louis,Knotting,Students,and the were roommates,omg they were roommates,Alternate Universe - College/University,Mating Cycles/In Heat,Hate to Love"
One Direction (Band),Harry Styles/Louis Tomlinson,Harry Styles/Louis Tomlinson,Back to the Beginning,M/M,No,Yes,26 Jul 2015,"1,804",General Audiences,Creator Chose Not To Use Archive Warnings,"Fluff,Alternate Universe,Prequel,Bullying,Football | Soccer,First Dates,Mpreg,Teen Pregnancy,Kid Fic,Marriage Proposal,Weddings,Famous Louis,Baker Harry,Deaf Character,Minor Character Death,Protective Louis,Sign Language,Pregnant Harry,Mild Smut,Angst"
One Direction (Band),Harry Styles/Louis Tomlinson,Harry Styles/Louis Tomlinson,How's About We Make a Baby?,M/M,No,Yes,24 Dec 2014,"1,803",Mature,No Archive Warnings Apply,"Mpreg Louis,Yes that is correct,Mpreg,Fluff,Tooth-Rotting Fluff,Comfort/Angst,Fluff and Smut,Lots of not-so-hidden social commentary on the state of the fandom..."
One Direction (Band),Harry Styles/Louis Tomlinson,Harry Styles/Louis Tomlinson,"always an angel, never a god",M/M,No,Yes,25 Sep 2023,"1,801",Explicit,Creator Chose Not To Use Archive Warnings,"Friends With Benefits,Jealousy,Fashion Designer Louis Tomlinson,Pining,Lies,So many lies,Morally Ambiguous Character,But the funny kind,Humor,Possessive Behavior,Rumors,Inspired by Gossip Girl,Barebacking"
One Direction (Band),Harry Styles/Louis Tomlinson,Harry Styles/Louis Tomlinson,Watching The World Fall,M/M,No,Yes,17 Jan 2020,"1,799",Explicit,No Archive Warnings Apply,"Explicit Sexual Content,Alternate Universe,Late Late Live Tinder,Post Break-up"
One Direction (Band),Harry Styles/Louis Tomlinson,Harry Styles/Louis Tomlinson,No Turbulence Please,M/M,No,Yes,03 Aug 2015,"1,797",Explicit,No Archive Warnings Apply,"Friends to Lovers,Alpha/Beta/Omega Dynamics,Rutting,Knotting,Unrealistic Sex,Airplane Sex,Mile High Club,Famous Harry,Pregnancy Kink,Plot What Plot/Porn Without Plot,Top Harry,Bottom Louis"
One Direction,Harry Styles/Louis Tomlinson,Harry Styles/Louis Tomlinson,Breathe Me,M/M,No,Yes,16 Jun 2018,"1,797",Mature,"Creator Chose Not To Use Archive Warnings,Underage","Omega Louis,Alpha Harry,Beta Liam,Beta Niall,Alpha Zayn,Omega Perrie,Alpha/Beta/Omega Dynamics,larry stylinson - Freeform,Self-Harming Louis,eating disorder Louis,anorexic louis,Bulimic Louis,Insecure Louis,Sad Louis,Innocent Louis,Protective Harry,Dominant Harry,Possessive Harry,If Easily Triggered Please Don't Read!,Bullied Louis,Aggressive Harry,Omega Gemma"
One Direction (Band),Harry Styles/Louis Tomlinson,Harry Styles/Louis Tomlinson,A Long Way From The Playground,M/M,No,Yes,05 Dec 2020,"1,796",Not Rated,Creator Chose Not To Use Archive Warnings,"Heartbreak,Breakups,Pining,Crying Harry,Desperate Louis,Mpreg Harry,Kids,Secret Child,Unplanned Pregnancy,Secrets,Hiatus,Reunion,Famous One Direction,One Direction reunion tour,Pregnant Harry Styles,Breakup,secret kids,Twins,Louis and Eleanor,but not really,youll just have to wait and see,Original Styles-Tomlinson Child(ren) - Freeform,Homophobic Language,Smut,Top Louis,louis toplinson,Bottom Harry,Harry in Panties,long fic,Past Relationship(s),Crying,Endgame Larry,Finished,Post-Traumatic Stress Disorder - PTSD,Nightmares,Trauma"
One Direction (Band),Harry Styles/Louis Tomlinson,Harry Styles/Louis Tomlinson,Your Silhouette Over Me,M/M,No,Yes,08 Jul 2015,"1,790",Explicit,Creator Chose Not To Use Archive Warnings,"Smut,Oral Sex,Rimming,Felching,Blow Jobs,Anal Sex,Anal Fingering,Ass Play,Lingerie,Harry in Panties,Gay Bar,Top Harry,Bottom Louis,Body Shots"
One Direction (Band),Harry Styles/Louis Tomlinson,Harry Styles/Louis Tomlinson,"Love, Ever After",M/M,No,Yes,17 May 2021,"1,787",Explicit,No Archive Warnings Apply,"Alpha/Beta/Omega Dynamics,ABO,Alpha Harry Styles,Omega Louis Tomlinson,Farmer Harry Styles,Dating Agency Owner Louis Tomlinson,Dating,blind dates,Heats,ruts,Knotting,Anal Sex,Blow Jobs,Soulmates,Pining,Miscommunication,Idiots in Love,Fluff,Banter,Romance,hangovers,Harry's Girls,(of the bovine kind - they're cows - it's fiiiiine),Pool,Darts,Beer,pubs,Top Harry Styles,Bottom Louis Tomlinson,Matchmaking,Barebacking,farmers markets"
One Direction (Band),Harry Styles/Louis Tomlinson,Harry Styles/Louis Tomlinson,American Rose,M/M,No,Yes,16 Oct 2015,"1,787",Mature,Creator Chose Not To Use Archive Warnings,"Alternate Universe,Synesthesia,Internalized Homophobia,Broken Harry,Scared Louis,Harry hears in colors,Love Confessions,Friends to Lovers,Louis broke Harry's heart years ago,Bottom Louis,First Time,Fluff and Angst,First Kiss,Protectiveness,Cuddling & Snuggling,Emotional Hurt/Comfort,Verbal Abuse"
One Direction (Band),Harry Styles/Louis Tomlinson,Harry Styles/Louis Tomlinson,can i be him?,M/M,No,Yes,22 Aug 2017,"1,786",Mature,No Archive Warnings Apply,"YouTube,YouTuber Harry,Soulmates,Soulmate-Identifying Marks,Alternate Universe - Soulmates,Coming Out,University Student Louis,Disney References,Harry Potter References,this fic is ridiculous please read it,Playlist Live,Photographer Harry,Teacher Louis,Niall and Liam are those awful youtubers everyone hates,Harry is a sweetheart,Louis hates the internet"
One Direction (Band),Harry Styles/Louis Tomlinson,Harry Styles/Louis Tomlinson,a runaway american dream,M/M,No,Yes,17 Mar 2013,"1,786",Not Rated,Creator Chose Not To Use Archive Warnings,
One Direction (Band),Harry Styles/Louis Tomlinson,Harry Styles/Louis Tomlinson,Player,M/M,No,Yes,18 Oct 2021,"1,785",Explicit,No Archive Warnings Apply,"famous/non-famous,tennis player harry,publicist louis,Personal assistant Niall,Physiotherapist Liam,Nurse Zayn,Himbo Harry,Highly Strung Louis,Sassy Louis,Harry likes to tease Louis,Revealing Instagram Posts,Dick Pics,Recovery From Surgery,but no medical procedures or anything like that,Mutual Pining,Flirting,Masturbation,Anal Sex,Top Harry,Bottom Louis"
One Direction (Band),Harry Styles/Louis Tomlinson,Harry Styles/Louis Tomlinson,kiwi,M/M,No,Yes,08 Nov 2017,"1,783",Not Rated,Creator Chose Not To Use Archive Warnings,"Recreational Drug Use,Explicit Sexual Content,a fuckload of terrible kiwi and hs1 references prepare yourselves,Jealousy,Pining,ALL THE GOOD STUFF"
One Direction (Band),Harry Styles/Louis Tomlinson,Harry Styles/Louis Tomlinson,Such Good Luck,M/M,No,Yes,07 Aug 2017,"1,783",Explicit,No Archive Warnings Apply,"Alternate Universe - Historical,Alternate Universe - Edwardian,Alternate Universe - 1910s,Mpreg,Mpreg Louis,Established Relationship,Secret Relationship,Class Difference,everything is consensual within the class difference,Fluff,Smut,Anal Fingering,Anal Sex,Rimming,Angst,Angst with a Happy Ending"
One Direction (Band),Harry Styles/Louis Tomlinson,Harry Styles/Louis Tomlinson,Spoiled Brat,M/M,No,Yes,12 Jan 2014,"1,783",Explicit,Creator Chose Not To Use Archive Warnings,"Anal Sex,Spanking,Rough Sex,Daddy Kink,Sugar Daddy,Dirty Talk,sugardaddy!Harry,SugarBaby!Louis,Louis gets spanked and fucked on his daddy Harry's Desk,I Don't Even Know,I don't have the energy to edit so I will later maybe,Enjoy my mess,Harry's using a carpenter's ruler by the way.,UPDATING MY FUCKING TAGS BECAUSE I'M NOT DEALING WITH ANGRY FUCKING PEOPLE,VERY VERY VERY ROUGH SEX,Dom/sub,Violence,Fuck all of you who made me feel like shit,And I hope all of you who liked this get a cookie from a cute human"
One Direction (Band),Harry Styles/Louis Tomlinson,Harry Styles/Louis Tomlinson,Better Mistakes,M/M,No,Yes,01 Aug 2021,"1,837",Explicit,No Archive Warnings Apply,"Enemies to Lovers,Hate to Love,Mpreg,Mpreg Louis,Pregnant Louis Tomlinson,Unplanned Pregnancy,Pregnant Sex,Anal Sex,Wall Sex,Shameless Smut,Cheating,Blow Jobs,Smut,Angst,Happy Ending,Pining,Denial of Feelings,Falling In Love,Affairs,Endgame Harry Styles/Louis Tomlinson,Chaptered,Jealousy,Threats of Violence,theyre minor but still there,Protective Harry,Sassy Louis Tomlinson,Slow Burn,Mutual Pining"
One Direction (Band),Harry Styles/Louis Tomlinson,Harry Styles/Louis Tomlinson,Give It Up To Me,M/M,No,Yes,18 Apr 2014,"1,837",Explicit,No Archive Warnings Apply,"Daddy Kink,Sugar Daddy,Nipple Play,Toys,Spanking,Exhibitionism,Dirty Talk,Orgasm Delay/Denial,Overstimulation,Rimming,Felching,Riding,Blow Jobs,Anal Fingering,Anal Sex,Face-Sitting,That tag looks horrendous oh god,Dom/sub,Smut,Bottom Louis,Sub Louis"
One Direction (Band),Harry Styles/Louis Tomlinson,Harry Styles/Louis Tomlinson,A Taste of Desire,M/M,No,Yes,24 Apr 2018,"1,835",Explicit,Graphic Depictions Of Violence,"Alternate Universe - Historical,Alternate Universe - Victorian,Alternate Universe - 19th Century,Alternate Universe - Industrial Revolution,Alpha/Beta/Omega Dynamics,ABO society based on equality and consent,Alpha Harry,Omega Louis,Knotting,Mating Bond,Mating Cycles/In Heat,Mill Owner Harry,Social Activist Louis,Fluff,Slow Burn,Smut,Anal Fingering,Anal Sex,Angst,Major Character Injury,minor character injury,Fire"
One Direction (Band),Harry Styles/Louis Tomlinson,Harry Styles/Louis Tomlinson,When Tomorrow Comes,M/M,No,Yes,03 Jun 2020,"1,832",Explicit,No Archive Warnings Apply,"Alpha/Beta/Omega Dynamics,Alpha Harry,Omega Louis,Beta Niall,Scenting,Nesting,Bonding,Mating,Mating Bites,bondmates,Mpreg,Pups,Fluff,Comfort,Explicit Sexual Content,Top Harry,Bottom Louis"
One Direction (Band),Harry Styles/Louis Tomlinson,Harry Styles/Louis Tomlinson,going nowhere fast,M/M,No,Yes,06 Jun 2013,"1,830",Not Rated,Creator Chose Not To Use Archive Warnings,
One Direction (Band),Harry Styles/Louis Tomlinson,Harry Styles/Louis Tomlinson,hit me with your sweet love,M/M,No,Yes,06 May 2020,"1,829",Explicit,Creator Chose Not To Use Archive Warnings,"Alpha/Beta/Omega Dynamics,Omega Louis,Alpha Harry,Powerful Harry,Rich Harry,Sugar Baby Louis Tomlinson,Anal Sex,Scent Marking,Soulmates,Praise Kink,Comeplay,Infidelity,Additional Warnings In Author's Note,Feminization,Miscommunication"
One Direction (Band),Harry Styles/Louis Tomlinson,Harry Styles/Louis Tomlinson,In plain sight,M/M,No,Yes,26 Jul 2015,"1,829",Not Rated,Creator Chose Not To Use Archive Warnings,"Eating Disorders,Anorexia,Insecure Louis,Depressed Louis,Triggers,Self-Hatred,Self-Harm,Feeding,Sad Louis,Depression,Worried Harry,Body Image,Angst and Hurt/Comfort,Angst,Possibly Triggering,Don't Like Don't Read,Could be triggering,Louis-centric,Hurt Louis,Hurt/Comfort,Falling In Love,Friends to Lovers,Bulimia,Secrets,Insecure Harry,Insecurity,I won't give everything away with the tags,Everything will make sense"
One Direction (Band),Harry Styles/Louis Tomlinson,Harry Styles/Louis Tomlinson,i carry your heart with me (i carry it in my heart),M/M,No,Yes,12 May 2017,"1,827",Explicit,No Archive Warnings Apply,"Angst,Hurt/Comfort,Fluff,Drama,Miscommunication,Anal Sex,Bottom Louis,Alternate Universe - Modern Setting,Romance"
One Direction (Band),Harry Styles/Louis Tomlinson,Harry Styles/Louis Tomlinson,Under the lights tonight,M/M,No,Yes,30 Jul 2015,"1,826",Mature,Creator Chose Not To Use Archive Warnings,"Established Relationship,Anal Sex,Fluff,Rimming,Alternate Universe - Modern Setting"
One Direction (Band),Harry Styles/Louis Tomlinson,Harry Styles/Louis Tomlinson,in that bright white noise,M/M,No,Yes,14 Jan 2014,"1,826",Explicit,Creator Chose Not To Use Archive Warnings,"Alternate Universe - College/University,Bonfires,Intoxication,Fluff,Felching,Anal Sex,Anal Fingering,Blind Date,Friendship,Flirting,Unsafe Sex"
One Direction (Band),Harry Styles/Louis Tomlinson,Harry Styles/Louis Tomlinson,Liberté,M/M,No,Yes,02 May 2016,"1,824",Mature,No Archive Warnings Apply,"Alternate Universe - Pirate,always wanted to tag that,Hate to Love,Prince Louis,pirate ot4,Mentions of Blood,Bottom Louis,Top Harry,Sailing,17th Century,a.k.a the golden age of piracy,Mention of Arranged Marriage,Dark Harry,Famous Harry,Pirate Harry,Historical References,Fluff,Angst,Unresolved Sexual Tension,Secret Identity,Frottage,Drug Addiction,side Ziam"
One Direction (Band),Harry Styles/Louis Tomlinson,Harry Styles/Louis Tomlinson,Weigh Us Down (We're In Love),M/M,No,Yes,02 Jul 2014,"1,823",Mature,No Archive Warnings Apply,"Growing Up Together,Alternate Universe - College/University,Alternate Universe - High School,Mpreg,Mpreg Harry,Blow Jobs,Anal Sex,Body Worship,(but just a bit of the body worship),Fluff,(so much fluff i'm puking glitter over the shoes harry wore to snl),Bottom Harry,Top Louis,Pregnant Sex"
One Direction (Band),Harry Styles/Louis Tomlinson,Harry Styles/Louis Tomlinson,House of The Rising Sun,M/M,No,Yes,10 Jan 2022,"1,820",Mature,Graphic Depictions Of Violence,"New Orleans,Witches,Vampires,Werewolves,Demons,Alternate Universe,Alternate Universe - Fantasy,Murder,Death Rituals,Dark Magic,Louisiana Voodoo vibe,Voodoo,Slowburn -ish,Vampires rule New Orleans,Witches are feisty,Witch!harry,vampire!Louis,werewolf!liam,witch!niall,VampireKing!Zayn,Hierarchy,Cities of the dead,Not exactly enemies to lovers but their species are sworn enemies you know?,Ritual Sacrifice,Eventual Smut,happy ending obviously,I can't write/ read non-happy endings sorry,Investigation,Magic,spells,Compulsion,because vampires love their compulsion tricks,I added the tag for major character death but again - Happy ending I promise!,Marie Laveau - Freeform,Voodoo Queen,Voodoo Princesses,Bayou Wolves,Cemetery Witches,French Quarter Vampires,French Quarter,Friends With Benefits - kind of,Pining,Protective!Louis,protective!zayn,Vampires be territorial,Harvest Boys,Familiars,OT5 Friendship (One Direction),Violence,Blood and Gore,Death,Minor Niall Horan/Original Female Character(s),Zayn Malik/ Liam Payne,Explicit Sexual Content"
One Direction (Band),Harry Styles/Louis Tomlinson,Harry Styles/Louis Tomlinson,just my style,M/M,No,Yes,29 Jan 2018,"1,818",Explicit,No Archive Warnings Apply,"Alpha/Beta/Omega Dynamics,Omega Louis,Alpha Harry Styles,Nerd Harry Styles,Rich Louis Tomlinson,Chronic Illness,Hospitals,Rimming,First Time Blow Jobs,Scenting,Alternate Universe - 1960s"
One Direction (Band),Harry Styles/Louis Tomlinson,Harry Styles/Louis Tomlinson,you set off avalanches in my heart,M/M,No,Yes,14 Dec 2014,"1,817",Not Rated,No Archive Warnings Apply,"Alternate Universe - College/University,harry does way too much,liam is pretty much telepathic,niall likes mashed potatoes,zayn loves liam and liam loves zayn but it's not a big deal,louis writes,louis always writes in my fics sorry,Fluff,Pining,that's all this fic is fluff and pining,just the fluffiest piniest shit ever,there is also a naomi/emily reference in here see if you can find it,oh and mentions of past abuse,Alcohol,Drugs,just weed though"
One Direction (Band),Harry Styles/Louis Tomlinson,Harry Styles/Louis Tomlinson,Bigger Than Life,M/M,No,Yes,09 Oct 2015,"1,816",Explicit,No Archive Warnings Apply,"Happy Ending,Canon Compliant,IM SORRY please dont hate me i promise things get better and larry is in fact very real,it's just that ANGST GIVES ME LIFE,um there's also some smut so yay for that!!!!,Rimming,I DONT KNOW WHAT ELSE TO SAY im sorry for the briana thing and the xander thing,dear larries dont hate me IT'S JUST FIC IT'S NOT REAL ok,um louis suffers a lot an harry is a bit of an ass sometimes but everything works out in the end,Angst,Pining,Jealousy,I FORGOT to mention liam is a bit of a dick here im sorry if u love liam :("
One Direction (Band),Harry Styles/Louis Tomlinson,Harry Styles/Louis Tomlinson,double dog dare ya,M/M,No,Yes,22 Jul 2013,"1,815",Explicit,No Archive Warnings Apply,"Romance,Schmoop,Truth or Dare,Fingerfucking,Non AU"
One Direction (Band),Harry Styles/Louis Tomlinson,Harry Styles/Louis Tomlinson,Tell Me That You Want Me Tonight,M/M,No,Yes,19 Apr 2018,"1,814",Mature,Creator Chose Not To Use Archive Warnings,"CEO Harry,PA Louis,Boss/Employee Relationship,New York City,Desk Sex,Anal Sex,Oral Sex,Blow Jobs,Happy Ending,Sharing a Bed,Secret Relationship,Secret Crush,Pining,Mutual Pining,Shy Louis,Friends to Lovers"
One Direction (Band),Harry Styles/Louis Tomlinson,Harry Styles/Louis Tomlinson,If Ignorance Be Bliss,M/M,No,Yes,08 Jul 2018,"1,812",Mature,Creator Chose Not To Use Archive Warnings,"Friends to Lovers,Coming Out,Alternate Universe - College/University,Dom/sub Undertones,Overhearing Sex,Harry flirts with anything that has a pulse,Slow Burn,Dirty Talk,Unrequited Love,Pole Dancing,Harry does sexy karaoke,Masturbation,Angst,Fluff and Smut,Screenshots,Spanking,Jealous Harry,Jealous Louis,Drunk Sex,They flirt using historical references and I don't know how I've managed that,Their dorms are next to each other and harry gets laid a lot"
One Direction (Band),Harry Styles/Louis Tomlinson,Harry Styles/Louis Tomlinson,little wings on my shoes,M/M,No,Yes,25 Sep 2014,"1,811",Mature,Underage,"Alternate Universe - High School,Alternate Universe- American,Coming Out,Ableism,Misogyny,A Heavy Dose of,Internalized Homophobia,and also just regular,Homophobia,Homophobic Slurs,Violence,First Time,Kind of Almost Forced Outing,Semi-Public Sex,Hickeys,Sneaking Around,and finally A LOT of,Dry Humping,Hand Jobs,also,i forgot,the whole premise,is that they're,nerds,Nerd Louis,Nerd Harry,Nerd Zayn,Nerd Liam,(that last one is a stretch),actually they're all more like,high-achieving suburban weirdos,Popular Niall,obviously,than your classic 'nerd',Transphobia"
One Direction (Band),Harry Styles/Louis Tomlinson,Harry Styles/Louis Tomlinson,Falling Into Place,M/M,No,Yes,30 Nov 2016,"1,862",Explicit,Creator Chose Not To Use Archive Warnings,"Angst with a Happy Ending,Explicit Sexual Content,Bottom Louis,Addiction,Dom/sub Undertones"
One Direction (Band),Harry Styles/Louis Tomlinson,Harry Styles/Louis Tomlinson,keep holding me this way,M/M,No,Yes,04 Feb 2015,"1,861",Explicit,No Archive Warnings Apply,"Alternate Universe - College/University,Humor"
One Direction (Band),Harry Styles/Louis Tomlinson,Harry Styles/Louis Tomlinson,The Way You Make Me Feel,M/M,No,Yes,29 Jun 2015,"1,858",Explicit,No Archive Warnings Apply,"Disney World & Disneyland,Bets & Wagers,Orgasm Delay/Denial,Public Sex,Lingerie,Shotgunning"
One Direction (Band),Harry Styles/Louis Tomlinson,Harry Styles/Louis Tomlinson,Wanted Most,M/M,No,Yes,13 Apr 2014,"1,857",Mature,Creator Chose Not To Use Archive Warnings,"Smut,Rimming,Fluff and Smut,Eventual Smut,Anal Sex,Blow Jobs,Hand Jobs,Pining,theif,Alternative Universe - FBI,Criminal Louis,Fluff,Angst,Fluff and Angst,Angst and Fluff and Smut,Humor,Oral Sex,Handcuffs,Agent Harry,Swearing,Romance,I have no idea what else to tag,Alternate Universe - Robin Hood,Modern Day Robin Hood,Friends With Benefits,Friends to Lovers,Budding Love,A SHIT TON OF INACCURACIES INVOLVING EVERYTHING OKAY GET OFF MY DICK,Medical Inaccuracies,Harry is a year or two too young to be an agent but oh well"
One Direction (Band),Harry Styles/Louis Tomlinson,Harry Styles/Louis Tomlinson,dancing in the moonlight,M/M,No,Yes,14 Feb 2021,"1,851",Explicit,Creator Chose Not To Use Archive Warnings,"Alpha/Beta/Omega Dynamics,Omega Louis Tomlinson,Alternate Universe - College/University,Friends With Benefits,Idiots in Love,Light Angst,Barebacking,Knotting,Himbo Harry Styles,Himbo Harry,Mpreg,Valentine's Day"
One Direction (Band),Harry Styles/Louis Tomlinson,Harry Styles/Louis Tomlinson,KIWI KIWI KIWI,M/M,No,Yes,13 Dec 2017,"1,848",Not Rated,No Archive Warnings Apply,"kiwi music video au,famous/non-famous,Kid Fic,dad louis,Gucci suits,cake mountains,a gaping absence of actual kiwis,Famous Harry,kids as wingmen,Family Vibes,Implied Mpreg,Happy Ending,POV switch,also actual kiwis"
One Direction (Band),Harry Styles/Louis Tomlinson,Harry Styles/Louis Tomlinson,Paper Houses,M/M,No,Yes,06 Nov 2017,"1,848",Explicit,Creator Chose Not To Use Archive Warnings,"Alternate Universe - Modern Setting,Famous Harry,Famous Louis,Alternate Universe - Actors,Actor Harry Styles,Alternate Universe - Fashion & Models,Model Louis,Los Angeles,Magazine articles,Angst and Humor,Angst,Angst with a Happy Ending,Awkward Flirting,Pining,POV Louis,Exes,Strangers to Lovers,Then,Exes to Lovers,Getting Back Together,Jealousy,Kissing,Blow Jobs,Hand Jobs,Anal Fingering,Anal Sex,Riding,Smut,50 Reasons to Have Sex Fic Fest,Explicit Sexual Content,side Ziam,Long-Distance Relationship,Break Up"
One Direction (Band),Harry Styles/Louis Tomlinson,Harry Styles/Louis Tomlinson,Crave,M/M,No,Yes,11 Jan 2018,"1,847",Explicit,No Archive Warnings Apply,"Strangers,BDSM,Dom/sub,Bondage,CEO Louis,Musician Harry,Slow Burn,Friends to Lovers,Sexual Tension,mentions of Simon Cowell,Daddy Kink,Sub Harry,Dom Louis,Kink Negotiation,Friends With Benefits,Nipple Play,Nipple Clamps,Sexting,Phone Sex,Cock Rings,Orgasm Delay/Denial,Blow Jobs,Rimming,Anal Sex,Face-Fucking,Spanking,Riding,Top Louis,Top Harry,Bottom Harry,Bottom Louis,Multiple Orgasms,Begging,Handcuffs,Panties,Collars,Barebacking,Butt Plugs,Anal Fingering,Biting,Painplay,Aftercare,Subspace,Subdrop,Hair-pulling,Light Angst,Switching,Rope Bondage,Public Sex,Exhibitionism,Sex Club,Kink Discovery,Kink Exploration,Dirty Talk,Happy Ending,Blindfolds,Teasing,Feathers & Featherplay,Spreader Bars,Coming Untouched"
One Direction (Band),Harry Styles/Louis Tomlinson,Harry Styles/Louis Tomlinson,Golden,M/M,No,Yes,21 Apr 2022,"1,846",Explicit,Creator Chose Not To Use Archive Warnings,"closeting,Trauma,Panic Attacks,Past possible non-con (not between H&L),Explorations of Femininity,identity discovery,Healing,Self-Discovery,Emotional Hurt/Comfort,Angst,Domestic Fluff,Sexual exploration,Gay Sex,Lots Of Beaches,farming,Sisters,Social Media,music industry,Eating Disorders (not a major part)"
One Direction (Band),Harry Styles/Louis Tomlinson,Harry Styles/Louis Tomlinson,24K Magic,M/M,No,Yes,11 Nov 2018,"1,844",Explicit,No Archive Warnings Apply,"Famous Harry,Writer Louis,Amazing friend Niall,mentions of drug use,Drinking,negative portrayal of a bi character"
