fandom,relationship,taggedRel,title,relType,isCanon,isRPF,datetime,kudos,rating,warnings,tags
방탄소년단 | Bangtan Boys | BTS,Jeon Jungkook/Kim Taehyung | V,Jeon Jeongguk | Jungkook/Kim Taehyung | V,The Perks of Being Married,M/M,No,Yes,29 Jun 2022,"3,216",Explicit,Creator Chose Not To Use Archive Warnings,"Alternate Universe,Arranged Marriage,Alternate Universe - Arranged Marriage,Fashion Designer Kim Taehyung | V,Architect Jeon Jungkook,Sassy Kim Taehyung | V,Tsundere Jeon Jungkook,Kim Taehyung | V is Bad at Feelings,Jeon Jungkook is Bad at Feelings,Jeon Jungkook is Whipped,Kim Taehyung | V is a Little Shit,Jeon Jungkook is a Tease,Jealousy,Possessiveness,Character Development,Family Issues,Domestic Fluff,Slow Burn,Strangers to Lovers,Sexual Tension,Explicit Sexual Content,Smut,holyshitsomuchsmut,blowjob,Come Eating,Switch Kim Taehyung | V,Switch Jeon Jungkook,Anal Sex,Light Bondage,Light Angst,Developing Relationship,Falling In Love,Smoking,only sometimes,Love Confessions,Happy Ending"
방탄소년단 | Bangtan Boys | BTS,Min Yoongi | Suga/Park Jimin,Jeon Jeongguk | Jungkook/Kim Taehyung | V,Full Moon Fireflies,M/M,No,Yes,23 Mar 2018,"3,341",Mature,Graphic Depictions Of Violence,"Alternate Universe - Medieval,Alternate Universe - Magic,Fairies,Wolves,Knights - Freeform,kings - Freeform,Politics,fairy!jimin,Werewolf!Yoongi,knight!Jungkook,Prince Park Jimin,Sword Fighting,Blood and Gore,Slow Burn,Tsunderes,Love Triangles,Unrequited Love,Complex Plotlines,so much plot,Red Riding Hood Elements,Alternate Universe - Game of Thrones Fusion,Alternate Universe - Fantasy,Epic,fancy vocabulary,Fancy fonts,Eventual Smut,Pining so intense that it will kill you,wondering why you ever clicked on this godforsaken swill in the first place,Realistic characters that aren't Gary Sues,Responsible Namjoon that painfully mirrors real life,Hate to Love,Not an ABO,Alternate Universe - Princess Mononoke Fusion,Alternate Universe - Journey to the West,A whole fucking kpop ensemble,and whole buncha OC's that you won't remember just like in the real Game of Thrones.,Medieval but being gay is okay Bc I'm not touching homophobia with a ten foot pole,War,Redemption,Kang Daniel is a whole meal,Character Death,Original Character Death(s)"
방탄소년단 | Bangtan Boys | BTS,Jeon Jungkook/Kim Taehyung | V,Jeon Jeongguk | Jungkook/Kim Taehyung | V,Telephone,M/M,No,Yes,10 Sep 2022,"3,338",Explicit,No Archive Warnings Apply,"Alpha/Beta/Omega Dynamics,Alpha Jeon Jungkook,Omega Kim Taehyung | V,Single Parent Kim Taehyung | V,Single mother Taehyung,Mob Boss Jeon Jungkook,University Student Kim Taehyung | V,First Meeting,Fluff and Angst,Domestic Fluff,Happy Ending,Obsession,Stalker Jeon Jungkook,Dark Jeon Jungkook,Fluff and Smut,Explicit Sexual Content,Blood and Violence"
방탄소년단 | Bangtan Boys | BTS,Jeon Jungkook/Kim Taehyung | V,Jeon Jeongguk | Jungkook/Kim Taehyung | V,inure,M/M,No,Yes,29 Apr 2021,"3,334",Explicit,No Archive Warnings Apply,"Alternate Universe - Modern Setting,Professor Jeon Jungkook,Professor Kim Taehyung | V,exes to friends to lovers,Slow Burn,Aged-Up Character(s),Hurt/Comfort,Emotional Baggage,Mutual Pining,Angst,Fluff,Eventual Smut,Top Jeon Jungkook,Bottom Kim Taehyung | V"
방탄소년단 | Bangtan Boys | BTS,Jeon Jungkook/Kim Taehyung | V,Jeon Jeongguk | Jungkook/Kim Taehyung | V,"I’m fine, if you ask",M/M,No,Yes,29 Jul 2017,"3,331",Explicit,Creator Chose Not To Use Archive Warnings,"Alternate Universe - College/University,Disabled Character,Blind Character,Blind Kim Taehyung | V,Tattooed Jeon Jungkook,Fluff,Angst,Smut,Top Jeon Jungkook,Bottom Kim Taehyung | V,past bullying,Misunderstandings,Happy Ending"
방탄소년단 | Bangtan Boys | BTS,Jeon Jeongguk | Jungkook/Kim Taehyung | V,Jeon Jeongguk | Jungkook/Kim Taehyung | V,My Love Is Carried To You By My Feet,M/M,No,Yes,19 Mar 2015,"3,331",Teen And Up Audiences,No Archive Warnings Apply,
방탄소년단 | Bangtan Boys | BTS,Jeon Jungkook/Jung Hoseok/Kim Namjoon/Kim Seokjin/Kim Taehyung/Min Yoongi/Park Jimin,Jeon Jeongguk | Jungkook/Kim Taehyung | V,Home,M/M,No,Yes,05 Mar 2022,"3,320",Teen And Up Audiences,Graphic Depictions Of Violence,"Supernatural Elements,Alternate Universe - Supernatural Elements,Magic,Alternate Universe - Magic,Magical Realism,Fae & Fairies,Vampires,Were-Creatures,Alternate Universe - Elf,Fluff,Fluff and Angst,Domestic Fluff,Fluff and Humor,Fluff and Crack,Angst,Hurt/Comfort,Angst and Hurt/Comfort,Violence,Blood and Violence,Emotional Hurt/Comfort,Emotional Manipulation,Anxiety,Anxiety Attacks,Separation Anxiety,Anxiety Disorder,Eating Disorders"
방탄소년단 | Bangtan Boys | BTS,Jeon Jungkook/Kim Taehyung | V,Jeon Jeongguk | Jungkook/Kim Taehyung | V,Give You Me,M/M,No,Yes,26 Sep 2020,"3,316",Explicit,Creator Chose Not To Use Archive Warnings,"Alternate Universe,Alternate Universe - Modern Setting,Alpha/Beta/Omega Dynamics,Alpha/Omega,Arranged Marriage,Eventual Romance,Eventual Smut,Angst and Fluff and Smut,Happy Ending,Angst with a Happy Ending,Alpha Jeon Jungkook,Omega Kim Taehyung | V,Mating Bond,Secrets,side yoonmin,side namjin,Strangers to Lovers,Misunderstandings,Explicit Sexual Content"
방탄소년단 | Bangtan Boys | BTS,Jeon Jungkook & Kim Taehyung | V,Jeon Jeongguk | Jungkook/Kim Taehyung | V,Avia,M/M,No,Yes,30 Nov 2018,"3,316",Explicit,Graphic Depictions Of Violence,"Alternate Universe - Fantasy,Alternate Universe - Wings,Mild Language,Fluff,A lot of worldbuilding,Other Additional Tags to Be Added,Magic,Warm and Fuzzy Feelings,Slow Build,Explicit Sexual Content,Reincarnation,Background Relationships,made-up language"
방탄소년단 | Bangtan Boys | BTS,Jeon Jungkook/Kim Taehyung | V,Jeon Jeongguk | Jungkook/Kim Taehyung | V,Where the Light Shines,M/M,No,Yes,07 Dec 2021,"3,312",Explicit,No Archive Warnings Apply,"Smut,Sexual Tension,Strangers to Lovers,Angst,Angst with a Happy Ending,First Kiss,Massage,Inspired by The Handmaiden (2016),Violence,Sub Jeon Jungkook,Dom Kim Taehyung | V,Bottom Jeon Jungkook,Top Jeon Jungkook,Top Kim Taehyung | V,Bottom Kim Taehyung | V,Practice Kissing,Nude Modeling,Abuse,Mirror Sex,Virgin Jeon Jungkook,Body Worship,Dom Jeon Jungkook,Betrayal,Dysfunctional Relationships,Dubious Morality"
방탄소년단 | Bangtan Boys | BTS,Jeon Jungkook/Kim Taehyung | V,Jeon Jeongguk | Jungkook/Kim Taehyung | V,"Snow, Blood, Night",M/M,No,Yes,04 Jun 2021,"3,303",Explicit,No Archive Warnings Apply,"Alternate Universe - Vampire,Alternate Universe - Royalty,Modern Royalty,Vampire Turning,Half-Vampires,Vampire Bites,Vampire Sex,Blood,Blood and Injury,Blood Drinking,Mild Blood,Blood Loss,Blood Sharing,Minor Violence,Animal Attack,Animal Death,Near Death Experiences,Past Character Death,Explicit Sexual Content,Explicit Language,Art History,Vampire Jeon Jungkook,Vampire Park Jimin (BTS),Vampire Min Yoongi | Suga,Vampire Kim Namjoon | RM,Vampire Kim Seokjin | Jin,Top Jeon Jungkook,Bottom Kim Taehyung | V,Eventual Smut,Angst,Angst with a Happy Ending,Prince Jeon Jungkook,Swordfighting,Castles,Power Bottom Kim Taehyung | V,Falling In Love,Jeon Jungkook is Bad at Feelings,Kim Taehyung | V is a Tease,Plot,Knives,Worldbuilding,Prague,Winter,Mystery,Vampires,Character Turned Into Vampire,Jeon Jungkook Has a Tragic Past,Orphan Kim Taehyung | V,Background Relationships,Mates,Forbidden Love,Slow Burn"
방탄소년단 | Bangtan Boys | BTS,Jeon Jungkook/Kim Taehyung | V,Jeon Jeongguk | Jungkook/Kim Taehyung | V,Collar Me,M/M,No,Yes,29 Aug 2021,"3,293",Explicit,No Archive Warnings Apply,"BDSM,BDSM Scene,Consensual Kink,Contracts,Alternate Universe - Lawyers,Jeon Jungkook & Kim Taehyung | V are the Same Age,Oral Sex,Dom/sub,Dom/sub Play,Dom Jeon Jungkook,Sub Kim Taehyung | V,Anal Fingering,Chatting & Messaging,Explicit Sexual Content,Explicit Language,Mutual Masturbation,Office Sex,Alternate Universe - BDSM,Kink Negotiation,Voice Kink,Caning,Face-Fucking,Handcuffs,Desk Sex,Rough Sex,Anal Sex,Bondage,Overstimulation,Foot Jobs,Sexting,Top Jeon Jungkook,Bottom Kim Taehyung | V,Power Dynamics,Power Play,Power Exchange,Nicknames,Kinky,Nipple Play,Nipple Clamps,Painplay,Orgasm Delay/Denial,Orgasm Control,Mirror Sex,Light Masochism,Light Sadism,Spanking,Anal Plug,Punishment,Public Scene,Body Worship,Crossdressing Kink,Crossdressing Kim Taehyung | V,Kim Taehyung | V Wears a Dress,Kilts,Belts,Background Relationships,Dungeon,Dacryphilia,Temperature Play,Lube,Restraints,Blindfolds,Family Issues,Collars,Multiple Orgasms,Domestic Bliss,Love,Soft Dom Jeon Jungkook"
방탄소년단 | Bangtan Boys | BTS,Jeon Jungkook/Kim Namjoon | RM/Kim Taehyung | V/Park Jimin,Jeon Jeongguk | Jungkook/Kim Taehyung | V,Better With You,M/M,No,Yes,09 Jan 2020,"3,291",Mature,No Archive Warnings Apply,"Alternate Universe,Alpha/Beta/Omega Dynamics,Polyamory,Mentions of past abuse,Mating Cycles/In Heat,Kim Taehyung | V is a Little Shit,Jeon Jungkook is a Little Shit,Park Jimin (BTS) is So Done,Alpha Kim Namjoon | RM,Omega Jeon Jungkook,Omega Park Jimin (BTS),Omega Kim Taehyung | V,side!yoonseokjin,Knotting,Marking,Other Additional Tags to Be Added,Mpreg,child!soobin,Non-Traditional Alpha/Beta/Omega Dynamics,everyone switches,Smut,Breeding Kink,Blow Jobs,Rimming,Foursome - M/M/M/M,Minor Character Death,veryveryvery mild gore,like some blood,Intersex Omegas,Cults,characters make bad decisions sometimes and that's okay,Titty Fucking,Somnophilia"
방탄소년단 | Bangtan Boys | BTS,Jeon Jungkook/Kim Taehyung | V,Jeon Jeongguk | Jungkook/Kim Taehyung | V,Strangers in the Night,M/M,No,Yes,28 Feb 2022,"3,289",Explicit,No Archive Warnings Apply,"Neo Noir,Alternate Universe - Vampire,Alternate Universe - Urban Fantasy,Vampire Kim Taehyung | V,Werewolf Jeon Jungkook,Nightclub Owner Kim Taehyung,Prize Fighter Jeon Jungkook,Faerie Park Jimin,Faerie Jung Hoseok,Vampire Kim Seokjin | Jin,Vampire Min Yoongi | Suga,Werewolf Kim Namjoon | RM,Strangers to Lovers,Forbidden Love,Enemies to Lovers,Angst,Hurt/Comfort,Sexual Tension,Explicit Sexual Content,Explicit Language,Blood and Violence,Kidnapping,Serious Injuries,Blood,Blood Drinking,Biting,Past Dubcon/NonCon (not between Taekook),Past Murders,Taehyung has an abusive past,Morally Grey Characters,Mind Control,Manipulation,Dubcon Biting,Knotting,Self-Lubrication,Mating Cycles/In Heat,Mating Bites,Mating Bond,wolf shifting,Switch Kim Taehyung | V,Switch Jeon Jungkook,Angst with a Happy Ending,There's a Lot of Smut and it's Downright Feral at Times"
방탄소년단 | Bangtan Boys | BTS,Jeon Jungkook/Kim Taehyung | V,Jeon Jeongguk | Jungkook/Kim Taehyung | V,Until We Get There,M/M,No,Yes,04 Sep 2016,"3,288",Mature,No Archive Warnings Apply,Alternate Universe - Tattoo Parlor
방탄소년단 | Bangtan Boys | BTS,Jung Hoseok | J-Hope/Min Yoongi | Suga,Jeon Jeongguk | Jungkook/Kim Taehyung | V,Bite Me,M/M,No,Yes,01 Apr 2019,"3,285",Explicit,Creator Chose Not To Use Archive Warnings,"Alternate Universe - Vampire,Vampire Hunters,Blood and Violence,mentioned emotional abuse,lots of cameos,Explicit Sexual Content,Minor Character Death,Fluff and Angst,Hurt/Comfort,Jeon Jungkook is Whipped,Jung Hoseok | J-Hope is Whipped,Min Yoongi | Suga Is Whipped,They're all whipped tbh,Kim Taehyung | V is a Little Shit,Slow Burn,they're all idiots,Idiots who get hurt a lot,Betrayal,Kim Seokjin | Jin is So Done,Friends With Benefits Kim Taehyung | V/Park Jimin,Relationship tags are in order of appearance."
방탄소년단 | Bangtan Boys | BTS,Min Yoongi | Suga/Park Jimin,Jeon Jeongguk | Jungkook/Kim Taehyung | V,rough around the edges,M/M,No,Yes,25 Jul 2020,"3,281",Mature,Creator Chose Not To Use Archive Warnings,"Fake/Pretend Relationship,insecure,Coffee Shop,friends - Freeform,Mutual Pining,Unrequited Love,Not Actually Unrequited Love"
방탄소년단 | Bangtan Boys | BTS,Jeon Jungkook/Kim Seokjin | Jin/Kim Taehyung | V,Jeon Jeongguk | Jungkook/Kim Taehyung | V,baby alpha,M/M,No,Yes,18 Apr 2019,"3,280",Explicit,No Archive Warnings Apply,"Alternate Universe - Soulmates,Alpha/Beta/Omega Dynamics,Non-Traditional Alpha/Beta/Omega Dynamics,Alpha/Omega,Alpha/Beta,Beta/Omega,Insecure Kim Seokjin | Jin,(I know I can't believe it either! insecure Jin is so ooc pffh),Mating Bites,mating chase,minjoon is mentioned,Angst and Fluff and Smut,Unsafe Sex,Hand Jobs,Knotting,Light Dom/sub,Kitchen Sex,Threesome - M/M/M,Polyamory,Kissing,Jimin speaks in memes I don't know why... it just happened,Jeongguk has a hyung kink,Drinking,drama as a plot device,Angst,Heavy Angst,Bottom Alpha,Top Beta,slow burn but in an explicit way,Mating Cycles/In Heat,Mating Bond,Aftercare,Rut,Play Fighting,Power Play"
방탄소년단 | Bangtan Boys | BTS,Jeon Jungkook/Jung Hoseok/Kim Namjoon/Kim Seokjin/Kim Taehyung/Min Yoongi/Park Jimin,Jeon Jeongguk | Jungkook/Kim Taehyung | V,⚜️Aeonian⚜️,M/M,No,Yes,30 Mar 2024,"3,279",Not Rated,Graphic Depictions Of Violence,"Royalty,Vampires,Omega Verse,Omega Jeon Jungkook,Vampire Bangtan Boys | BTS,Cultural Differences,Blood and Violence,Hurt/Comfort,Falling In Love,True Mates,Flirting,Sexual Tension,so much,Moral Ambiguity,The sexual tension is literally palpable,Mutual Pining,Misunderstandings,Sexual Content,Jealousy,Possessive Behavior,Protectiveness,Blood Kink,Not really they're vampires so ofc they like blood though,theyre also very bitey,Shameless Smut"
방탄소년단 | Bangtan Boys | BTS,Jeon Jungkook/Kim Taehyung | V,Jeon Jeongguk | Jungkook/Kim Taehyung | V,Doggy Style,M/M,No,Yes,20 Mar 2021,"3,275",Explicit,Rape/Non-Con,"Shapeshifter Jeon Jungkook,Boypussy Kim Taehyung | V,Boypussy,Somnophilia,beastiality,Dumbification,Top Jeon Jungkook,Bottom Kim Taehyung | V,Breeding,Creampie,tummy bulge,Mildly Dubious Consent,Rape/Non-con Elements,Non-Consensual Somnophilia"
방탄소년단 | Bangtan Boys | BTS,Jeon Jungkook/Kim Taehyung | V,Jeon Jeongguk | Jungkook/Kim Taehyung | V,Woodwitch,M/M,No,Yes,17 Sep 2019,"3,274",Explicit,No Archive Warnings Apply,"Horror,Incubus Jungkook,Witches,Demon Sex,Self-Lubrication,Top Kim Taehyung | V,Bottom Jeon Jungkook"
방탄소년단 | Bangtan Boys | BTS,Jeon Jungkook/Kim Taehyung | V,Jeon Jeongguk | Jungkook/Kim Taehyung | V,Sing Me Sweet Melodies,M/M,No,Yes,13 Dec 2020,"3,421",Teen And Up Audiences,No Archive Warnings Apply,"Idol Kim Taehyung | V,Famous Kim Taehyung | V,Non-Famous Jeon Jungkook,University Student Jeon Jungkook,Enemies to Lovers,Breaking Up & Making Up,Getting Back Together,high school sweethearts,Fluff and Angst,Angst with a Happy Ending,Misunderstandings,Miscommunication"
방탄소년단 | Bangtan Boys | BTS,Jeon Jungkook/Kim Taehyung | V,Jeon Jeongguk | Jungkook/Kim Taehyung | V,Dire Straits,M/M,No,Yes,23 Jun 2019,"3,415",Teen And Up Audiences,No Archive Warnings Apply,"Alternate Universe - Pirate,Pirates AU,Alternate Universe - Royalty,Royalty AU,Runaway Prince AU,Alternate Universe - Arranged Marriage,Arranged Marriage AU,Enemies to Lovers,Enemies to Friends,Friends to Lovers,Enemies to Friends to Lovers,Mutual Pining,Slow Burn,Minor Min Yoongi | Suga/Park Jimin"
방탄소년단 | Bangtan Boys | BTS,Jeon Jungkook/Kim Taehyung | V,Jeon Jeongguk | Jungkook/Kim Taehyung | V,DND (dilf next door) | taekook,M/M,No,Yes,18 Feb 2022,"3,414",Explicit,Creator Chose Not To Use Archive Warnings,"Omega Kim Taehyung | V,Alpha/Beta/Omega Dynamics,Alpha Jeon Jungkook,Alpha Min Yoongi | Suga,Omega Park Jimin (BTS),Beta Jung Hoseok | J-Hope,Alpha Kim Namjoon | RM,Omega Kim Seokjin | Jin,Alpha/Omega,DILF Jeon Jungkook,Jeon Jungkook is Whipped,Top Jeon Jungkook,Bottom Kim Taehyung | V,Dom Jeon Jungkook,Sub Kim Taehyung | V,Praise Kink,Cute Kim Taehyung | V,Fashion Designer Kim Taehyung | V,Jeon Jungkook is Older Than Kim Taehyung | V,jungkook is a dad,Daddy Kink,Needy Kim Taehyung | V,Rich Jeon Jungkook,Rich Kim Taehyung | V,Confident Kim Taehyung | V,Good Boy Kim Taehyung | V,Jeon Jungkook Has a Big Dick,Fluff,Fluff and Smut,Happy Ending,Eventual Smut,Multiple Orgasms,Knotting,Age Difference,Domestic Fluff,Domestic Jeon Jungkook/Kim Taehyung | V,Kim Taehyung | V Has a Praise Kink,Soft Dom Jeon Jungkook,Baby Boy Kim Taehyung | V,pillow princess kim taehyung,Hyung Kink,Falling In Love,Soft Jeon Jungkook"
방탄소년단 | Bangtan Boys | BTS,Jeon Jungkook/Kim Taehyung | V,Jeon Jeongguk | Jungkook/Kim Taehyung | V,i wanna taste you,M/M,No,Yes,29 Jun 2017,"3,414",Explicit,Creator Chose Not To Use Archive Warnings,"this is literally just 5k of smut,Threesome - M/M/M,Alternate Universe - College/University,Recreational Drug Use,Alcohol,Established Relationship,Dirty Talk,Oral Sex,Anal Sex,Blow Jobs,Explicit Language,Cock Slut,Facials,Snowballing,Dom/sub Undertones,Dom Park Jimin,Dom Jeon Jungkook,Sub Kim Taehyung | V,Bottom Kim Taehyung | V"
방탄소년단 | Bangtan Boys | BTS,Jeon Jungkook/Park Jimin,Jeon Jeongguk | Jungkook/Kim Taehyung | V,Training Wheels,M/M,No,Yes,04 Sep 2016,"3,414",General Audiences,"Creator Chose Not To Use Archive Warnings,No Archive Warnings Apply","Pining,Mutual Pining,lots of pining,Angst,Fluff and Angst,Angst with a Happy Ending,i think yall can tell that my fav trope ever is pining,brief one sided taekook tho,its mostly jimin pining and oh,Slow Burn,and yeah one day jeongguk,understands and,bam - Freeform,i need to study what am i doing,fun fact i cried writing this,i hope u enjoy this i lov u,Childhood Friends to Lovers,lapslock"
방탄소년단 | Bangtan Boys | BTS,Jeon Jungkook/Kim Taehyung | V,Jeon Jeongguk | Jungkook/Kim Taehyung | V,this is my heart (dive deep),M/M,No,Yes,31 Jul 2020,"3,410",Mature,Creator Chose Not To Use Archive Warnings,"Domestic Fluff,Lawyer Kim Taehyung | V,Chef Jeon Jungkook,Strangers to Lovers,Tooth-Rotting Fluff,Smut,Switch Jeon Jungkook,Switch Kim Taehyung | V,Jeon Jungkook is a Sweetheart,this is the fluffiest thing I've ever written,Alternate Universe - Modern Setting,Parent Kim Taehyung | V,Single Parent Kim Taehyung | V,Kim Taehyung | V & Park Jimin are Best Friends,Fluff and Smut"
방탄소년단 | Bangtan Boys | BTS,Jeon Jungkook/Kim Taehyung | V,Jeon Jeongguk | Jungkook/Kim Taehyung | V,Beg for Mercy,M/M,No,Yes,06 Sep 2017,"3,409",Mature,No Archive Warnings Apply,"Alternate Universe - College/University,Overwatch - Freeform,taekook love video games,they're big nerds,Kim Taehyung | V & Park Jimin are Best Friends,Smut,Porn With Plot,Top Kim Taehyung | V,Bottom Jeon Jungkook,Bottoming from the Top,Fluff and Humor,Attempt at angst,I Tried"
방탄소년단 | Bangtan Boys | BTS,Min Yoongi | Suga/Park Jimin,Jeon Jeongguk | Jungkook/Kim Taehyung | V,Up in the Air,M/M,No,Yes,11 Jun 2015,"3,406",Teen And Up Audiences,No Archive Warnings Apply,"implied namjin,the VKook is a side pairing too,sorry that namjin and hobi don't have big roles in this"
방탄소년단 | Bangtan Boys | BTS,Jeon Jungkook/Kim Taehyung | V,Jeon Jeongguk | Jungkook/Kim Taehyung | V,I found my paradise in your arms,M/M,No,Yes,17 Aug 2021,"3,396",Explicit,"Graphic Depictions Of Violence,Rape/Non-Con","Alpha/Beta/Omega Dynamics,Alternate Universe - Modern Setting,Gangs,Pack Dynamics,Alpha Jeon Jungkook,Omega Kim Taehyung | V,Alpha Kim Namjoon | RM,Omega Kim Seokjin | Jin,Alpha Min Yoongi | Suga,Alpha Jung Hoseok | J-Hope,Beta Park Jimin (BTS),Blood and Violence,Mating,Forced Bonding,Forced Relationship,Domestic Violence,Physical Abuse,Emotional/Psychological Abuse,Rape/Non-con Elements,Extramarital Affairs,Secret Relationship,Cheating,Kim Taehyung | V Needs a Hug,Kim Taehyung | V is a Little Shit,Kim Taehyung | V is a Brat,Sweet Kim Taehyung | V,Sweet Jeon Jungkook,Jeon Jungkook is So Done,Jeon Jungkook is Whipped,Sexual Tension,Getting to Know Each Other,Falling In Love,Dark Past,Protective Jeon Jungkook,Jeon Jungkook is Older Than Kim Taehyung | V,Praise Kink,Self-Lubrication,Shameless Smut,Blow Jobs,Hand Jobs,Rimming,Anal Fingering,Anal Sex,Dom/sub Undertones,Top Jeon Jungkook,Bottom Kim Taehyung | V,Knotting,Mating Cycles/In Heat,Punishment,Rape,Rape Aftermath,Suicidal Thoughts,Mpreg,Pregnant Kim Taehyung | V,Fear of Discovery,Torture,Original Character Death(s),Mating Bites,Happy Ending"
방탄소년단 | Bangtan Boys | BTS,Jeon Jungkook/Kim Taehyung | V,Jeon Jeongguk | Jungkook/Kim Taehyung | V,"The Wheels on the Bus (Go 'Oh Shit, He's Cute')",M/M,No,Yes,25 Feb 2017,"3,379",General Audiences,No Archive Warnings Apply,"vkook,taekook,Awkward Jeon Jungkook,Fluff,bts - Freeform,Texting,kind of a text fic,A little,taehyung designes clothes,Bffs vmin,background yoonmin,referenced past jikook,for like two words"
방탄소년단 | Bangtan Boys | BTS,Jeon Jungkook/Everyone,Jeon Jeongguk | Jungkook/Kim Taehyung | V,happy birthday jungkook,M/M,No,Yes,31 Aug 2017,"3,373",General Audiences,Creator Chose Not To Use Archive Warnings,"crying jungkook,Hurt/Comfort,this prank was sooo mean lol,Hurt Jeon Jungkook,Platonic Relationships,slight angst,Fluff,Fluff and Angst,Jeon Jungkook-centric,Anxiety,Sad with a Happy Ending"
방탄소년단 | Bangtan Boys | BTS,Jeon Jungkook/Kim Taehyung | V,Jeon Jeongguk | Jungkook/Kim Taehyung | V,Angel Baby,M/M,No,Yes,25 Sep 2022,"3,371",Explicit,No Archive Warnings Apply,"Alpha/Beta/Omega Dynamics,Alpha Jeon Jungkook,Omega Kim Taehyung | V,Omega Park Jimin (BTS),Alpha Kim Namjoon | RM,Alpha Min Yoongi | Suga,Beta Jung Hoseok | J-Hope,Omega Kim Seokjin | Jin,Slow Burn,Hurt/Comfort,Fluff and Angst,Angst with a Happy Ending,Fluff,Domestic Fluff,Domestic Jeon Jungkook/Kim Taehyung | V,Mpreg,Implied Mpreg,Male Lactation,Breastfeeding,Lactation,Nesting,Top Jeon Jungkook,Bottom Kim Taehyung | V,Misunderstandings,Child Neglect,Child Abandonment,Jealous Jeon Jungkook,Protective Jeon Jungkook,Soft Kim Taehyung | V,CEO Jeon Jungkook,Babysitter Kim Taehyung | V,Jeon Jungkook is Whipped,Parenthood,Protective Kim Taehyung | V,Single Parent Jeon Jungkook,Emotional Hurt/Comfort,Hand Jobs,Scenting,Anal Sex,Anal Fingering,Sex,Adorable Kim Taehyung | V,Cute Kim Taehyung | V,Mating Cycles/In Heat,Mating,Mating Bites,Cuddlefucking,Sleepy Cuddles,Nipple Play,Nipple Licking,Knotting,Heats,ruts,Explicit Sexual Content"
방탄소년단 | Bangtan Boys | BTS,Jeon Jungkook/Kim Taehyung | V,Jeon Jeongguk | Jungkook/Kim Taehyung | V,Never Letting Go of Surburbia,M/M,No,Yes,19 Nov 2017,"3,369",Explicit,No Archive Warnings Apply,"Alternate Universe - Neighbors,Single Dad!Jeongguk,Mutual Pining,Nurse!Taehyung,The kid is adorable,Bottom Kim Taehyung | V,Top Jeon Jungkook,Jihan/Taehyung freeform"
방탄소년단 | Bangtan Boys | BTS,Jeon Jungkook/Kim Taehyung | V,Jeon Jeongguk | Jungkook/Kim Taehyung | V,Hair-Trigger,M/M,No,Yes,18 May 2018,"3,365",Not Rated,Creator Chose Not To Use Archive Warnings,"Bottom Jeon Jungkook,Top Kim Taehyung | V,Switching,But the bit where Tae bottoms is only mentioned and not very explicit,Multiple Orgasms,Anal Sex,Sub Jeon Jungkook,But softly"
방탄소년단 | Bangtan Boys | BTS,Jeon Jungkook/Kim Taehyung | V,Jeon Jeongguk | Jungkook/Kim Taehyung | V,Stuffed Drumsticks and Cotton Candy Kisses,M/M,No,Yes,07 Apr 2017,"3,365",Mature,Creator Chose Not To Use Archive Warnings,"carnival setting,muchos fluff,Makeout Sesh,jeongguk is very shy,but also very hot,tripled whipped cream w extra whip no cream"
방탄소년단 | Bangtan Boys | BTS,Jeon Jungkook/Jung Hoseok/Kim Namjoon/Kim Seokjin/Kim Taehyung/Min Yoongi/Park Jimin,Jeon Jeongguk | Jungkook/Kim Taehyung | V,Honey Trap,M/M,No,Yes,02 Oct 2022,"3,363",Explicit,Graphic Depictions Of Violence,"Alternate Universe,Bunny Hybrid Jeon Jungkook,wolf hybrid hyungs,Fluff and Smut,Dirty Talk,Pet Names,the hyungs call jk baby excessively,guided masturbation,Fingering,Rimming,Bottom Jeon Jungkook,Dom/sub Undertones,Knotting,Breeding Kink,graphic violence scene in ch8"
방탄소년단 | Bangtan Boys | BTS,Jeon Jungkook/Everyone,Jeon Jeongguk | Jungkook/Kim Taehyung | V,Evermore,M/M,No,Yes,01 Jul 2021,"3,355",Mature,Creator Chose Not To Use Archive Warnings,"Shy Jeon Jungkook,Cute Jeon Jungkook,Oblivious Jeon Jungkook,Alternate Universe - Fantasy,Alternate Universe - Vampire,Human Jeon Jungkook,Vampire Kim Namjoon | RM,Vampire Kim Seokjin | Jin,Vampire Min Yoongi | Suga,Vampire Jung Hoseok | J-Hope,Vampire Park Jimin (BTS),Vampire Kim Taehyung | V,Werewolves,Vampires,Jeon Jungkook-centric,Protective Bangtan Boys | BTS,Protective Hyungs,Violence,only when someone is a threat to them lol,Dark BTS,Kidnapping,jungkook has long hair yeehaw,Other Additional Tags to Be Added,Namjoon's big fat tiddies demanded a grand entrance as they should,no really his shirt is hanging on by a thread"
방탄소년단 | Bangtan Boys | BTS,Jeon Jungkook/Kim Taehyung | V,Jeon Jeongguk | Jungkook/Kim Taehyung | V,Reborn in Water,M/M,No,Yes,05 Jul 2017,"3,352",Explicit,No Archive Warnings Apply,"Strangers to Lovers,Masturbation,Magical Realism,naiad!taehyung,Alternative Universe - Nature Spirits,accidental arranged marriage,Wet Dream,siren!yoongi,Mermaid!Jin,mermaid!Hoseok,Light Angst,Long-Distance Relationship,Fluff and Smut"
