fandom,relationship,taggedRel,title,relType,isCanon,isRPF,datetime,kudos,rating,warnings,tags
방탄소년단 | Bangtan Boys | BTS,Jeon Jungkook/Everyone,Jeon Jeongguk | Jungkook/Kim Taehyung | V,"In The Lowest Deep, A Lower Deep",M/M,No,Yes,25 Jun 2021,"4,415",Explicit,Rape/Non-Con,"Molestation,Trains,Public Transportation,Public Humiliation,Situational Humiliation,Exhibitionism,Rape/Non-con Elements,Non-Consensual Touching,Bottom Jeon Jungkook,Alternate Universe,Dirty Talk,Daddy Kink,Overstimulation,Blackmail,Top Kim Namjoon | Rap Monster,Top Kim Seokjin | Jin,Top Kim Taehyung | V,Switch Kim Taehyung | V,Feminization,Forced Feminization,Sexual Abuse,Explicit Sexual Content,Rimming,Threesome - M/M/M,Orgasm Delay/Denial,Sex Toys,Manipulation,Non-Consensual Spanking,Subdrop,Emotional Manipulation,Oral Sex,Safeword Misuse,Omorashi,Loss of Virginity,Top Jeon Jungkook,Implied/Referenced Drug Use,Non-Consensual Drug Use"
방탄소년단 | Bangtan Boys | BTS,Jeon Jungkook/Kim Taehyung | V,Jeon Jeongguk | Jungkook/Kim Taehyung | V,take an inch (i’ll give you a mile),M/M,No,Yes,04 Dec 2018,"4,405",Explicit,No Archive Warnings Apply,"Summer Love,Fluff,minimal angst,copious amounts of making out,Smut"
방탄소년단 | Bangtan Boys | BTS,Jeon Jungkook/Kim Taehyung | V,Jeon Jeongguk | Jungkook/Kim Taehyung | V,your body on mine,M/M,No,Yes,19 Aug 2023,"4,404",Explicit,Creator Chose Not To Use Archive Warnings,"Non-Traditional Alpha/Beta/Omega Dynamics,Alpha/Beta/Omega Dynamics,Alpha/Alpha,Rutting,Knotting,Mating Cycles/In Heat,Rough Sex,Face-Fucking,Come Marking,Dirty Talk,Name-Calling,Established Relationship,Alpha Kim Taehyung | V,Alpha Jeon Jungkook,Bottom Jeon Jungkook,Top Kim Taehyung | V"
방탄소년단 | Bangtan Boys | BTS,Min Yoongi | Suga/Park Jimin,Jeon Jeongguk | Jungkook/Kim Taehyung | V,Deliver My Heart on a Silver Platter,M/M,No,Yes,29 Jan 2018,"4,401",Explicit,No Archive Warnings Apply,"Delivery Boy Park Jimin,Mob Boss Min Yoongi,Alternate Universe - Mob,Fluff,Romance,Min Yoongi | Suga Is Whipped,Smut,heed the tags,Dead Dove: Do Not Eat,Barebacking,Anal Sex,Anal Fingering,Biting,Blow Jobs,Deepthroating,Spanking,Daddy Kink,sue me,Rimming,Age Difference"
방탄소년단 | Bangtan Boys | BTS,Jeon Jungkook/Kim Taehyung | V,Jeon Jeongguk | Jungkook/Kim Taehyung | V,"Take it, Keep it.",M/M,No,Yes,15 Mar 2022,"4,395",Not Rated,Creator Chose Not To Use Archive Warnings,"Alpha/Beta/Omega Dynamics,Mpreg,Alpha Jeon Jungkook,Alpha Jung Hoseok | J-Hope,Alpha Kim Namjoon | RM,Alpha Min Yoongi | Suga,Beta Kim Seokjin | Jin,Omega Park Jimin (BTS),Omega Kim Taehyung | V,Angst with a Happy Ending,Falling In Love,baby fever,Jeon Jungkook is Whipped,Jeon Jungkook is Bad at Feelings,Jeon Jungkook is a Brat,Kim Taehyung | V & Park Jimin are Best Friends,Bottom Kim Taehyung | V,Top Jeon Jungkook,Kim Taehyung | V is a Sweetheart,Jeon Jungkook is a Little Shit,Kim Taehyung | V-centric,Alternate Universe - College/University,Rich Jeon Jungkook,Orphan Kim Taehyung | V,Enemies to Lovers"
방탄소년단 | Bangtan Boys | BTS,Min Yoongi | Suga/Park Jimin,Jeon Jeongguk | Jungkook/Kim Taehyung | V,need a little sweetness in my life,M/M,No,Yes,02 Jan 2016,"4,391",Teen And Up Audiences,Creator Chose Not To Use Archive Warnings,"this is literally my first fic in two years i'm a bit rusty,also the vkook is minor so,Alternate Universe - College/University,Coffeeshop AU,kind of,not really i mean there's coffee involved"
방탄소년단 | Bangtan Boys | BTS,Jeon Jungkook/Kim Taehyung | V,Jeon Jeongguk | Jungkook/Kim Taehyung | V,(thought you knew) you were in this song,M/M,No,Yes,01 Jan 2017,"4,389",Teen And Up Audiences,Major Character Death,"Alternate Universe - Soulmates,Soulmates,art teacher!tae,photography major!jeongguk,Domestic,Fluff and Angst,Fluff,Angst,Hurt/Comfort,Growing Up,Developing Relationship,First Meetings,Romance,Moving In Together,Domestic Bliss,First Time,Established Relationship,please read start notes even if you're not sure if you want to read the fic! ;;"
방탄소년단 | Bangtan Boys | BTS,Jeon Jungkook/Everyone,Jeon Jeongguk | Jungkook/Kim Taehyung | V,Home [DISCONTINUED/INDEFINITE HIATUS],M/M,No,Yes,06 Mar 2021,"4,801",Explicit,"Graphic Depictions Of Violence,Rape/Non-Con,Underage","Hurt/Comfort,Emotional Hurt/Comfort,Emotional/Psychological Abuse,Angst,Fluff and Angst,Shy Jeon Jungkook,Omega Jeon Jungkook,Alpha Kim Namjoon | Rap Monster,Alpha Park Jimin,Alpha Jung Hoseok | J-Hope,Alpha Min Yoongi | Suga,Beta Kim Seokjin | Jin,Omega Kim Taehyung | V,mentions of rape/non-con,Prostitution,Alpha/Beta/Omega Dynamics,Bottom Jeon Jungkook,Flashbacks,Smut,Mating Cycles/In Heat,Physical Abuse,discontinued/indefinite hiatus"
방탄소년단 | Bangtan Boys | BTS,Jeon Jungkook/Kim Taehyung | V,Jeon Jeongguk | Jungkook/Kim Taehyung | V,Hit The Lights,M/M,No,Yes,14 Dec 2015,"4,793",Explicit,No Archive Warnings Apply,Drabble
방탄소년단 | Bangtan Boys | BTS,Jeon Jungkook/Kim Taehyung | V,Jeon Jeongguk | Jungkook/Kim Taehyung | V,lighting the fuse might result in a bang,M/M,No,Yes,03 Jan 2021,"4,782",Explicit,No Archive Warnings Apply,"Alternate Universe,Explicit Sexual Content,Semi-Public Sex,Car Sex,Enemy Lovers,Explicit Language,Sexual Tension,Bottom Kim Taehyung | V,Top Jeon Jungkook,Christmas,New Year's Eve,they're both bad at feelings,Smut,Blow Jobs,Plot What Plot/Porn Without Plot,Taehyung Hates Men,Light Body Shaming"
방탄소년단 | Bangtan Boys | BTS,Min Yoongi | Suga/Park Jimin,Jeon Jeongguk | Jungkook/Kim Taehyung | V,Crown in the Flames,M/M,No,Yes,06 Oct 2023,"4,776",Explicit,No Archive Warnings Apply,"Alternate Universe - Fantasy,Alternate Universe - Dragons,Alternate Universe - Royalty,Alternate Universe - Arranged Marriage,Alternate Universe - Magic,Dragon Min Yoongi | Suga,Dragon Kim Taehyung | V,Dragon Jung Hoseok | J-Hope,Dragon Kim Seokjin | Jin,Blind Jeon Jungkook,Past Jung Hoseok | J-Hope/Min Yoongi | Suga,Romance,Slow Burn,Explicit Sexual Content,Top Min Yoongi | Suga,Bottom Park Jimin (BTS)"
방탄소년단 | Bangtan Boys | BTS,Jeon Jungkook/Kim Taehyung | V,Jeon Jeongguk | Jungkook/Kim Taehyung | V,Kenopsia,M/M,No,Yes,18 Apr 2022,"4,770",Teen And Up Audiences,No Archive Warnings Apply,"Established Relationship,Break Up,Getting Back Together,Emotional Hurt/Comfort,Angst and Hurt/Comfort,Angst with a Happy Ending,Insecurity,Jealousy,Model Kim Taehyung | V,University Student Jeon Jungkook,Miscommunication,Misunderstandings,Idiots in Love,Unresolved Emotional Tension"
방탄소년단 | Bangtan Boys | BTS,Jeon Jungkook/Kim Taehyung | V,Jeon Jeongguk | Jungkook/Kim Taehyung | V,i see you a masterpiece (never a mess),M/M,No,Yes,17 Jul 2020,"4,766",Explicit,No Archive Warnings Apply,"Alternate Universe - Modern Setting,Chaebol Jeon Jungkook,Chaebol Kim Taehyung | V,Fake/Pretend Relationship,fake engagement,Strangers to Lovers,Friends to Lovers,Jealous Jeon Jungkook,Jealous Kim Taehyung | V,Kim Taehyung | V is Bad at Feelings,Jeon Jungkook is Whipped,Kim Taehyung | V is Whipped,Jeon Jungkook is a Sweetheart,Angst,Fluff,Explicit Sexual Content,Hurt/Comfort,Emotional Hurt/Comfort,Angst with a Happy Ending,Eventual Happy Ending,Eventual Romance,Family Drama,Dysfunctional Family,Family Issues,Painter Kim Taehyung | V,Businessman Jeon Jungkook,Top Jeon Jungkook,Bottom Kim Taehyung | V,One Night Stands,Lace,Lingerie,handjobs,Blowjobs,Anal Fingering,Anal Sex,slight exhibitionism,slowburn,This Kinda Also Shows The Bad Side Of Being A Chaebol"
방탄소년단 | Bangtan Boys | BTS,Jeon Jungkook/Kim Taehyung | V,Jeon Jeongguk | Jungkook/Kim Taehyung | V,you give me the whole damn zoo,M/M,No,Yes,11 Feb 2017,"4,758",Explicit,No Archive Warnings Apply,"Alternate Universe - High School,Hybrids,Bullying,Mating Cycles/In Heat,Phone Sex,(one sided really?),Anal Sex,it's really fluffly high school boyfriends okay?"
방탄소년단 | Bangtan Boys | BTS,Jeon Jungkook/Kim Taehyung | V,Jeon Jeongguk | Jungkook/Kim Taehyung | V,A Little Bit Dangerous (But Baby That's How I Want It),M/M,No,Yes,09 Oct 2016,"4,740",Explicit,Creator Chose Not To Use Archive Warnings,"Top Jungkook,Dom Jungkook,Police Officer Jungkook,Bottom Taehyung,Sub Taehyung,Student Taehyung,Sex on a Car,Rough Sex,Rough Oral Sex,Anal Sex,Anal Fingering,Face-Fucking,Facials,Hair-pulling,Handcuffs,Gun Kink,Name-Calling,Slut Shaming,Dirty Talk,Plot What Plot/Porn Without Plot,Implied/Referenced Drug Use,And alcohol too I guess"
방탄소년단 | Bangtan Boys | BTS,Jeon Jungkook/Kim Taehyung | V,Jeon Jeongguk | Jungkook/Kim Taehyung | V,Sabertooth,M/M,No,Yes,16 Apr 2021,"4,738",Explicit,Creator Chose Not To Use Archive Warnings,"Arranged Marriage,Angst and Fluff and Smut,Slow Romance,Fake/Pretend Relationship,Kim Seokjin | Jin & Kim Taehyung | V are Siblings,Single Parent Kim Namjoon | RM,Angst and Feels,Sexual Tension,Brooding Jeon Jungkook,whipped taekook,Mutual Pining,Mutual Masturbation,Hot Tub Sex,Implied/Referenced Suicide,Violence,Dirty Talk,Yacht Sex,Food Kink,Mile High Club,Switch Jeon Jungkook,Switch Kim Taehyung | V,Mushy,Kitchen Sex,Sassy Kim Taehyung | V,Original Character(s),Uncles Taekook,Love Confessions,Taehyung is a Hot Nerd,Scratch that- He's the hottest nerd,Falling In Love,CEO Jeon Jungkook,Angst with a Happy Ending,Enemies to Friends to Lovers,Enemies to Lovers"
방탄소년단 | Bangtan Boys | BTS,Jeon Jungkook/Kim Taehyung | V,Jeon Jeongguk | Jungkook/Kim Taehyung | V,you can leave a toothbrush (at my place),M/M,No,Yes,25 May 2016,"4,730",Explicit,Creator Chose Not To Use Archive Warnings,"Alternate Universe - College/University,Friends With Benefits To Lovers,I just made up that tag,Rivalry,Smoking,Non-Linear Narrative,many sex,Forbidden Love"
방탄소년단 | Bangtan Boys | BTS,Jeon Jeongguk | Jungkook/Kim Taehyung | V,Jeon Jeongguk | Jungkook/Kim Taehyung | V,Armani can't compare to you,M/M,No,Yes,16 May 2015,"4,722",Not Rated,No Archive Warnings Apply,
방탄소년단 | Bangtan Boys | BTS,Jeon Jungkook/Kim Taehyung | V,Jeon Jeongguk | Jungkook/Kim Taehyung | V,what is lost/what is left behind,M/M,No,Yes,05 May 2020,"4,721",Teen And Up Audiences,No Archive Warnings Apply,"Memory Loss,Post-Break Up,Alternate Universe,Angst with a Happy Ending,mentions of a car accident,Fluff"
방탄소년단 | Bangtan Boys | BTS,Jeon Jungkook/Kim Taehyung | V,Jeon Jeongguk | Jungkook/Kim Taehyung | V,Fade Into You,M/M,No,Yes,30 Jul 2020,"4,666",Explicit,No Archive Warnings Apply,"Alternate Universe - After College/University,Wedding,Aged-Up Character(s),College flashbacks,side established yoonmin,OT7 Friendship,Drinking,Past Relationship(s),First Love,Reunions,Ex-Boyfriends,Explicit Sexual Content,Time Skips,Coming of Age,Post-Break Up,New York City,Beach House,Some Humor,Smoking,Anal Sex,Anal Fingering,Oral Sex,Eventual Smut,Mild recreational drug use,Angst with a Happy Ending,Exes to Lovers"
방탄소년단 | Bangtan Boys | BTS,Jeon Jungkook/Kim Taehyung | V,Jeon Jeongguk | Jungkook/Kim Taehyung | V,Make You Mine (I Can Fuck You Better),M/M,No,Yes,23 Dec 2019,"4,646",Mature,Creator Chose Not To Use Archive Warnings,"taekook,vkook,Alternate Universe - College/University,College romance,College Roommates,jungkook and taehyung are roommates,and they were ROOMMATES,oh my god they were roommates,Mutual Pining,Sexual Tension,Cheating,Dubious Morality,Moral Grey Areas,Smut,Mildly Dubious Consent,slightly coerced sex,Dom/sub Undertones,Top Jeon Jungkook,Bottom Kim Taehyung | V,Tae is a sweetheart,jungkook is kind of an asshole,The Grumpy One is Soft For the Sunshine One,book nerd Tae,Computer Geek Jungkook,Jane Austen references,Possessive Jungkook,Jealous Jungkook,Whipped Jungkook,these two are complete IDIOTS with their feelings,side yoonmin"
방탄소년단 | Bangtan Boys | BTS,Jeon Jungkook/Kim Taehyung | V,Jeon Jeongguk | Jungkook/Kim Taehyung | V,Been There All Night,M/M,No,Yes,18 Feb 2017,"4,626",Explicit,Creator Chose Not To Use Archive Warnings,"Alternate Universe - Office,Alternate Universe - Lawyers,Lawyer Jeon Jungkook,Secretary Kim Taehyung,Paralegal Park Jimin,Minor Min Yoongi | Suga/Park Jimin,Jealous Kim Taehyung | V,Top Jeon Jungkook,Bottom Kim Taehyung | V,Taehyung is petty,Eventual Romance,Office Sex,Oral Sex,Clothed Sex,Dirty Talk"
방탄소년단 | Bangtan Boys | BTS,Jeon Jungkook/Kim Taehyung | V,Jeon Jeongguk | Jungkook/Kim Taehyung | V,Anyone Else But You,M/M,No,Yes,21 Oct 2017,"4,615",Explicit,Underage,"Alpha/Beta/Omega Dynamics,Alternate Universe - High School,Implied/Referenced Underage Sex,tense home life,Slice of Life,-Ish,Angst,Mpreg,Past Relationship(s)"
방탄소년단 | Bangtan Boys | BTS,Min Yoongi | Suga/Park Jimin,Jeon Jeongguk | Jungkook/Kim Taehyung | V,Soul Bond,M/M,No,Yes,20 Dec 2016,"4,614",Teen And Up Audiences,No Archive Warnings Apply,"yoonmin,Romance,Alternate Universe - Soulmates,Angst with a Happy Ending,Fluff,SO MUCH FLUFF,Alternate Universe - College/University,Min Yoongi/Park Jimin - Freeform,side Taekook - Freeform,side namjin,Yoongi is an asshole,as usual,but he has a reason I guess??,Jimin is a Sweetheart,taehyung is a good best friend,He's also a little shit,jungkook is a cutie,hoseok is oblivious,angsty but has a happy ending so never fear,Happy Ending,Slow Build,yoongi is so weak for jimin,no smut sorry kids,though vague mentions of sex,Mild Language,Emotional Hurt/Comfort,i felt like a monster writing this im so sorry"
방탄소년단 | Bangtan Boys | BTS,Jeon Jungkook/Kim Taehyung | V,Jeon Jeongguk | Jungkook/Kim Taehyung | V,The Geographical Cure,M/M,No,Yes,16 Apr 2017,"4,565",Explicit,No Archive Warnings Apply,"World Travel,Pining,Awkward Jeon Jungkook,Strangers to Lovers,Sexual Tension,Artist Jeon Jungkook,Literature Major Kim Taehyung,A Series of Cute Dates Where They Fall In Love,Deep Unbearable Denial,Explicit Sexual Content,Prague,Blow Jobs,Face-Fucking,Riding,slow burn?,Alternate Universe - College/University"
방탄소년단 | Bangtan Boys | BTS,Jeon Jungkook/Everyone,Jeon Jeongguk | Jungkook/Kim Taehyung | V,Doe-Eyed Mystery,M/M,No,Yes,16 Mar 2021,"4,562",General Audiences,No Archive Warnings Apply,"Alternate Universe - Fantasy,Light Angst,Supernatural Elements,Jeon Jungkook-centric,But mostly through the eyes of the hyungs,Trigger warnings before certain chapters,Fluff,No Romance,All Platonic - Freeform,OT7,Special Agents!BTS,Crime Scenes,Protective Min Yoongi | Suga,Protective Kim Taehyung | V,Protective Kim Seokjin | Jin,Protective Kim Namjoon | RM,Protective Park Jimin (BTS),Protective Jung Hoseok | J-Hope,Protective Hyungs,Hurt/Comfort,Domestic Fluff"
방탄소년단 | Bangtan Boys | BTS,Jeon Jungkook/Kim Taehyung | V,Jeon Jeongguk | Jungkook/Kim Taehyung | V,can you be (mine?),M/M,No,Yes,23 Mar 2016,"4,558",Mature,No Archive Warnings Apply,"Alternate Universe - College/University,Alternate Universe - Coffee Shops & Cafés,if you squint there some yoonmin,if you close your eyes and imagine the promise land there's chanbaek,haha i love starbucks,i love life,you are all blessings,vkook,taekook,re-rated for the sex ha ha,Social Networking,Twitter,Snapchat,theres just a bunch of social media in this shit i swear i dont know what happened"
방탄소년단 | Bangtan Boys | BTS,Jeon Jungkook/Kim Taehyung | V,Jeon Jeongguk | Jungkook/Kim Taehyung | V,night winds,M/M,No,Yes,27 Dec 2016,"5,116",Explicit,No Archive Warnings Apply,"Slow Burn,Friends to Lovers,Alpha/Beta/Omega Dynamics,Non-Traditional Alpha/Beta/Omega Dynamics,Mutual Pining,side yoonmin,Alternate Universe - College/University,Alpha Taehyung,Beta Jeongguk,Masturbation,Mating Cycles/In Heat,Trope Subversion,OT7,Friends With Benefits,TaEHyunG iS prECioUs,jeongguk is 24/7 emotionally constipated,and also a haikyuu fanboy,jimin is the best friend ever,Roommates,Smut,Heat Sex"
방탄소년단 | Bangtan Boys | BTS,Jeon Jungkook/Kim Taehyung | V,Jeon Jeongguk | Jungkook/Kim Taehyung | V,Show Me That You Need Me,M/M,No,Yes,18 May 2016,"5,082",Explicit,No Archive Warnings Apply,"Alpha/Beta/Omega Dynamics,Alpha Jungkook,Omega Taehyung,Knotting,Light Dom/sub,Biting,Submission"
방탄소년단 | Bangtan Boys | BTS,Jeon Jungkook/Kim Taehyung | V,Jeon Jeongguk | Jungkook/Kim Taehyung | V,Vitrail,M/M,No,Yes,31 Jul 2020,"5,079",Mature,Creator Chose Not To Use Archive Warnings,"Alternate Universe - Fantasy,Witch Jeon Jungkook,Witch Kim Taehyung | V,Top Kim Taehyung | V,Bottom Jeon Jungkook,pls dont read based on dynamic its not significant,Mention of blood,Violence,Heavy Angst,Slow Burn,Familiars,Eventual Smut,Fluff,lots and lots of magic,Jeon Jungkook & Park Jimin are Roommates,headmaster yoongi,Scholar Namjoon,Healer Seokjin,Witch Park Jimin (BTS),Hurt/Comfort,Happy Ending,abusive parenting,Nightmares,Minor Character Death,Implied/Referenced Child Abuse,Temporary Character Death,Alternate Universe - College/University,themes around death and death magic,no MC death ever though,Please read notes!,i keep being told the angst is just sad and not really heavy"
방탄소년단 | Bangtan Boys | BTS,Jeon Jungkook/Kim Taehyung | V,Jeon Jeongguk | Jungkook/Kim Taehyung | V,salt & ice,M/M,No,Yes,28 Jul 2021,"5,078",Explicit,No Archive Warnings Apply,"Alternate Universe - Modern Setting,Strangers to Lovers,Age Difference,Aged-Up Character(s),Investment Banker Taehyung,Grad Student Jungkook,Friends With Benefits,Angst,Fluff,Top Jeon Jungkook,Bottom Kim Taehyung | V"
방탄소년단 | Bangtan Boys | BTS,Jeon Jungkook/Kim Taehyung | V,Jeon Jeongguk | Jungkook/Kim Taehyung | V,"Break Your Record, Kim Taehyung",M/M,No,Yes,27 Jun 2020,"5,078",Teen And Up Audiences,"Creator Chose Not To Use Archive Warnings,No Archive Warnings Apply","Swimmer Kim Taehyung | V,Tsunderes,Fluff,Kim Taehyung | V is Whipped,Jealous Kim Taehyung | V,Jealous Jeon Jungkook,Alternate Universe - College/University,Top Kim Taehyung | V,Bottom Jeon Jungkook,Slut Shaming,Dirty Talk,Rimming,Accidental Dating,Kitchen Sex,Fluff and Smut,Kim Taehyung | V is Bad at Feelings,Love Confessions"
방탄소년단 | Bangtan Boys | BTS,Jeon Jeongguk | Jungkook/Kim Taehyung | V,Jeon Jeongguk | Jungkook/Kim Taehyung | V,And Suddenly You're All I Need,M/M,No,Yes,26 Mar 2015,"5,076",General Audiences,No Archive Warnings Apply,"Alternate Universe - Coffee Shops & Cafés,Sort Of"
방탄소년단 | Bangtan Boys | BTS,Jeon Jungkook/Kim Taehyung | V,Jeon Jeongguk | Jungkook/Kim Taehyung | V,Take Me Home,M/M,No,Yes,03 Jan 2016,"5,032",Not Rated,No Archive Warnings Apply,"Angst,Eventual Fluff,Hurt/Comfort"
방탄소년단 | Bangtan Boys | BTS,Jeon Jungkook/Kim Taehyung | V,Jeon Jeongguk | Jungkook/Kim Taehyung | V,IMMA BEAT THAT PUSSY,M/M,No,Yes,15 Feb 2019,"5,019",Teen And Up Audiences,"No Archive Warnings Apply,Creator Chose Not To Use Archive Warnings","Texting,Crack,Alternate Universe - College/University,Pining,Fake/Pretend Relationship,Fluff,OT7 Antics,there is no token het,they are kinda nasty"
방탄소년단 | Bangtan Boys | BTS,Jeon Jungkook/Everyone,Jeon Jeongguk | Jungkook/Kim Taehyung | V,Marked as Ours,M/M,No,Yes,25 Oct 2022,"5,004",Mature,Creator Chose Not To Use Archive Warnings,"OT7,Alternate Universe,Alternate Universe - Fantasy,Magic,Protective Hyungs,Fluff,Smut,Romance,Drama,Emotional Hurt/Comfort,Hurt/Comfort,True Mates,Soulmate-Identifying Marks,Soulmates,Protective Bangtan Boys | BTS,Jeon Jungkook is a Sweetheart,Jeon Jungkook Needs a Hug,Bangtan Boys | BTS is a Family,BTS is soft,Mythical Beings & Creatures,Falling In Love,Families of Choice,Past Child Abuse,Explicit Sexual Content,Ambiguous/Open Ending"
방탄소년단 | Bangtan Boys | BTS,Jeon Jungkook/Kim Taehyung | V,Jeon Jeongguk | Jungkook/Kim Taehyung | V,a game of survival,M/M,No,Yes,28 May 2020,"5,000",Explicit,Graphic Depictions Of Violence,"Alternate Universe - Vampire,Fantasy,Vampires,Vampire Kim Taehyung | V,Vampire Hunter Jeon Jungkook,Clans,Violence,Blood Drinking,Hate to Love,kind of,Love to Hate to Love really,scientific experimentation,side yoonmin,Eventual Smut,Blow Jobs,Anal Sex,Blood Kink,Top Jeon Jungkook,Bottom Kim Taehyung | V,Top Kim Taehyung | V,Bottom Jeon Jungkook,Mates,Character Death (see notes)"
방탄소년단 | Bangtan Boys | BTS,Jeon Jungkook/Kim Taehyung | V,Jeon Jeongguk | Jungkook/Kim Taehyung | V,Brace Face,M/M,No,Yes,28 Jan 2019,"4,990",Not Rated,Creator Chose Not To Use Archive Warnings,"Alternate Universe - High School,jungkook is a jock,taehyung is in band,jimin and tae are the nerdy dream team I've always wanted,Fluff,tae has braces and glasses,Nerds vs Jocks,lets go I love stereotypes,Battlestar Galactica References"
방탄소년단 | Bangtan Boys | BTS,Jeon Jungkook/Kim Taehyung | V,Jeon Jeongguk | Jungkook/Kim Taehyung | V,"and i get to kiss you, baby, just because i can",M/M,No,Yes,05 Mar 2017,"4,973",Mature,No Archive Warnings Apply,"Alternate Universe,Established Relationship,Time Skips,College,Arguing,Domestic Fluff,Drabble,Multiple Pov,Angst,Smut,Alcohol"
방탄소년단 | Bangtan Boys | BTS,Jeon Jungkook/Everyone,Jeon Jeongguk | Jungkook/Kim Taehyung | V,Interventions,M/M,No,Yes,12 Aug 2020,"4,959",Explicit,Rape/Non-Con,"Cock Cages,Non-Consensual Bondage,Pacifiers,Emotional Manipulation,Sexual Coercion,Bunny Hybrid Jeon Jungkook,Oral Fixation,Humiliation,Non-Consensual Spanking,Bondage,Nipple Play,Bottom Jeon Jungkook,Jeon Jungkook-centric,Masturbation,Pet Names,Accidental Voyeurism,Alternate Universe,Crying,Embarrassment,Situational Humiliation,Praise Kink,Chastity Device,Finger Sucking,Self-Lubrication,No Safeword,Begging,Hyung Kink,Orgasm Delay/Denial,Orgasm Denial,Size Difference,Size Kink,Small Penis,Verbal Humiliation,Manipulation,Coercion,Spanking,Sexual Frustration,Dubious Consent,Needy Jeon Jungkook,Daddy Kink,Non-Consensual Body Modification,Diapers,Forced Infantilism,Loss of independence,forced age play,Dark,Rape/Non-con Elements,Brainwashing,Dubious Morality,No Aftercare,Power Imbalance,Evil hyungs,Forced Chastity,Forced Regression,sexual age play,Gaslighting,Blow Jobs,Discipline,Punishment,Pet Play,forced pet play,Helpless Jungkook,diaper use,Fucking Machines,ABDL,Dead Dove: Do Not Eat"
방탄소년단 | Bangtan Boys | BTS,Jeon Jungkook/Kim Taehyung | V,Jeon Jeongguk | Jungkook/Kim Taehyung | V,Night Ride,M/M,No,Yes,26 Sep 2017,"4,953",Mature,No Archive Warnings Apply,"Hate to Love,Mild Hurt/Comfort,Hate Sex,Orgasm Denial,Anal Sex,Alternate Universe - Grocery Store,Bottom Kim Taehyung | V,Top Jeon Jungkook,Minor Kim Namjoon | Rap Monster/Kim Seokjin | Jin,like its just mentioned,Pining,Rough Sex,basically jungkook Is done with taes bs and hate fucks the living day lights out of him,Jeon Jungkook in Denial,Fake/Pretend Relationship,im gonna turn this into a whole fic perhaps,Clothed Sex,Voyeurism,Car Sex,Road Head,Public Sex,Praise Kink,Dysfunctional Relationships,Jealousy,jhope is just mentioned rn soz,Ferris Wheel Sex,Fluff and Smut,does this have a plot???? in my mind it does but I'm the author so idk,theres hella smut tho,Spit As Lube,Angst and Fluff and Smut,Light Bondage,Light Dom/sub,Jeon Jungkook is Bad at Feelings,also hes dom as shit,Spanking,Body Worship,how did this fic get this long holy shit,uhhhhh what was I gonna tag,oh right,Mirror Sex,Sex Toys,Vibrators,Kim Taehyung | V & Park Jimin are Best Friends,Road Trips,Alternate Universe - College/University"
방탄소년단 | Bangtan Boys | BTS,Jeon Jungkook/Kim Taehyung | V,Jeon Jeongguk | Jungkook/Kim Taehyung | V,I Wanna Burn with You Tonight,M/M,No,Yes,05 Feb 2018,"4,942",Explicit,Creator Chose Not To Use Archive Warnings,"Alpha/Beta/Omega Dynamics,Omega Verse,Smut,Top Kim Taehyung | V,Bottom Jeon Jungkook,Knotting,Self-Lubrication,Mating Cycles/In Heat,Barebacking,Best Friends,Alternate Universe - College/University,Alpha Kim Taehyung | V,Omega Jeon Jungkook,Mutual Pining,Light Angst,Pheromones,Porn with Feelings,Porn With Plot,mentioned namjin,Rimming"
방탄소년단 | Bangtan Boys | BTS,Jeon Jungkook/Kim Taehyung | V/Park Jimin,Jeon Jeongguk | Jungkook/Kim Taehyung | V,The one with dom Jeongguk (but not really),M/M,No,Yes,23 Jul 2019,"4,918",Explicit,No Archive Warnings Apply,"vminkook,Poly Relationship,Polyamory,Threesome - M/M/M,Dom/sub,Dom Park Jimin (BTS),Sub Kim Taehyung | V,Sub Jeon Jungkook,jungkook tries to be a dom,Anal Sex,Anal Fingering,Blowjobs,Praise Kink,Aftercare,No Aftercare,but they don't realise he needs it,Angst with a Happy Ending,Angst,Fluff and Angst,Hurt/Comfort,Smut,Under-negotiated Kink,under negotiated bdsm"
방탄소년단 | Bangtan Boys | BTS,Jeon Jungkook/Kim Taehyung | V,Jeon Jeongguk | Jungkook/Kim Taehyung | V,Trouble I'm In,M/M,No,Yes,20 May 2018,"4,907",Mature,Creator Chose Not To Use Archive Warnings,"the crossdressing jeongguk au that no one asked for,Depression,Anxiety,mild ocd,Kim Taehyung | V is Bad at Feelings,like really bad at feelings,he's also bad at coping,jeongguk likes feminine clothing,Prostitution,sugardaddy!taehyung,sugarbaby!jeongguk,Misunderstandings,Internalized Homophobia,Homophobic Language,Implied/Referenced Homophobia,Aged up characters,Shameless Smut,don't let the summary fool you this is more plot than just smut,Fluff and Angst,Bottom Jeon Jungkook,Car Sex"
방탄소년단 | Bangtan Boys | BTS,Min Yoongi | Suga/Park Jimin,Jeon Jeongguk | Jungkook/Kim Taehyung | V,shut up and drive,M/M,No,Yes,15 Aug 2017,"4,901",Explicit,No Archive Warnings Apply,"Alternate Universe - Car Racing,Racing,Street Racing,Park Jimin Is a Little Shit,Min Yoongi | Suga is So Done,this was supposed to be porn without plot,but its got plot now so,Porn With Plot,this is 12k of sin and that's a mistake,Bottom Park Jimin,Power Bottom Park Jimin,Top Min Yoongi | Suga,Blow Jobs,Public Blow Jobs,Exhibitionism,Coming In Pants,Anal Fingering,Fingerfucking,Oral Sex,Come Eating,Spanking,Anal Sex,Butt Plugs,Riding,Car Sex,Sex in a Car,Praise Kink"
