fandom,relationship,taggedRel,title,relType,isCanon,isRPF,datetime,kudos,rating,warnings,tags
The 100 (TV),Bellamy Blake/Clarke Griffin,Bellamy Blake/Clarke Griffin,First Comes Love,F/M,Semi-Canon,No,19 May 2018,"1,430",General Audiences,No Archive Warnings Apply,"Alternate Universe - Modern Setting,Modern Royalty"
The 100 (TV),Bellamy Blake/Clarke Griffin,Bellamy Blake/Clarke Griffin,Kiss the Ugly Property Brother to Make the Handsome Property Brother Jealous,F/M,Semi-Canon,No,14 Mar 2019,"1,495",Teen And Up Audiences,No Archive Warnings Apply,"Alternate Universe - Reality Show,Home Improvement"
The 100 (TV),Bellamy Blake/Clarke Griffin,Bellamy Blake/Clarke Griffin,"Just the Fax, Ma'am",F/M,Semi-Canon,No,04 Sep 2017,"1,494",Teen And Up Audiences,No Archive Warnings Apply,Alternate Universe - Modern Setting
The 100 (TV),Bellamy Blake/Clarke Griffin,Bellamy Blake/Clarke Griffin,For a While I Heard You Missing Steps In the Street,F/M,Semi-Canon,No,17 Apr 2017,"1,493",Teen And Up Audiences,No Archive Warnings Apply,"Alternate Universe - Fantasy,Witchcraft"
The 100 (TV),Bellamy Blake/Clarke Griffin,Bellamy Blake/Clarke Griffin,"By All Accounts, It Doesn't Make Sense",F/M,Semi-Canon,No,27 Apr 2015,"1,489",Teen And Up Audiences,No Archive Warnings Apply,"Alternate Universe - Modern Setting,Animal Transformation,Crack"
The 100 (TV),Bellamy Blake/Clarke Griffin,Bellamy Blake/Clarke Griffin,This Part of the Day Bewilders Me,F/M,Semi-Canon,No,20 May 2017,"1,483",Teen And Up Audiences,No Archive Warnings Apply,"Alternate Universe - Modern Setting,Kid Fic"
The 100 (TV),Bellamy Blake/Clarke Griffin,Bellamy Blake/Clarke Griffin,"Alas and Alack, You Just Don't Call Me Back",F/M,Semi-Canon,No,04 Feb 2016,"1,482",General Audiences,No Archive Warnings Apply,"Alternate Universe - Modern Setting,Social Media"
The 100 (TV),Bellamy Blake/Clarke Griffin,Bellamy Blake/Clarke Griffin,The Cracks in Our Armor,F/M,Semi-Canon,No,28 Aug 2017,"1,481",Mature,No Archive Warnings Apply,"Bellarke,TheBashuflPoet,Alternate Universe,Alternate Universe - College/University,Alternate Universe - Modern Setting,Slow Build,Slow Burn,Clarke Griffin & John Murphy Friendship,Octavia Ships It,Clarke/Jasper/Monty science bro friendship,Murphy is an Ass,but like a lovable one,Miller is done with everyone's shit,slow that's like fiery pit of hell slow,Or so I've been told,Angst,Angst with a Happy Ending,Emotional Hurt/Comfort"
The 100 (TV),Bellamy Blake/Clarke Griffin,Bellamy Blake/Clarke Griffin,The Weather Outside Is Frightful,F/M,Semi-Canon,No,15 May 2017,"1,480",Explicit,No Archive Warnings Apply,"Alternate Universe - Modern Setting,Sharing a Bed"
The 100 (TV),Bellamy Blake/Clarke Griffin,Bellamy Blake/Clarke Griffin,"Treading On Water, Cause I Never Learned To Swim",F/M,Semi-Canon,No,20 Apr 2017,"1,477",Mature,Creator Chose Not To Use Archive Warnings,"Friends to Lovers,Alternate Universe - Modern Setting,Alternate Universe - College/University,""I'm in love with you and I didn't know it"",Best Friends,The Delinquents are a big family,Lots of drinking,Beach Trip,Angst,Fluff,Sea mechanic"
The 100 (TV),Bellamy Blake/Clarke Griffin,Bellamy Blake/Clarke Griffin,Cause I Try and I Try and I Try,F/M,Semi-Canon,No,29 Oct 2015,"1,476",Teen And Up Audiences,No Archive Warnings Apply,Alternate Universe - College/University
The 100 (TV),Bellamy Blake/Clarke Griffin,Bellamy Blake/Clarke Griffin,you don't know the chances,F/M,Semi-Canon,No,20 Nov 2014,"1,475",Teen And Up Audiences,No Archive Warnings Apply,Spoilers for 2x05
The 100 (TV),Bellamy Blake/Clarke Griffin,Bellamy Blake/Clarke Griffin,"Turn You On, Turn You Up, Figure You Out",F/M,Semi-Canon,No,21 Jul 2015,"1,474",Explicit,No Archive Warnings Apply,Alternate Universe - Met on the Ark
The 100 (TV),Bellamy Blake/Clarke Griffin,Bellamy Blake/Clarke Griffin,You Look As Good As The Day I Met You,F/M,Semi-Canon,No,23 Dec 2016,"1,473",Teen And Up Audiences,Creator Chose Not To Use Archive Warnings,"Alternate Universe - Modern Setting,Enemies to Friends to Lovers,Mutual Pining"
The 100 (TV),Bellamy Blake/Clarke Griffin,Bellamy Blake/Clarke Griffin,this is ourselves,F/M,Semi-Canon,No,23 Sep 2016,"1,473",Explicit,No Archive Warnings Apply,"Post-Season/Series 03,Plot What Plot/Porn Without Plot"
The 100 (TV),Bellamy Blake/Clarke Griffin,Bellamy Blake/Clarke Griffin,"Before We Get Going, Here's Some Books I'd Like You to Read",F/M,Semi-Canon,No,11 Mar 2017,"1,472",Teen And Up Audiences,No Archive Warnings Apply,Alternate Universe - Modern Setting
The 100 (TV),Bellamy Blake/Clarke Griffin,Bellamy Blake/Clarke Griffin,All Peeling Thunder,F/M,Semi-Canon,No,27 Apr 2016,"1,470",Teen And Up Audiences,No Archive Warnings Apply,"Alternate Universe - Modern Setting,Female Friendship,Girl Power,Angst,Hurt/Comfort,Alternate Universe - Soulmates,Soulmate-Identifying Marks,Soulmates"
The 100 (TV),Bellamy Blake/Clarke Griffin,Bellamy Blake/Clarke Griffin,Lost Children,F/M,Semi-Canon,No,09 Dec 2014,"1,464",General Audiences,No Archive Warnings Apply,"Alternate Universe - Canon Divergence,Fluff,Future Fic,Just some happy moments,3+1"
The 100 (TV),Bellamy Blake/Clarke Griffin,Bellamy Blake/Clarke Griffin,bite your friend like chocolate,F/M,Semi-Canon,No,21 Jan 2019,"1,463",Explicit,No Archive Warnings Apply,"Alternate Universe - Modern Setting,High School,Best Friends to Lovers,Mutual Pining,Semi-Public Sex,Loss of Virginity,Fluff,Explicit Sexual Content,Masturbation,Football player!Bellamy"
The 100 (TV),Bellamy Blake/Clarke Griffin,Bellamy Blake/Clarke Griffin,How'd We Get In This Position,F/M,Semi-Canon,No,29 Jun 2019,"1,457",Teen And Up Audiences,No Archive Warnings Apply,Alternate Universe - Modern Setting
The 100 (TV),Bellamy Blake/Clarke Griffin,Bellamy Blake/Clarke Griffin,Check Me Out,F/M,Semi-Canon,No,28 Jan 2018,"1,455",Explicit,No Archive Warnings Apply,"Alternate Universe - Modern Setting,Plot What Plot/Porn Without Plot,Exhibitionism"
The 100 (TV),Bellamy Blake/Clarke Griffin,Bellamy Blake/Clarke Griffin,The Color of Grief,F/M,Semi-Canon,No,16 Oct 2018,"1,528",Teen And Up Audiences,Creator Chose Not To Use Archive Warnings,"synesthesia!Clarke,gradstudent!Bellamy,Enemies to Friends to Lovers,Because I'm a slut for a good enemies to lovers story,grief recovery,This is definitely a happy/sad kinda fic,recovering from grief,Found Families,all the brotps you can't stop me,Alternate Universe - Modern Setting,Attempted Sexual Assault,Trigger: Attempted Sexual Assault"
The 100 (TV),Bellamy Blake/Clarke Griffin,Bellamy Blake/Clarke Griffin,fucking magnets (how do they work),F/M,Semi-Canon,No,22 Jun 2017,"1,527",Explicit,No Archive Warnings Apply,"Alternate Universe - Modern Setting,Summer Camp,Magic"
The 100 (TV),Bellamy Blake/Clarke Griffin,Bellamy Blake/Clarke Griffin,the heavens hum a stun-gun lullaby,F/M,Semi-Canon,No,27 May 2018,"1,520",Teen And Up Audiences,Creator Chose Not To Use Archive Warnings,"Alternate Universe - Canon Divergence,Grounder Bellamy Blake,Alternate Universe - Soulmates"
The 100 (TV),Bellamy Blake/Clarke Griffin,Bellamy Blake/Clarke Griffin,tsubasa wa nai kedo,F/M,Semi-Canon,No,28 Apr 2016,"1,520",Teen And Up Audiences,No Archive Warnings Apply,"Alternate Universe - Modern Setting,Alternate Universe - Roommates/Housemates,Alternate Universe - Teachers"
The 100 (TV),Bellamy Blake/Clarke Griffin,Bellamy Blake/Clarke Griffin,See Me In Hindsight,F/M,Semi-Canon,No,11 Jul 2015,"1,520",Teen And Up Audiences,Creator Chose Not To Use Archive Warnings,"Alternate Universe - Modern Setting,Alternate Universe - College/University"
The 100 (TV),Bellamy Blake/Clarke Griffin,Bellamy Blake/Clarke Griffin,I Swear I'm Going to Bite You Hard And Taste Your Tinny Blood,F/M,Semi-Canon,No,16 Jun 2016,"1,519",Teen And Up Audiences,No Archive Warnings Apply,"Alternate Universe - Modern Setting,Alternate Universe - Neighbors,Cats"
The 100 (TV),Bellamy Blake/Clarke Griffin,Bellamy Blake/Clarke Griffin,Count the Stars (Shining in Your Eyes),F/M,Semi-Canon,No,11 Aug 2017,"1,518",Explicit,Creator Chose Not To Use Archive Warnings,"Marriage of Convenience,Post-Season/Series 03,Plot What Plot/Porn Without Plot,Frottage,Mutual Masturbation,Mutual Pining"
The 100 (TV),Bellamy Blake/Clarke Griffin,Bellamy Blake/Clarke Griffin,one night to push and scream (and then relief),F/M,Semi-Canon,No,24 Dec 2015,"1,518",Explicit,Creator Chose Not To Use Archive Warnings,"Enemies to Friends to Lovers,Undercover as Married,Alternate Universe - Modern Setting,Alternative Universe - FBI,Smut"
The 100 (TV),Bellamy Blake/Clarke Griffin,Bellamy Blake/Clarke Griffin,One Deep Breath and One Big Step,F/M,Semi-Canon,No,04 Jun 2017,"1,517",Teen And Up Audiences,No Archive Warnings Apply,Alternate Universe - College/University
The 100 (TV),Bellamy Blake/Clarke Griffin,Bellamy Blake/Clarke Griffin,I'd Still Stare at You,F/M,Semi-Canon,No,25 May 2016,"1,517",Teen And Up Audiences,No Archive Warnings Apply,"Alternate Universe - Modern Setting,Alternate Universe - Soulmates,Soulmates"
The 100 (TV),Bellamy Blake/Clarke Griffin,Bellamy Blake/Clarke Griffin,Make My Messes Matter,F/M,Semi-Canon,No,16 Jan 2016,"1,517",Teen And Up Audiences,No Archive Warnings Apply,"Alternate Universe - Modern Setting,Alternate Universe - Werewolf,Domestic Fluff,Slow Burn"
The 100 (TV),Bellamy Blake/Clarke Griffin,Bellamy Blake/Clarke Griffin,I Don't Want To Be Your Friend (i wanna kiss your neck),F/M,Semi-Canon,No,02 Apr 2017,"1,516",Mature,Creator Chose Not To Use Archive Warnings,"Alternate Universe - Modern Setting,High School,Friends to Lovers"
The 100 (TV),Bellamy Blake/Clarke Griffin,Bellamy Blake/Clarke Griffin,I Threw Stones at the Stars (but the Whole Sky Fell),F/M,Semi-Canon,No,09 Oct 2017,"1,514",Explicit,No Archive Warnings Apply,"Future Fic,Fluff and Angst,Sexual Content,season two divergence,old school Bellarke"
The 100 (TV),Bellamy Blake/Clarke Griffin,Bellamy Blake/Clarke Griffin,Virtually Yours,F/M,Semi-Canon,No,12 Aug 2017,"1,512",Explicit,No Archive Warnings Apply,"Alternate Universe - Modern Setting,Alternate Universe - College/University,Friends With Benefits,Friendship,Some FLUFF! because I can't write a fic without it apparently,Explicit Sexual Content,Enemies to Friends to Lovers (sort of),Mutual Pining"
The 100 (TV),Bellamy Blake/Clarke Griffin,Bellamy Blake/Clarke Griffin,i know your call (despite my faults),F/M,Semi-Canon,No,08 Jul 2020,"1,511",Mature,No Archive Warnings Apply,"Alternate Universe - Werewolf,Alternate Universe - Supernatural Elements,Werewolf AU,like you needed another one,Sexual Tension,Friends to Lovers,Rating May Change,because of potential smut,I Will Go Down With This Ship,kinda slow burn,potential smut,I'm Going to Hell,certified garbage fire TM,no beta we die like men"
The 100 (TV),Bellamy Blake/Clarke Griffin,Bellamy Blake/Clarke Griffin,"Children No Longer Obey Their Parents, and Everyone Is Writing a Book",F/M,Semi-Canon,No,07 Jun 2016,"1,510",Teen And Up Audiences,No Archive Warnings Apply,"Alternate Universe - Modern Setting,Social Media"
The 100 (TV),Bellamy Blake/Clarke Griffin,Bellamy Blake/Clarke Griffin,Even If We're Just Dancing in the Dark,F/M,Semi-Canon,No,26 Aug 2015,"1,506",Explicit,Creator Chose Not To Use Archive Warnings,"Fake/Pretend Relationship,artist!Clarke,Teacher!Bellamy"
The 100 (TV),Bellamy Blake/Clarke Griffin,Bellamy Blake/Clarke Griffin,We Can Both Watch X-Files,F/M,Semi-Canon,No,15 Nov 2016,"1,501",Explicit,No Archive Warnings Apply,"Alternate Universe - Modern Setting,Plot What Plot/Porn Without Plot,Porn Watching"
The 100 (TV),Bellamy Blake/Clarke Griffin,Bellamy Blake/Clarke Griffin,Tied Knots,F/M,Semi-Canon,No,08 Nov 2015,"1,498",Mature,No Archive Warnings Apply,"Romance,Bellarke,Alternate Universe - Modern Setting,Drama,Angst,First Love,Absent Parents,College,Summer,Underage Drinking"
The 100 (TV),Bellamy Blake/Clarke Griffin,Bellamy Blake/Clarke Griffin,I'll Cater With All the Birds That I Can Kill,F/M,Semi-Canon,No,02 Apr 2019,"1,565",Teen And Up Audiences,No Archive Warnings Apply,"Alternate Universe - Urban Fantasy,Animal Transformation"
The 100 (TV),Bellamy Blake/Clarke Griffin,Bellamy Blake/Clarke Griffin,Just the Best I Ever Had,F/M,Semi-Canon,No,06 Feb 2018,"1,565",Explicit,No Archive Warnings Apply,Alternate Universe - College/University
The 100 (TV),Bellamy Blake/Clarke Griffin,Bellamy Blake/Clarke Griffin,Showing Off,F/M,Semi-Canon,No,05 May 2015,"1,563",Explicit,Underage,"Alternate Universe - Canon Divergence,Tumblr Prompt,Fluff,PWP,Bellamy just likes showing off his guns,believe it or not that's not metaphorical,but really they just keep marking each other the end,Secret Relationship"
The 100 (TV),Bellamy Blake/Clarke Griffin,Bellamy Blake/Clarke Griffin,I Hear You're Somewhere In the Sand,F/M,Semi-Canon,No,07 Sep 2018,"1,561",Explicit,No Archive Warnings Apply,"Alternate Universe - Modern Setting,Escort Service"
The 100 (TV),Bellamy Blake/Clarke Griffin,Bellamy Blake/Clarke Griffin,And You Can Have This Heart to Break,F/M,Semi-Canon,No,15 Jan 2017,"1,560",Explicit,No Archive Warnings Apply,"Alternate Universe - Modern Setting,Alternate Universe - Persuasion Fusion"
The 100 (TV),Bellamy Blake/Clarke Griffin,Bellamy Blake/Clarke Griffin,We Won't Have to Give Up a Thing (We'll Stay Who We Are),F/M,Semi-Canon,No,17 Jan 2018,"1,559",Teen And Up Audiences,No Archive Warnings Apply,"Alternate Universe - Modern Setting,Foster Care"
The 100 (TV),Bellamy Blake/Clarke Griffin,Bellamy Blake/Clarke Griffin,You're Just Another Recovering Heart,F/M,Semi-Canon,No,04 Dec 2017,"1,556",Mature,Creator Chose Not To Use Archive Warnings,"Post-Canon,Season/Series 04 Spoilers,Slow Burn"
The 100 (TV),Bellamy Blake/Clarke Griffin,Bellamy Blake/Clarke Griffin,And Catch You If You Should Fall,F/M,Semi-Canon,No,25 May 2017,"1,554",Teen And Up Audiences,No Archive Warnings Apply,"Alternate Universe - Modern Setting,Sharing a Bed"
The 100 (TV),Bellamy Blake/Clarke Griffin,Bellamy Blake/Clarke Griffin,devout,F/M,Semi-Canon,No,19 Feb 2023,"1,553",Explicit,Creator Chose Not To Use Archive Warnings,"Alternate Universe - Modern Setting,Smut,Tattoo artist Bellamy,Preacher's Daughter Clarke,Dual POV,Loss of Virginity,Religious Guilt,Corruption,Good Girl Bad Boy,Slow Burn,Christianity,Tattoos,Sexual Repression,sexual awakening,Age Difference,bet,Homophobia,Denial of Feelings,Angst,Jealousy,Possessive Behavior,Praise Kink,Cheating,Light Stalking,Sneaking Around"
The 100 (TV),Bellamy Blake/Clarke Griffin,Bellamy Blake/Clarke Griffin,Yesterday's Dress In a Complete Mess,F/M,Semi-Canon,No,29 Feb 2016,"1,552",Teen And Up Audiences,No Archive Warnings Apply,Alternate Universe - College/University
The 100 (TV),Bellamy Blake/Clarke Griffin,Bellamy Blake/Clarke Griffin,Darkest of Marks,F/M,Semi-Canon,No,29 Dec 2014,"1,551",Mature,"Creator Chose Not To Use Archive Warnings,No Archive Warnings Apply","AU,mature themes,Minor Character Death,First Time,Ark!AU"
The 100 (TV),Bellamy Blake/Clarke Griffin,Bellamy Blake/Clarke Griffin,Winners Don't Always Get Lucky Breaks,F/M,Semi-Canon,No,02 Jun 2015,"1,547",Mature,No Archive Warnings Apply,"Alternate Universe,Ark!AU,Alternate Universe - Arranged Marriage,Kid Fic"
The 100 (TV),Bellamy Blake/Clarke Griffin,Bellamy Blake/Clarke Griffin,This Is As Easy As Lovers Go,F/M,Semi-Canon,No,17 Feb 2016,"1,546",Mature,No Archive Warnings Apply,"Alternate Universe - Modern Setting,Friends With Benefits"
The 100 (TV),Bellamy Blake/Clarke Griffin,Bellamy Blake/Clarke Griffin,"In the Darkness of My Night, In the Brightness of My Day",F/M,Semi-Canon,No,01 Aug 2017,"1,545",Teen And Up Audiences,No Archive Warnings Apply,"Canon Compliant,Post-Season/Series 04"
The 100 (TV),Bellamy Blake/Clarke Griffin,Bellamy Blake/Clarke Griffin,And You May Ask Yourself,F/M,Semi-Canon,No,25 Apr 2017,"1,543",Mature,No Archive Warnings Apply,"Alternate Universe - Modern Setting,Alternate Universe - Neighbors"
The 100 (TV),Bellamy Blake/Clarke Griffin,Bellamy Blake/Clarke Griffin,The Dropship,F/M,Semi-Canon,No,25 Apr 2016,"1,539",Mature,Creator Chose Not To Use Archive Warnings,Ficlets
The 100 (TV),Bellamy Blake/Clarke Griffin,Bellamy Blake/Clarke Griffin,Champion Alcoholics,F/M,Semi-Canon,No,23 Oct 2017,"1,537",Teen And Up Audiences,No Archive Warnings Apply,Alternate Universe - College/University
The 100 (TV),Bellamy Blake/Clarke Griffin,Bellamy Blake/Clarke Griffin,My Heart Wasn't Satisfied,F/M,Semi-Canon,No,23 Apr 2016,"1,535",Explicit,No Archive Warnings Apply,"Alternate Universe - Modern Setting,Witches,Curses,Smut,Fluff,Humor,Alternate Universe - Soulmates,in a weird kind of way,Masturbation,Sexual Frustration,Friends to Lovers"
The 100 (TV),Bellamy Blake/Clarke Griffin,Bellamy Blake/Clarke Griffin,Forbidden Fruit,F/M,Semi-Canon,No,22 Jul 2017,"1,534",Mature,Creator Chose Not To Use Archive Warnings,"Bellarke,Bar Fight,Hospitals,AU,alternative universe,Romance,revaltions,Doctor Clarke,Neighbors,Flirting,Drunken Confessions,Fluff,Slow Burn,Slow Burn Bellamy Blake/Clarke Griffin,best friends brother,Forbidden Fruit,Alternate Universe - Modern Setting,Modern AU,multi-chapter,Friends With Benefits,detective! Bellamy,Mentions of past,mentions of Wells,Minor Octavia Blake/Lincoln,Firefighter Raven Reyes,ski trips,Thanksgiving,jealous! Clarke,jealous! Bellamy,Other Additional Tags to Be Added,New Year's Eve,New Year's Kiss,Panic Attacks,Parties,Christmas,Holidays,Secret Santa,possible pregnancy,Wedding Planning,Angst,Minor Jasper Jordan/Maya Vie,Trigger Warnings,Drunk confessions,Attempted Sexual Assault,Gunshot Wounds,Doctor! Clarke,rated M for language and implications,no real smut"
The 100 (TV),Bellamy Blake/Clarke Griffin,Bellamy Blake/Clarke Griffin,Bet On It,F/M,Semi-Canon,No,21 Apr 2017,"1,533",Teen And Up Audiences,No Archive Warnings Apply,Alternate Universe - Modern Setting
The 100 (TV),Bellamy Blake/Clarke Griffin,Bellamy Blake/Clarke Griffin,"Chemical, Physical, Kryptonite",F/M,Semi-Canon,No,16 Jan 2016,"1,614",Explicit,No Archive Warnings Apply,"Alternate Universe - Modern Setting,Tumblr Prompt,Friends With Benefits,Friends to Lovers,Fluff,Smut,basically a lot of sex and then oops feelings,4x1,POV Multiple"
The 100 (TV),Bellamy Blake/Clarke Griffin,Bellamy Blake/Clarke Griffin,Deep as Lakes and Dark as Stars,F/M,Semi-Canon,No,11 Jun 2015,"1,602",Explicit,No Archive Warnings Apply,"Plot What Plot/Porn Without Plot,Post-Season/Series 02,Mild Spoilers"
The 100 (TV),Bellamy Blake/Clarke Griffin,Bellamy Blake/Clarke Griffin,"you're a shining star, you'll do great in LA",F/M,Semi-Canon,No,12 Aug 2016,"1,595",Teen And Up Audiences,No Archive Warnings Apply,Alternate Universe - Hollywood
The 100 (TV),Bellamy Blake/Clarke Griffin,Bellamy Blake/Clarke Griffin,Willing to Make a Deal,F/M,Semi-Canon,No,30 Jun 2018,"1,594",Teen And Up Audiences,No Archive Warnings Apply,"Alternate Universe - Urban Fantasy,Minor Bellamy Blake/Echo"
The 100 (TV),Bellamy Blake/Clarke Griffin,Bellamy Blake/Clarke Griffin,so put your hands down my pants and I bet you'll feel nuts,F/M,Semi-Canon,No,24 Jul 2015,"1,593",Mature,No Archive Warnings Apply,"Alternate Universe - College/University,Alcohol"
The 100 (TV),Bellamy Blake/Clarke Griffin,Bellamy Blake/Clarke Griffin,Ice,F/M,Semi-Canon,No,15 Sep 2016,"1,591",Teen And Up Audiences,Creator Chose Not To Use Archive Warnings,"High School AU,Slow Burn,Bellarke,figure skating,Hockey,Rivalry,Vitriolic Best Buds,AU,Alternate Universe"
The 100 (TV),Bellamy Blake/Clarke Griffin,Bellamy Blake/Clarke Griffin,Nothing But Affection For All Those Who've Sailed With Me,F/M,Semi-Canon,No,18 May 2016,"1,589",Teen And Up Audiences,No Archive Warnings Apply,"Alternate Universe - Fantasy,Alternate Universe - Royalty"
The 100 (TV),Bellamy Blake/Clarke Griffin,Bellamy Blake/Clarke Griffin,What Team?,F/M,Semi-Canon,No,02 Jan 2016,"1,589",General Audiences,No Archive Warnings Apply,Alternate Universe - College/University
The 100 (TV),Bellamy Blake/Clarke Griffin,Bellamy Blake/Clarke Griffin,once bitten,F/M,Semi-Canon,No,30 Jan 2023,"1,587",Explicit,Graphic Depictions Of Violence,"Alpha/Beta/Omega Dynamics,Alternate Universe - Mob,Organized Crime,Arranged Marriage,Alternate Universe - Modern Setting,Mating Cycles/In Heat,Mating Bites,Alpha Bellamy Blake,Omega Clarke Griffin,Smut,and some more smut,and uh some more smut,Loss of Virginity,mafia,Mob Boss Bellamy,Angst,probably,Enemies to Lovers,Blood and Violence,Possessive Sex,Come Marking,Breeding Kink"
The 100 (TV),Bellamy Blake/Clarke Griffin,Bellamy Blake/Clarke Griffin,Morning Is A Long Way Down,F/M,Semi-Canon,No,29 May 2014,"1,587",Teen And Up Audiences,No Archive Warnings Apply,
The 100 (TV),Bellamy Blake/Clarke Griffin,Bellamy Blake/Clarke Griffin,i saw the devil in the mirror last night,F/M,Semi-Canon,No,10 Feb 2015,"1,586",Mature,"Graphic Depictions Of Violence,Major Character Death","yet another,zombie apocalypse AU,rag tag bunch,Angst,Slow Build"
The 100 (TV),Bellamy Blake/Clarke Griffin,Bellamy Blake/Clarke Griffin,And Done With,F/M,Semi-Canon,No,21 Feb 2016,"1,583",Explicit,No Archive Warnings Apply,"Alternate Universe - Roommates/Housemates,Casual Sex"
The 100 (TV),Bellamy Blake/Clarke Griffin,Bellamy Blake/Clarke Griffin,Emergency Contacts,F/M,Semi-Canon,No,13 Jun 2017,"1,579",Teen And Up Audiences,No Archive Warnings Apply,"Hurt/Comfort,Friends to Lovers,Strangers to Lovers,police officer!bellamy,artist!Clarke,Alternate Universe - Modern Setting,Slow Burn"
The 100 (TV),Bellamy Blake/Clarke Griffin,Bellamy Blake/Clarke Griffin,Clothes Make the Man,F/M,Semi-Canon,No,26 Jan 2020,"1,576",Explicit,No Archive Warnings Apply,"Alternate Universe - Modern Setting,Minor Monty Green/Nathan Miller,Minor Raven Reyes/Gina Martin,Boxers"
The 100 (TV),Bellamy Blake/Clarke Griffin,Bellamy Blake/Clarke Griffin,Time Is On Our Side,F/M,Semi-Canon,No,16 Apr 2017,"1,576",Teen And Up Audiences,No Archive Warnings Apply,"Alternate Universe - Modern Setting,Fake/Pretend Relationship"
The 100 (TV),Bellamy Blake/Clarke Griffin,Bellamy Blake/Clarke Griffin,Forget the World,F/M,Semi-Canon,No,15 Apr 2015,"1,576",General Audiences,No Archive Warnings Apply,"Alternate Universe - Canon Divergence,Future Fic,Fluff,POV Multiple,Another 3+1,yup back to that,complete and utter fluff,basically I just wanted them to hold each other a lot"
The 100 (TV),Bellamy Blake/Clarke Griffin,Bellamy Blake/Clarke Griffin,Friends Lock,F/M,Semi-Canon,No,09 Jun 2017,"1,571",Teen And Up Audiences,No Archive Warnings Apply,Alternate Universe - Hollywood
The 100 (TV),Bellamy Blake/Clarke Griffin,Bellamy Blake/Clarke Griffin,you might as well be the devil,F/M,Semi-Canon,No,14 Oct 2016,"1,570",Teen And Up Audiences,No Archive Warnings Apply,"Alternate Universe - College/University,Alternate Universe - Soulmates,Soulmate-Identifying Marks,Denial,Pining,Slow Burn,Enemies to Friends to Lovers"
The 100 (TV),Bellamy Blake/Clarke Griffin,Bellamy Blake/Clarke Griffin,coastal waters,F/M,Semi-Canon,No,07 Aug 2021,"1,568",Mature,No Archive Warnings Apply,"Intimacy,Future Fic,Slow Burn,Domestic Fluff,Mostly Fluff,Little bit of angst,grounder tattoos,Minor Character Death,Haircuts,nuclear bunker exploring!,Dancing!,Smut,happy fic"
The 100 (TV),Bellamy Blake/Clarke Griffin,Bellamy Blake/Clarke Griffin,Risk/Reward,F/M,Semi-Canon,No,26 Nov 2015,"1,567",Explicit,No Archive Warnings Apply,"Alternate Universe - Modern Setting,Childhood Friends,Kid Fic"
The 100 (TV),Bellamy Blake/Clarke Griffin,Bellamy Blake/Clarke Griffin,The One Who Lies Close to Me,F/M,Semi-Canon,No,09 Apr 2016,"1,664",Teen And Up Audiences,No Archive Warnings Apply,"Alternate Universe - Modern Setting,Loss of Parent(s)"
The 100 (TV),Bellamy Blake/Clarke Griffin,Bellamy Blake/Clarke Griffin,Dulce et Decorum Est (To Go Home and Get Some Rest),F/M,Semi-Canon,No,08 Apr 2015,"1,663",Teen And Up Audiences,No Archive Warnings Apply,Alternate Universe - High School
The 100 (TV),Bellamy Blake/Clarke Griffin,Bellamy Blake/Clarke Griffin,Just Gotta Get Right Outta Here,F/M,Semi-Canon,No,24 Jul 2016,"1,661",Teen And Up Audiences,No Archive Warnings Apply,Alternate Universe - Modern Setting
The 100 (TV),Bellamy Blake/Clarke Griffin,Bellamy Blake/Clarke Griffin,Waste It on Me,F/M,Semi-Canon,No,24 Nov 2019,"1,660",Explicit,Creator Chose Not To Use Archive Warnings,"Alternate Universe - Modern Setting,Soulmates,Reincarnation,Strangers to Lovers,Explicit Sexual Content,Explicit Language,Friendship,Friends to Lovers,Friends With Benefits,Angst,Smut,Fluff,Slow Burn,Mutual Pining,Drinking,Minor Violence,Mentions of Mental Illness,Depression,Panic Attacks,Emotional Hurt/Comfort,Past Alcohol Abuse/Alcoholism"
The 100 (TV),Bellamy Blake & Octavia Blake,Bellamy Blake/Clarke Griffin,"And Hides Her Somewhere In Herself, Safe From Harm",F/M,Semi-Canon,No,26 Mar 2016,"1,660",General Audiences,No Archive Warnings Apply,"Alternate Universe - Modern Setting,Parent Death,Implied/Referenced Child Abuse"
The 100 (TV),Bellamy Blake/Clarke Griffin,Bellamy Blake/Clarke Griffin,How to Woo Bellamy Blake in Five Minutes or Less,F/M,Semi-Canon,No,12 Jan 2015,"1,657",Mature,No Archive Warnings Apply,"Fluff and Crack,Humor,Feel-good,bellamy is oblivious,Mentions of Sex,Awkward Boners,Awkward Conversations,really this is 3800 plus words of bellamy being awkward and cursing a lot,pre 02x08?,light lime in chapter 3!,Complete"
The 100 (TV),Bellamy Blake/Clarke Griffin,Bellamy Blake/Clarke Griffin,"Nightly, Beside the Green, Green Grass",F/M,Semi-Canon,No,27 Oct 2016,"1,653",Explicit,No Archive Warnings Apply,"Alternate Universe - Modern Setting,Childhood Friends,Accidental Voyeurism"
The 100 (TV),Bellamy Blake/Clarke Griffin,Bellamy Blake/Clarke Griffin,the prime directive,F/M,Semi-Canon,No,14 Jul 2014,"1,643",Explicit,"Creator Chose Not To Use Archive Warnings,No Archive Warnings Apply","Sex Pollen,Explicit Sexual Content,Plot What Plot/Porn Without Plot"
