fandom,relationship,taggedRel,title,relType,isCanon,isRPF,datetime,kudos,rating,warnings,tags
The 100 (TV),Bellamy Blake/Clarke Griffin,Bellamy Blake/Clarke Griffin,You're The Only Home I Know,F/M,Semi-Canon,No,21 May 2016,"1,241",Teen And Up Audiences,Creator Chose Not To Use Archive Warnings,"Alternate Universe - Modern Setting,Alternate Universe - Neighbors,Pining,Domestic Fluff,Slow Burn"
The 100 (TV),Bellamy Blake/Clarke Griffin,Bellamy Blake/Clarke Griffin,Tell Me No More Stories and I'll Tell You No Lies,F/M,Semi-Canon,No,07 Jul 2015,"1,241",Teen And Up Audiences,No Archive Warnings Apply,"Alternate Universe - Fairy Tale,Alternate Universe - Beauty and the Beast"
The 100 (TV),Bellamy Blake/Clarke Griffin,Bellamy Blake/Clarke Griffin,A Heavy Heart to Carry,F/M,Semi-Canon,No,14 Nov 2021,"1,239",Teen And Up Audiences,Creator Chose Not To Use Archive Warnings,"Alternate Universe - Canon Divergence,Artificial Insemination,season 1 AU,Pregnancy,Slow Burn,Angst"
The 100 (TV),Bellamy Blake/Clarke Griffin,Bellamy Blake/Clarke Griffin,A Riddle In Nine Syllables,F/M,Semi-Canon,No,05 Jul 2015,"1,239",Teen And Up Audiences,No Archive Warnings Apply,"Alternate Universe - Modern Setting,Pregnancy"
The 100 (TV),Bellamy Blake/Clarke Griffin,Bellamy Blake/Clarke Griffin,You Should Say Hi,F/M,Semi-Canon,No,06 Feb 2015,"1,239",Mature,No Archive Warnings Apply,"Detective!Bellamy,Alternative Coffeeshop AU,They'll be the death of me,Fluff"
The 100 (TV),Bellamy Blake/Clarke Griffin,Bellamy Blake/Clarke Griffin,"My Affection, Well It Comes and Goes",F/M,Semi-Canon,No,26 Oct 2017,"1,235",Teen And Up Audiences,No Archive Warnings Apply,Alternate Universe - Modern Setting
The 100 (TV),Bellamy Blake/Clarke Griffin,Bellamy Blake/Clarke Griffin,What a Laugh It Would Have Been,F/M,Semi-Canon,No,03 Dec 2015,"1,235",General Audiences,No Archive Warnings Apply,"Alternate Universe - Modern Setting,Secret Relationship,Holidays"
The 100 (TV),Bellamy Blake/Clarke Griffin,Bellamy Blake/Clarke Griffin,A Friend For the End of the World,F/M,Semi-Canon,No,25 Mar 2017,"1,231",Explicit,No Archive Warnings Apply,"Season/Series 04,Fluff and Smut,Bellarke,Life-Affirming Sex,lots of feelings,Canon Divergent"
The 100 (TV),Bellamy Blake/Clarke Griffin,Bellamy Blake/Clarke Griffin,a soft epilogue,F/M,Semi-Canon,No,01 Feb 2016,"1,229",Teen And Up Audiences,No Archive Warnings Apply,"Season/Series 03 Spoilers,Friendship"
The 100 (TV),Bellamy Blake/Clarke Griffin,Bellamy Blake/Clarke Griffin,Instructions for Dancing,F/M,Semi-Canon,No,07 Feb 2016,"1,227",Teen And Up Audiences,No Archive Warnings Apply,Alternate Universe - Modern Setting
The 100 (TV),Bellamy Blake/Clarke Griffin,Bellamy Blake/Clarke Griffin,The Reason for the Season,F/M,Semi-Canon,No,11 Dec 2016,"1,226",General Audiences,No Archive Warnings Apply,"Alternate Universe - Modern Setting,Alternate Universe - Foster Family"
The 100 (TV),Bellamy Blake/Clarke Griffin,Bellamy Blake/Clarke Griffin,It's All Internet Interaction,F/M,Semi-Canon,No,19 Feb 2018,"1,225",Teen And Up Audiences,Creator Chose Not To Use Archive Warnings,"Alternate Universe - Modern Setting,Social Media,Alternate Universe - Hollywood,Enemies to Friends to Lovers"
The 100 (TV),Bellamy Blake/Clarke Griffin,Bellamy Blake/Clarke Griffin,Where We Are,F/M,Semi-Canon,No,23 Jan 2015,"1,224",General Audiences,No Archive Warnings Apply,"Future Fic,AU with children,I was in a mood,having mommy and daddy bellarke feels,this is a gross level of fluff,seriously though,Domestic Fluff,some Linctavia too,everyone's basically preggers and happy,Because I can,I just have too many feels"
The 100 (TV),Bellamy Blake/Clarke Griffin,Bellamy Blake/Clarke Griffin,here we go (just lose control and let your body give in),F/M,Semi-Canon,No,02 Jul 2014,"1,222",Mature,Creator Chose Not To Use Archive Warnings,"Mild Smut,nothing too graphic though,Quite a bit of swearing,Unwanted Attraction,Alternate Universe - Canon Divergence,And Parentheses,there are a lot of parentheses"
The 100 (TV),Bellamy Blake/Clarke Griffin,Bellamy Blake/Clarke Griffin,And Keep You Here With Me,F/M,Semi-Canon,No,29 Aug 2017,"1,221",Teen And Up Audiences,No Archive Warnings Apply,"Alternate Universe - Movie Fusion,That Thing You Do! AU,Minor Finn Collins/Clarke Griffin"
The 100 (TV),Bellamy Blake/Clarke Griffin,Bellamy Blake/Clarke Griffin,Seasons of Love,F/M,Semi-Canon,No,11 Apr 2016,"1,221",General Audiences,No Archive Warnings Apply,"Alternate Universe - Canon Divergence,Fluff,so much effing fluff,Babyfic,pregnancy fic,POV Multiple,Slight Hurt/Comfort,Pregnant Clarke,Worried Bellamy,that's basically it,happy ever after"
The 100 (TV),Bellamy Blake/Clarke Griffin,Bellamy Blake/Clarke Griffin,I Do Sing For You,F/M,Semi-Canon,No,21 May 2018,"1,265",Not Rated,No Archive Warnings Apply,"Drabbles,Alternate Universe - Modern Setting,Fluff,Smut"
The 100 (TV),Bellamy Blake/Clarke Griffin,Bellamy Blake/Clarke Griffin,Reminders,F/M,Semi-Canon,No,29 Nov 2015,"1,264",Explicit,No Archive Warnings Apply,"Fluff,Smut,Alternate Universe - Modern Setting"
The 100 (TV),Bellamy Blake/Clarke Griffin,Bellamy Blake/Clarke Griffin,The Boy With the Eager Eyes,F/M,Semi-Canon,No,10 Sep 2015,"1,264",Teen And Up Audiences,No Archive Warnings Apply,"Alternate Universe - Modern Setting,Age Swap"
The 100 (TV),Raven Reyes/Kyle Wick,Bellamy Blake/Clarke Griffin,The Fool Might Be My Middle Name,F/M,Semi-Canon,No,07 Jun 2015,"1,260",Teen And Up Audiences,No Archive Warnings Apply,"Alternate Universe - Canon Divergence,Minor Finn Collins/Raven Reyes"
The 100 (TV),Bellamy Blake/Clarke Griffin,Bellamy Blake/Clarke Griffin,A Hell of a Long Way Home,F/M,Semi-Canon,No,12 Jun 2018,"1,259",Teen And Up Audiences,No Archive Warnings Apply,Alternate Universe - Hogwarts
The 100 (TV),Bellamy Blake/Clarke Griffin,Bellamy Blake/Clarke Griffin,Like I Know My Own Mind,F/M,Semi-Canon,No,15 Mar 2016,"1,258",General Audiences,No Archive Warnings Apply,Alternate Universe - Modern Setting
The 100 (TV),Bellamy Blake/Clarke Griffin,Bellamy Blake/Clarke Griffin,Ad Multos Annos,F/M,Semi-Canon,No,24 May 2015,"1,258",General Audiences,No Archive Warnings Apply,Alternate Universe - Modern Setting
The 100 (TV),Bellamy Blake/Clarke Griffin,Bellamy Blake/Clarke Griffin,No-Shave November,F/M,Semi-Canon,No,01 Feb 2018,"1,257",Teen And Up Audiences,No Archive Warnings Apply,"Alternate Universe - Modern Setting,Minor Monty Green/Nathan Miller"
The 100 (TV),Bellamy Blake/Clarke Griffin,Bellamy Blake/Clarke Griffin,As Long As You Love Me,F/M,Semi-Canon,No,07 Jul 2018,"1,256",Mature,Creator Chose Not To Use Archive Warnings,"Amnesia,Reluctant Roommates,bed sharing,Eventual Smut,Mutual Pining,Bellamy can't catch a break,Fake Relationship,Slow Burn,Raven is a Mom,Aurora doesnt suck,Reluctant Housemates,Alternate Universe - Modern Setting,Smut"
The 100 (TV),Bellamy Blake/Clarke Griffin,Bellamy Blake/Clarke Griffin,these are the days that bind us,F/M,Semi-Canon,No,11 May 2014,"1,256",Teen And Up Audiences,Creator Chose Not To Use Archive Warnings,"Hurt/Comfort,Hurt Clarke,smooches"
The 100 (TV),Bellamy Blake/Clarke Griffin,Bellamy Blake/Clarke Griffin,Out With the Old and In With the New,F/M,Semi-Canon,No,21 Jun 2018,"1,255",Teen And Up Audiences,No Archive Warnings Apply,"Alternate Universe - Modern Setting,Reality TV"
The 100 (TV),Bellamy Blake/Clarke Griffin,Bellamy Blake/Clarke Griffin,Addicted,F/M,Semi-Canon,No,23 Jun 2014,"1,255",Not Rated,Creator Chose Not To Use Archive Warnings,"Fluff,Friends With Benefits,Friends to Lovers,dork!Bellamy,donewithyourshit!Clarke,Fake/Pretend Relationship"
The 100 (TV),Bellamy Blake/Clarke Griffin,Bellamy Blake/Clarke Griffin,where dwell the brave at heart,F/M,Semi-Canon,No,05 Jan 2015,"1,253",Teen And Up Audiences,No Archive Warnings Apply,"Alternate Universe,Alternate Universe - Hogwarts,it's a harry potter!au,Quidditch,Love/Hate Relationship"
The 100 (TV),Bellamy Blake/Clarke Griffin,Bellamy Blake/Clarke Griffin,I Think You're Cute,F/M,Semi-Canon,No,20 Nov 2016,"1,251",Not Rated,No Archive Warnings Apply,"Alternate Universe - Modern Setting,Social Media,Fluff and Humor,Friends to Lovers"
The 100 (TV),Bellamy Blake/Clarke Griffin,Bellamy Blake/Clarke Griffin,"and love, you taste like magic",F/M,Semi-Canon,No,26 Jun 2015,"1,249",Mature,No Archive Warnings Apply,"Alternate Universe - Modern Setting,Alternate Universe - Soulmates,Soulmate-Identifying Marks,Tattoos"
The 100 (TV),Bellamy Blake/Clarke Griffin,Bellamy Blake/Clarke Griffin,home is where the heart is,F/M,Semi-Canon,No,08 Sep 2014,"1,249",Mature,No Archive Warnings Apply,"Alternate Universe - Modern Setting,Fluff,Smut,Angst,All of the Feelings"
The 100 (TV),Bellamy Blake/Clarke Griffin,Bellamy Blake/Clarke Griffin,all the kids are talking slang i won’t pretend to understand,F/M,Semi-Canon,No,19 Apr 2016,"1,248",Not Rated,No Archive Warnings Apply,"Future Fic,(not very future-ish but well),Domestic Fluff,delinquent fluff,Fluff and Humor,CAN I BE ANY CLEARER THAT THIS IS STRAIGHT-UP FLUFF"
The 100 (TV),Bellamy Blake/Clarke Griffin,Bellamy Blake/Clarke Griffin,Love Me Tenure,F/M,Semi-Canon,No,10 Sep 2017,"1,246",Teen And Up Audiences,No Archive Warnings Apply,"Alternate Universe - Modern Setting,Alternate Universe - College/University,Texting"
The 100 (TV),Bellamy Blake/Clarke Griffin,Bellamy Blake/Clarke Griffin,Let Me Show You Them,F/M,Semi-Canon,No,02 May 2016,"1,245",General Audiences,No Archive Warnings Apply,"Alternate Universe - Coffee Shops & Cafés,Pokemon"
The 100 (TV),Bellamy Blake/Clarke Griffin,Bellamy Blake/Clarke Griffin,in the woods somewhere,F/M,Semi-Canon,No,04 Sep 2019,"1,244",Explicit,No Archive Warnings Apply,"Alternate Universe - Canon Divergence,Season/Series 01,Explicit Sexual Content,Hurt/Comfort,Sharing a Bed,just co-leaders with benefits... nothing to see here"
The 100 (TV),Bellamy Blake/Clarke Griffin,Bellamy Blake/Clarke Griffin,The Art of Disappearing,F/M,Semi-Canon,No,03 Feb 2016,"1,292",Mature,No Archive Warnings Apply,"Alternate Universe - Modern Setting,Fake Marriage,Slow Burn,Alternate Universe - Small Town,Witness Protection,Fluff and Angst,Minor Violence,Minor Character Death"
The 100 (TV),Bellamy Blake/Clarke Griffin,Bellamy Blake/Clarke Griffin,"the pedal's down, my eyes are closed",F/M,Semi-Canon,No,16 Mar 2015,"1,292",Mature,No Archive Warnings Apply,"Other characters in minor roles - Freeform,Alternate Universe - Modern Setting,Friends to Lovers"
The 100 (TV),Bellamy Blake/Clarke Griffin,Bellamy Blake/Clarke Griffin,Constant,F/M,Semi-Canon,No,07 Aug 2021,"1,290",Explicit,Creator Chose Not To Use Archive Warnings,"Bellarke,Alternate Universe - Modern Setting,Romance,Drama,Angst and Feels,Family Drama,Smut,Shameless Smut,Explicit Sexual Content,Explicit Language,Flashbacks,Minor John Murphy/Raven Reyes,Minor Octavia Blake/Lincoln,Minor Monty Green/Harper McIntyre,Minor Jasper Jordan/Maya Vie,Sex,Oral Sex,Anal Sex,group friendship,Big Brother Bellamy Blake,High School,College,Teen Years,Adulthood,Friendship/Love,Falling In Love,And you thought my other fics were long,sort of 2 stories in 1,Artist Clarke Griffin,football player Bellamy,Bellamy and Clarke are hot,Emotional Rollercoaster"
The 100 (TV),Bellamy Blake/Clarke Griffin,Bellamy Blake/Clarke Griffin,Not With Haste,F/M,Semi-Canon,No,29 Jun 2016,"1,288",General Audiences,No Archive Warnings Apply,"Alternate Universe - Post-Canon,Post Season 3,Future Fic,Fluff,Slow Burn,Fools in Love,the usual you know the drill"
The 100 (TV),Bellamy Blake/Clarke Griffin,Bellamy Blake/Clarke Griffin,there's an art to life's distractions,F/M,Semi-Canon,No,23 Apr 2018,"1,287",Explicit,No Archive Warnings Apply,"Roommates,Friends With Benefits"
The 100 (TV),Bellamy Blake/Clarke Griffin,Bellamy Blake/Clarke Griffin,and are we there yet (home),F/M,Semi-Canon,No,26 Jul 2017,"1,286",Teen And Up Audiences,No Archive Warnings Apply,"Single Parents,Fluff,POV Bellamy Blake"
The 100 (TV),Bellamy Blake/Clarke Griffin,Bellamy Blake/Clarke Griffin,a kiss is a secret which takes the lips for the ear,F/M,Semi-Canon,No,06 Dec 2014,"1,286",General Audiences,No Archive Warnings Apply,"Alternate Universe - Canon Divergence,5+1,Accidental Kissing,Oblivious"
The 100 (TV),Bellamy Blake/Clarke Griffin,Bellamy Blake/Clarke Griffin,Friends (I watched us as we changed),F/M,Semi-Canon,No,14 Apr 2015,"1,285",Teen And Up Audiences,No Archive Warnings Apply,"Alternate Universe - Modern Setting,Social Media,Fluff,Enemies to Friends to Lovers"
The 100 (TV),Bellamy Blake/Clarke Griffin,Bellamy Blake/Clarke Griffin,Waiting For a Winter To Be Done,F/M,Semi-Canon,No,06 Feb 2016,"1,283",General Audiences,No Archive Warnings Apply,"Alternate Universe - Modern Setting,Soulmate-Identifying Marks,Holidays"
The 100 (TV),Bellamy Blake/Clarke Griffin,Bellamy Blake/Clarke Griffin,Best Dad in the Universe,F/M,Semi-Canon,No,17 Jun 2018,"1,280",General Audiences,No Archive Warnings Apply,Alternate Universe - Modern Setting
The 100 (TV),Bellamy Blake/Clarke Griffin,Bellamy Blake/Clarke Griffin,The Story of How Hard We Tried,F/M,Semi-Canon,No,10 Feb 2018,"1,277",Teen And Up Audiences,No Archive Warnings Apply,Alternate Universe - Hollywood
The 100 (TV),Bellamy Blake/Clarke Griffin,Bellamy Blake/Clarke Griffin,"Sing to Me, Muse",F/M,Semi-Canon,No,19 Feb 2016,"1,276",General Audiences,No Archive Warnings Apply,"Alternate Universe - Fans & Fandom,Tumblr"
The 100 (TV),Bellamy Blake/Clarke Griffin,Bellamy Blake/Clarke Griffin,The Emotional Maturity of a Blueberry Scone,F/M,Semi-Canon,No,18 Jan 2016,"1,275",Teen And Up Audiences,No Archive Warnings Apply,"Alternate Universe - Modern Setting,Friends With Benefits"
The 100 (TV),Bellamy Blake/Clarke Griffin,Bellamy Blake/Clarke Griffin,If I Could Do It All Again (I Shouldn't Still Want This),F/M,Semi-Canon,No,28 Aug 2022,"1,274",Mature,No Archive Warnings Apply,"Alternate Universe - College/University,Exes,Angst,emt clarke,Alternate Universe - Modern Setting,Slow Burn,Friends to Lovers,Enemies to Friends to Lovers,sorta - Freeform,A whole lotta Murphy Clarke and Raven being buds,because it’s necessary,enemies to friends to lovers to enemies to friends to lovers to oh this is exhausting"
The 100 (TV),Bellamy Blake/Clarke Griffin,Bellamy Blake/Clarke Griffin,Almosts and Maybes,F/M,Semi-Canon,No,28 Sep 2019,"1,273",Explicit,No Archive Warnings Apply,"Alternate Universe - Modern Setting,Fluff,Smut,Angst,Pining,Friends to Lovers,Age Difference,Weddings,Slow Burn,well my version of a slow burn"
The 100 (TV),Bellamy Blake/Clarke Griffin,Bellamy Blake/Clarke Griffin,Sanctuary,F/M,Semi-Canon,No,13 May 2020,"1,271",Explicit,"Graphic Depictions Of Violence,Creator Chose Not To Use Archive Warnings","Alternate Universe - Modern Setting,Protective Bellamy,Torture,Dark,like hella dark,Kidnapping,Hurt/Comfort,Emotional Hurt/Comfort,slowburn Bellarke,triggering content,Post-Traumatic Stress Disorder - PTSD,Recovery,Explicit Sexual Content"
The 100 (TV),Bellamy Blake/Clarke Griffin,Bellamy Blake/Clarke Griffin,(A Love Song) Like the Way It's Meant to Be,F/M,Semi-Canon,No,03 Nov 2017,"1,269",Teen And Up Audiences,No Archive Warnings Apply,Alternate Universe - Modern Setting
The 100 (TV),Bellamy Blake/Clarke Griffin,Bellamy Blake/Clarke Griffin,One Criterion in Particular,F/M,Semi-Canon,No,15 Mar 2017,"1,269",Mature,Creator Chose Not To Use Archive Warnings,"Alternate Universe - Canon Divergence,Pregnancy,Shameless Smut"
The 100 (TV),Bellamy Blake/Clarke Griffin,Bellamy Blake/Clarke Griffin,I've Been Awake For So Long,F/M,Semi-Canon,No,26 Jan 2017,"1,268",Teen And Up Audiences,No Archive Warnings Apply,"Alternate Universe - Modern Setting,Supernatural Elements"
The 100 (TV),Bellamy Blake/Clarke Griffin,Bellamy Blake/Clarke Griffin,baggage claim,F/M,Semi-Canon,No,25 May 2015,"1,266",Mature,No Archive Warnings Apply,"Fluff,Alternate Universe - Modern Setting,Las Vegas,Accidental Marriage"
The 100 (TV),Bellamy Blake/Clarke Griffin,Bellamy Blake/Clarke Griffin,But That's Not Why I'm Here,F/M,Semi-Canon,No,17 Oct 2017,"1,317",Teen And Up Audiences,No Archive Warnings Apply,Alternate Universe - Modern Setting
The 100 (TV),Bellamy Blake/Clarke Griffin,Bellamy Blake/Clarke Griffin,Take Me Out to Dinner Like You Did Last Week,F/M,Semi-Canon,No,08 Feb 2017,"1,316",Teen And Up Audiences,No Archive Warnings Apply,"Alternate Universe - Modern Setting,Fake/Pretend Relationship"
The 100 (TV),Bellamy Blake/Clarke Griffin,Bellamy Blake/Clarke Griffin,we keep being us (and we do better),F/M,Semi-Canon,No,10 Jul 2020,"1,315",Explicit,No Archive Warnings Apply,"Alternate Universe - Canon Divergence,Canon Compliant,Canon-Typical Violence,Bellamy Blake is a History & Mythology Nerd,Slow Burn Bellamy Blake/Clarke Griffin,Artist Clarke Griffin,Bisexual Clarke Griffin,Madi is Bellamy Blake and Clarke Griffin's Child,Depictions of Triage Medicine,Dealing With Trauma,Reminiscing on old friends and old lovers,Not nearly as heavy as the actual show but still heavy in moments,Clarke and Bellamy raise Madi,diverges from the end of s4,Basically Bellamy gets left behind as well as Clarke,Slow Burn,like a glacial burn,Pining,so much pining,Clarke pov,Bellamy PoV,Smut but like...not super explicit,Ironic moments,Humor,Fluff,Angst"
The 100 (TV),Bellamy Blake/Clarke Griffin,Bellamy Blake/Clarke Griffin,The Whole World In His Hands,F/M,Semi-Canon,No,20 May 2016,"1,314",Mature,No Archive Warnings Apply,Alternate Universe - College/University
The 100 (TV),Bellamy Blake/Clarke Griffin,Bellamy Blake/Clarke Griffin,Lost Souls,F/M,Semi-Canon,No,21 Sep 2018,"1,312",Teen And Up Audiences,Creator Chose Not To Use Archive Warnings,"Alternate Universe - Modern Setting,Alternate Universe - Soulmates,Soulmate-Identifying Marks,Panic Attacks,Mental Health Issues,Bartender!Clarke,Teacher!Bellamy,Mutual Pining,POV Clarke,Friends to Lovers,Hurt/Comfort,And they were soulmates,oh my god they were soulmates,Slow Burn,Depression,Anxiety,all the things i should have talked about in therapy,instead of projecting my problems onto a fictional character again,but here we are and you guys are my therapist now"
The 100 (TV),Bellamy Blake/Clarke Griffin,Bellamy Blake/Clarke Griffin,just the beating of our hearts,F/M,Semi-Canon,No,03 Sep 2017,"1,312",General Audiences,Creator Chose Not To Use Archive Warnings,"Alternate Universe - Canon Divergence,POV Outsider,3+1 fic"
The 100 (TV),Bellamy Blake/Clarke Griffin,Bellamy Blake/Clarke Griffin,Safe Search,F/M,Semi-Canon,No,12 Feb 2016,"1,312",Mature,No Archive Warnings Apply,"Alternate Universe - Modern Setting,Alternate Universe - Neighbors"
The 100 (TV),Bellamy Blake/Clarke Griffin,Bellamy Blake/Clarke Griffin,Bless Your Beautiful Hide,F/M,Semi-Canon,No,07 Jan 2015,"1,310",General Audiences,No Archive Warnings Apply,"Arranged Marriage,Politics,Weddings,Foreign Language,Culture Shock"
The 100 (TV),Bellamy Blake/Clarke Griffin,Bellamy Blake/Clarke Griffin,The Art of Repainting,F/M,Semi-Canon,No,31 May 2018,"1,305",Mature,No Archive Warnings Apply,"Modern AU,Exes,Angst,Childhood Friends,Alternate Universe - Modern Setting,Hurt/Comfort,Bellarke"
The 100 (TV),Bellamy Blake/Clarke Griffin,Bellamy Blake/Clarke Griffin,The Daily Grind,F/M,Semi-Canon,No,26 Jul 2015,"1,303",General Audiences,No Archive Warnings Apply,"Alternate Universe - College/University,Alternate Universe - Coffee Shops & Cafés,Barista AU,Tumblr Prompt,Fluff,First Meetings,Barista Clarke"
The 100 (TV),Bellamy Blake/Clarke Griffin,Bellamy Blake/Clarke Griffin,You Bring the Groom,F/M,Semi-Canon,No,06 Nov 2016,"1,302",General Audiences,No Archive Warnings Apply,"Canon Compliant,Fluff"
The 100 (TV),Bellamy Blake/Clarke Griffin,Bellamy Blake/Clarke Griffin,The Provenance of Griffin-Blakes,F/M,Semi-Canon,No,05 Apr 2015,"1,301",Explicit,No Archive Warnings Apply,"Alternate Universe - Modern Setting,Cop!Raven,cop!bellamy,Explicit Sexual Content,First Meetings,Minor Raven Reyes/Kyle Wick,Minor Nathan Miller/Monty Green,artist!Clarke"
The 100 (TV),Bellamy Blake/Clarke Griffin,Bellamy Blake/Clarke Griffin,I'll always wear the crown that you gave me,F/M,Semi-Canon,No,15 Oct 2017,"1,300",General Audiences,No Archive Warnings Apply,"Alternate Universe - Childhood Friends,Alternate Universe - Modern Setting,Minor Wells Jaha/Raven Reyes,Minor Octavia Blake/Lincoln,Requited Unrequited Love"
The 100,Bellamy Blake/Clarke Griffin,Bellamy Blake/Clarke Griffin,i don’t even know if you exist and yet i crave you,F/M,Semi-Canon,No,13 Mar 2016,"1,300",Teen And Up Audiences,No Archive Warnings Apply,"Alternate Universe - Modern Setting,Alternate Universe - Soulmates,Soulmates,Soulmate-Identifying Marks,Fluff"
The 100 (TV),Bellamy Blake/Clarke Griffin,Bellamy Blake/Clarke Griffin,Game On,F/M,Semi-Canon,No,05 Apr 2015,"1,300",Explicit,Underage,"Alternate Universe - Modern Setting,Alternate Universe - After College/University,Fluff,Smut,PWP,Drinking Games,Drinking,Sports,Teasing,Sexual Tension,the usual with these two really"
The 100 (TV),Bellamy Blake/Clarke Griffin,Bellamy Blake/Clarke Griffin,Tit For Tat,F/M,Semi-Canon,No,17 Dec 2015,"1,299",Explicit,No Archive Warnings Apply,"Alternate Universe - Modern Setting,Friends With Benefits,Fake/Pretend Relationship,Holidays"
The 100 (TV),Bellamy Blake/Clarke Griffin,Bellamy Blake/Clarke Griffin,Oh How Happy We'll Be,F/M,Semi-Canon,No,14 Jul 2016,"1,298",Teen And Up Audiences,No Archive Warnings Apply,"Alternate Universe - College/University,Alternate Universe - Modern Setting"
The 100 (TV),Bellamy Blake/Clarke Griffin,Bellamy Blake/Clarke Griffin,A Tunnel From My Window to Yours,F/M,Semi-Canon,No,07 Oct 2016,"1,297",Teen And Up Audiences,No Archive Warnings Apply,"Alternate Universe - Modern Setting,Social Media,Long-Distance Relationship"
The 100 (TV),Bellamy Blake/Clarke Griffin,Bellamy Blake/Clarke Griffin,I'm Sure of All the Things We Got,F/M,Semi-Canon,No,15 Mar 2017,"1,296",Teen And Up Audiences,No Archive Warnings Apply,"Alternate Universe - Modern Setting,Kid Fic"
The 100 (TV),Bellamy Blake/Clarke Griffin,Bellamy Blake/Clarke Griffin,"You and Me Both, Kid",F/M,Semi-Canon,No,27 Sep 2015,"1,295",Teen And Up Audiences,No Archive Warnings Apply,Alternate Universe - College/University
The 100 (TV),Bellamy Blake/Clarke Griffin,Bellamy Blake/Clarke Griffin,Would You Freak Out If I Said I Liked You?,F/M,Semi-Canon,No,17 Sep 2016,"1,338",Teen And Up Audiences,No Archive Warnings Apply,Alternate Universe - Modern Setting
The 100 (TV),Bellamy Blake/Clarke Griffin,Bellamy Blake/Clarke Griffin,like ships in the night (passing me by),F/M,Semi-Canon,No,31 Jul 2014,"1,338",Teen And Up Audiences,Major Character Death,"Bellamy is immortal,Clarke isn't,Alternate Universe - Historical,Alternate Universe - Modern Setting,Alternate Universe - Science Fiction,NO IT HAS A HAPPY ENDING I SWEAR"
The 100 (TV),Monty Green/Nathan Miller,Bellamy Blake/Clarke Griffin,WWCD?,F/M,Semi-Canon,No,13 May 2015,"1,337",Teen And Up Audiences,No Archive Warnings Apply,Alternate Universe - College/University
The 100 (TV),Bellamy Blake/Clarke Griffin,Bellamy Blake/Clarke Griffin,A Torment to Himself,F/M,Semi-Canon,No,01 Jan 2015,"1,335",General Audiences,No Archive Warnings Apply,
The 100 (TV),Bellamy Blake/Clarke Griffin,Bellamy Blake/Clarke Griffin,The Day Is Beautiful and So Are You,F/M,Semi-Canon,No,06 May 2018,"1,333",Teen And Up Audiences,No Archive Warnings Apply,"Alternate Universe - Modern Setting,Minor Octavia Blake/Niylah"
The 100 (TV),Bellamy Blake/Clarke Griffin,Bellamy Blake/Clarke Griffin,Tell Her the Honest Truth,F/M,Semi-Canon,No,05 Jan 2022,"1,328",Teen And Up Audiences,No Archive Warnings Apply,Alternate Universe - Modern Setting
The 100 (TV),Bellamy Blake/Clarke Griffin,Bellamy Blake/Clarke Griffin,squint at where you're from,F/M,Semi-Canon,No,25 May 2017,"1,328",General Audiences,No Archive Warnings Apply,"Canon Compliant,Season/Series 04 Spoilers"
The 100 (TV),Bellamy Blake/Clarke Griffin,Bellamy Blake/Clarke Griffin,you be the match (i'll be a fuse),F/M,Semi-Canon,No,15 Dec 2015,"1,328",Explicit,Creator Chose Not To Use Archive Warnings,"Alternate Universe - Modern Setting,Alpha/Beta/Omega Dynamics,Alpha Bellamy Blake,Omega Clarke Griffin,Bisexual Clarke Griffin,Mating Cycles/In Heat,Knotting,Porn With Plot,Mutual Pining"
The 100 (TV),Bellamy Blake/Clarke Griffin,Bellamy Blake/Clarke Griffin,Rum & Promises,F/M,Semi-Canon,No,06 Aug 2014,"1,327",Explicit,Creator Chose Not To Use Archive Warnings,"Bartender Clarke AU,Prompt Fill,Read at Your Own Risk,Smut,the title is so bad i'm so sorry,literally a third of this is smut"
The 100 (TV),Bellamy Blake/Clarke Griffin,Bellamy Blake/Clarke Griffin,How To Cover Up A Hickey,F/M,Semi-Canon,No,13 May 2018,"1,326",Teen And Up Audiences,No Archive Warnings Apply,"Alternate Universe - Modern Setting,Roommates,Alternate Universe - Roommates/Housemates,Friends to Lovers,YouTuber Clarke Griffin"
The 100 (TV),Bellamy Blake/Clarke Griffin,Bellamy Blake/Clarke Griffin,Distraction,F/M,Semi-Canon,No,01 Oct 2015,"1,326",Explicit,Creator Chose Not To Use Archive Warnings,"Sexual Tension,Desire,Emotional Constipation,Denial,Seduction,Angst,Masturbation,Sexual Fantasy,Cunnilingus,Suggestions of S&D,Dry Humping,Abandoned Work - Unfinished and Discontinued"
The 100 (TV),Bellamy Blake/Clarke Griffin,Bellamy Blake/Clarke Griffin,There Goes Your Social Life,F/M,Semi-Canon,No,30 Jan 2016,"1,325",Teen And Up Audiences,No Archive Warnings Apply,Alternate Universe - Modern Setting
The 100 (TV),Bellamy Blake/Clarke Griffin,Bellamy Blake/Clarke Griffin,"Two Voices, Now They Are Singing",F/M,Semi-Canon,No,26 Jul 2017,"1,324",Teen And Up Audiences,No Archive Warnings Apply,"Alternate Universe - Historical,Unplanned Pregnancy,Marriage of Convenience"
